,Time,Score,Event.Description,Hometeam,Awayteam,Timeout_Hometeam,Timeout_Awayteam,SeventhPlayer_Hometeam,SeventhPlayer_Awayteam,SixthPlayer_Hometeam,SixthPlayer_Awayteam,Penalty_Awayteam,Penalty_Hometeam
1,59:59:00,,"Manuel Zehnder (RM/fern) wirft, jedoch neben das Tor.",GWD Minden,HC Erlangen,0,0,0,0,0,0,0,0
2,59:05:00,25:32:00,Tor! Florian Kranzmann (GWD Minden) netzt ein zum neuen Spielstand von 25:32.,GWD Minden,HC Erlangen,0,0,0,0,0,0,0,0
3,58:59:00,,Yannik Bialowas von HC Erlangen unterläuft ein technischer Fehler. Der Ballbesitz wechselt.,GWD Minden,HC Erlangen,0,0,0,0,0,0,0,0
4,58:35:00,,Zeitstrafe vorbei HC Erlangen,GWD Minden,HC Erlangen,0,0,0,0,0,1,0,0
5,58:30:00,24:32:00,"Neuer Spielstand in Minden, 24:32 durch den Treffer von Max Staar für GWD Minden.",GWD Minden,HC Erlangen,0,0,0,0,0,1,0,0
6,58:16:00,,"Gute Torchance, aber Lutz Heiny (HC Erlangen) kann diese nicht erfolgreich verwandeln.",GWD Minden,HC Erlangen,0,0,0,0,0,1,0,0
7,57:52:00,,Überragende Parade des Torwarts Yahav Shamir (GWD Minden)! Johannes Sellin kann den Ball nicht im...,GWD Minden,HC Erlangen,0,0,0,0,0,1,0,0
8,57:37:00,,Siebter Spieler eingewechselt HC Erlangen,GWD Minden,HC Erlangen,0,0,0,1,0,1,0,0
9,57:19:00,23:32,"Neuer Spielstand in Minden, 23:32 durch den Treffer 6M von Jonah Jungmann für GWD Minden.",GWD Minden,HC Erlangen,0,0,0,0,0,1,0,0
10,57:08:00,22:32,Tor! Johannes Sellin (HC Erlangen) netzt ein zum neuen Spielstand von 22:32.,GWD Minden,HC Erlangen,0,0,0,0,0,1,0,0
11,56:43:00,,Siebter Spieler eingewechselt HC Erlangen,GWD Minden,HC Erlangen,0,0,0,1,0,1,0,0
12,56:39:00,22:31,Der 7-Meter wurde von Florian Kranzmann (GWD Minden) erfolgreich verwandelt.,GWD Minden,HC Erlangen,0,0,0,0,0,1,0,0
13,56:32:00,,Justin Kurch (HC Erlangen) erhält eine 2 Minuten Strafe.,GWD Minden,HC Erlangen,0,0,0,0,0,1,1,0
14,56:07:00,,Torwartwechsel bei HC Erlangen. Bertram Obling kommt für Klemen Ferlin.,GWD Minden,HC Erlangen,0,0,0,0,0,0,0,0
15,56:06:00,21:31,Christoph Steinert (HC Erlangen) trifft von der 7-Meter Linie.,GWD Minden,HC Erlangen,0,0,0,0,0,0,0,0
16,55:55:00,,"Der Torwart von GWD Minden, Yahav Shamir hält den Wurf von Yannik Bialowas.",GWD Minden,HC Erlangen,0,0,0,0,0,0,0,0
17,54:59:00,21:30,Tor (6M)! Florian Kranzmann (GWD Minden) netzt ein zum neuen Spielstand von 21:30.,GWD Minden,HC Erlangen,0,0,0,0,0,0,0,0
18,54:58:00,,Klemen Ferlin (HC Erlangen) hält den Wurf von Niclas Pieczkowski.,GWD Minden,HC Erlangen,0,0,0,0,0,0,0,0
19,54:14:00,,Manuel Zehnder von HC Erlangen unterläuft ein technischer Fehler. Der Ballbesitz wechselt.,GWD Minden,HC Erlangen,0,0,0,0,0,0,0,0
20,53:43:00,,Tomas Urban von GWD Minden unterläuft ein technischer Fehler. Der Ballbesitz wechselt.,GWD Minden,HC Erlangen,0,0,0,0,0,0,0,0
21,53:36:00,20:30,Johannes Sellin (HC Erlangen) überwindet den Torwart zum neuen Spielstand von 20:30.,GWD Minden,HC Erlangen,0,0,0,0,0,0,0,0
22,53:07:00,,Zeitstrafe vorbei HC Erlangen,GWD Minden,HC Erlangen,0,0,0,0,0,1,0,0
23,52:44:00,,Siebter Spieler eingewechselt HC Erlangen,GWD Minden,HC Erlangen,0,0,0,1,0,1,0,0
24,52:31:00,20:29,"Neuer Spielstand in Minden, 20:29 durch den Treffer von Jonah Jungmann für GWD Minden.",GWD Minden,HC Erlangen,0,0,0,0,0,1,0,0
25,52:13:00,19:29,Christopher Bissel (HC Erlangen) trifft zum Spielstand von 19:29 in Kampa-Halle.,GWD Minden,HC Erlangen,0,0,0,0,0,1,0,0
26,51:38:00,19:28,"Neuer Spielstand in Minden, 19:28 durch den Treffer 6M von Sebastian Firnhaber für HC Erlangen.",GWD Minden,HC Erlangen,0,0,0,0,0,1,0,0
27,51:14:00,,Siebter Spieler eingewechselt HC Erlangen,GWD Minden,HC Erlangen,0,0,0,1,0,1,0,0
28,51:04:00,,"Parade des Torwarts von HC Erlangen, Klemen Ferlin.",GWD Minden,HC Erlangen,0,0,0,0,0,1,0,0
29,50:51:00,,2-Minuten-Strafe für Nikolai Link. HC Erlangen muss nun die nächsten zwei Minuten mit einem Spieler weniger auskommen.,GWD Minden,HC Erlangen,0,0,0,0,0,1,1,0
30,50:27:00,,Yahav Shamir (GWD Minden) wurde soeben eingewechselt und soll nun die Abwehr stabilisieren.,GWD Minden,HC Erlangen,0,0,0,0,0,0,0,0
31,50:15:00,19:27,Johannes Sellin (HC Erlangen) trifft von (RA). Neuer Spielstand in Kampa-Halle: 19:27.,GWD Minden,HC Erlangen,0,0,0,0,0,0,0,0
32,49:28:00,,Zeitstrafe vorbei GWD Minden,GWD Minden,HC Erlangen,0,0,0,0,1,0,0,0
33,49:23:00,,"Der Torwart von HC Erlangen, Klemen Ferlin pariert den Wurf.",GWD Minden,HC Erlangen,0,0,0,0,1,0,0,0
34,49:11:00,,Sebastian Firnhaber blockt den Wurf von Luka Sebetic.,GWD Minden,HC Erlangen,0,0,0,0,1,0,0,0
35,48:07:00,19:26,Steffen Fäth (HC Erlangen) überwindet den Torwart von (RM/fern) zum neuen Spielstand von 19:26.,GWD Minden,HC Erlangen,0,0,0,0,1,0,0,0
36,47:49:00,,Siebter Spieler eingewechselt GWD Minden,GWD Minden,HC Erlangen,0,0,1,0,1,0,0,0
37,47:47:00,,Zeitstrafe vorbei GWD Minden,GWD Minden,HC Erlangen,0,0,0,0,1,0,0,0
38,47:26:00,,Carles Asensio Cambra (GWD Minden) erhält wegen eines Regelverstoßes eine 2 Minuten Strafe.,GWD Minden,HC Erlangen,0,0,0,0,1,0,0,1
39,47:25:00,19:25,Christopher Bissel (HC Erlangen) überwindet den Torwart zum neuen Spielstand von 19:25.,GWD Minden,HC Erlangen,0,0,0,0,1,0,0,0
40,47:03:00,19:24,"Neuer Spielstand in Minden, 19:24 durch den Treffer von Luka Sebetic für GWD Minden.",GWD Minden,HC Erlangen,0,0,0,0,1,0,0,0
41,46:34:00,,Siebter Spieler eingewechselt GWD Minden,GWD Minden,HC Erlangen,0,0,1,0,1,0,0,0
42,46:21:00,18:24,Christoph Steinert (HC Erlangen) trifft von der 7-Meter Linie und bringt den Spielstand auf 18:24.,GWD Minden,HC Erlangen,0,0,0,0,1,0,0,0
43,45:43:00,,Klemen Ferlin (HC Erlangen) hält den Wurf von Tomas Urban.,GWD Minden,HC Erlangen,0,0,0,0,1,0,0,0
44,45:42:00,,Tomas Urban (GWD Minden) erhält eine Zeitstrafe und hat nun zwei Minuten Zeit sich auf der Bank zu beruhigen.,GWD Minden,HC Erlangen,0,0,0,0,1,0,0,1
45,45:23:00,,HC Erlangen wechselt den Torwart. Klemen Ferlin kommt für Bertram Obling.,GWD Minden,HC Erlangen,0,0,0,0,0,0,0,0
46,45:08:00,18:23,Mats Korte (GWD Minden) trifft von der 7-Meter Linie.,GWD Minden,HC Erlangen,0,0,0,0,0,0,0,0
47,45:04:00,,Der eingewechselte Torwart Bertram Obling (HC Erlangen) steht nun zwischen den Pfosten.,GWD Minden,HC Erlangen,0,0,0,0,0,0,0,0
48,45:03:00,,Frank Carstens von GWD Minden wurde mit der Gelben Karte von Koppl/Regner verwarnt.,GWD Minden,HC Erlangen,0,0,0,0,0,0,0,0
49,44:10:00,,Der Wurfversuch von Niclas Pieczkowski (GWD Minden) wurde durch einen Block von Tim Zechel verhindert.,GWD Minden,HC Erlangen,0,0,0,0,0,0,0,0
50,43:37:00,17:23,Christopher Bissel (HC Erlangen) überwindet den Torwart von (LA) zum neuen Spielstand von 17:23.,GWD Minden,HC Erlangen,0,0,0,0,0,0,0,0
51,43:17:00,17:22,Tor! Niclas Pieczkowski (GWD Minden) netzt ein zum neuen Spielstand von 17:22.,GWD Minden,HC Erlangen,0,0,0,0,0,0,0,0
52,42:52:00,,Auszeit GWD Minden,GWD Minden,HC Erlangen,1,0,0,0,0,0,0,0
53,42:46:00,16:22,Tim Zechel (HC Erlangen) trifft zum Spielstand von 16:22 in Kampa-Halle.,GWD Minden,HC Erlangen,0,0,0,0,0,0,0,0
54,42:38:00,,Tomas Urban von GWD Minden unterläuft ein technischer Fehler. Der Ballbesitz wechselt.,GWD Minden,HC Erlangen,0,0,0,0,0,0,0,0
55,42:19:00,,Klemen Ferlin (HC Erlangen) mit einer Parade.,GWD Minden,HC Erlangen,0,0,0,0,0,0,0,0
56,41:36:00,,Zeitstrafe vorbei GWD Minden,GWD Minden,HC Erlangen,0,0,0,0,1,0,0,0
57,41:29:00,16:21,"Neuer Spielstand in Minden, 16:21 durch den Treffer 6M von Antonio Metzner für HC Erlangen.",GWD Minden,HC Erlangen,0,0,0,0,1,0,0,0
58,41:27:00,,Steffen Fäth (HC Erlangen) scheitert am Torwart Malte Semisch (GWD Minden).,GWD Minden,HC Erlangen,0,0,0,0,1,0,0,0
59,40:54:00,,"Der Torwart von HC Erlangen, Klemen Ferlin hält den Wurf von Niclas Pieczkowski.",GWD Minden,HC Erlangen,0,0,0,0,1,0,0,0
60,40:37:00,,Siebter Spieler eingewechselt GWD Minden,GWD Minden,HC Erlangen,0,0,1,0,1,0,0,0
61,40:31:00,16:20,Sebastian Firnhaber (HC Erlangen) trifft von (6M). Neuer Spielstand in Kampa-Halle: 16:20.,GWD Minden,HC Erlangen,0,0,0,0,1,0,0,0
62,39:44:00,,Siebter Spieler eingewechselt GWD Minden,GWD Minden,HC Erlangen,0,0,1,0,1,0,0,0
63,39:34:00,,"Nach einem harten Foul hat Maximilian Janke (GWD Minden) nun zwei Minuten Zeit, um sich auszuruhen.",GWD Minden,HC Erlangen,0,0,0,0,1,0,0,1
64,39:34:00,,Der Wurf von Antonio Metzner (HC Erlangen) landet hinter dem Tor.,GWD Minden,HC Erlangen,0,0,0,0,0,0,0,0
65,37:31:00,,Überragende Parade des Torwarts Klemen Ferlin (HC Erlangen)! Jonah Jungmann kann den Ball nicht im Tor unterbringen!,GWD Minden,HC Erlangen,0,0,0,0,0,0,0,0
66,36:53:00,16:19,Tor (6M)! Johannes Sellin (HC Erlangen) netzt ein zum neuen Spielstand von 16:19.,GWD Minden,HC Erlangen,0,0,0,0,0,0,0,0
67,35:49:00,16:18,"Neuer Spielstand in Minden, 16:18 durch den Treffer von Johannes Sellin für HC Erlangen.",GWD Minden,HC Erlangen,0,0,0,0,0,0,0,0
68,34:37:00,16:17,Antonio Metzner (HC Erlangen) trifft von (6M). Neuer Spielstand in Kampa-Halle: 16:17.,GWD Minden,HC Erlangen,0,0,0,0,0,0,0,0
69,34:19:00,16:16,Tor! Niclas Pieczkowski (GWD Minden) netzt ein zum neuen Spielstand von 16:16.,GWD Minden,HC Erlangen,0,0,0,0,0,0,0,0
70,33:47:00,15:16,Christoph Steinert (HC Erlangen) trifft von der 7-Meter Linie und bringt den Spielstand auf 15:16.,GWD Minden,HC Erlangen,0,0,0,0,0,0,0,0
71,33:25:00,,Parade von Torwart Malte Semisch (GWD Minden).,GWD Minden,HC Erlangen,0,0,0,0,0,0,0,0
72,32:52:00,15:15,Tomas Urban (GWD Minden) überwindet den Torwart zum neuen Spielstand von 15:15.,GWD Minden,HC Erlangen,0,0,0,0,0,0,0,0
73,32:47:00,,"Wurf von Steffen Fäth (HC Erlangen), aber der Ball landet nur am Pfosten.",GWD Minden,HC Erlangen,0,0,0,0,0,0,0,0
74,32:37:00,,Jonah Jungmann von GWD Minden unterläuft ein technischer Fehler. Der Ballbesitz wechselt.,GWD Minden,HC Erlangen,0,0,0,0,0,0,0,0
75,31:57:00,,Zeitstrafe vorbei GWD Minden,GWD Minden,HC Erlangen,0,0,0,0,1,0,0,0
76,31:44:00,14:15,"Neuer Spielstand in Minden, 14:15 durch den Treffer 6M von Christopher Bissel für HC Erlangen.",GWD Minden,HC Erlangen,0,0,0,0,1,0,0,0
77,31:00:00,,Siebter Spieler eingewechselt GWD Minden,GWD Minden,HC Erlangen,0,0,1,0,1,0,0,0
78,30:51:00,14:14,Christopher Bissel (HC Erlangen) überwindet den Torwart von (LA) zum neuen Spielstand von 14:14.,GWD Minden,HC Erlangen,0,0,0,0,1,0,0,0
79,30:24:00,14:13,Max Staar (GWD Minden) trifft zum Spielstand von 14:13 in Kampa-Halle.,GWD Minden,HC Erlangen,0,0,0,0,1,0,0,0
80,Halbz,13:13,,GWD Minden,HC Erlangen,0,0,0,0,1,0,0,0
81,29:59:00,13:13,"Neuer Spielstand in Minden, 13:13 durch den Treffer von Tim Zechel für HC Erlangen.",GWD Minden,HC Erlangen,0,0,0,0,1,0,0,0
82,29:39:00,,Maximilian Janke geht den Gegner zu stark an. GWD Minden muss nun die nächsten zwei Minuten mit einem Spieler weniger auskommen.,GWD Minden,HC Erlangen,0,0,0,0,1,0,0,1
83,29:13:00,13:12,"Tor von der 7-Meter Linie von Mats Korte (GWD Minden), neuer Spielstand 13:12.",GWD Minden,HC Erlangen,0,0,0,0,0,0,0,0
84,28:02:00,12:12,"Neuer Spielstand in Minden, 12:12 durch den Treffer RM/fern von Steffen Fäth für HC Erlangen.",GWD Minden,HC Erlangen,0,0,0,0,0,0,0,0
85,27:35:00,12:11,Mats Korte (GWD Minden) trifft zum Spielstand von 12:11 in Kampa-Halle.,GWD Minden,HC Erlangen,0,0,0,0,0,0,0,0
86,27:10:00,,"Parade des Torwarts von HC Erlangen, Klemen Ferlin.",GWD Minden,HC Erlangen,0,0,0,0,0,0,0,0
87,26:23:00,,Malte Semisch (GWD Minden) mit einer Parade.,GWD Minden,HC Erlangen,0,0,0,0,0,0,0,0
88,25:56:00,12:11,Klemen Ferlin (HC Erlangen) hält den Wurf von Carles Asensio Cambra.,GWD Minden,HC Erlangen,0,0,0,0,0,0,0,0
89,25:43:00,,Johannes Sellin (HC Erlangen) scheitert am Torwart Malte Semisch (GWD Minden).,GWD Minden,HC Erlangen,0,0,0,0,0,0,0,0
90,24:36:00,11:11,Magnus Holpert (GWD Minden) trifft von (6M). Neuer Spielstand in Kampa-Halle: 11:11.,GWD Minden,HC Erlangen,0,0,0,0,0,0,0,0
91,23:56,10:11,Tor (6M)! Sebastian Firnhaber (HC Erlangen) netzt ein zum neuen Spielstand von 10:11.,GWD Minden,HC Erlangen,0,0,0,0,0,0,0,0
92,23:50,10:10,Magnus Holpert (GWD Minden) überwindet den Torwart zum neuen Spielstand von 10:10.,GWD Minden,HC Erlangen,0,0,0,0,0,0,0,0
93,22:49,9:10,Steffen Fäth (HC Erlangen) trifft im Tempogegenstoß zum neuen Spielstand von 9:10.,GWD Minden,HC Erlangen,0,0,0,0,0,0,0,0
94,22:43,,Der Wurfversuch von Luka Sebetic (GWD Minden) wurde durch einen Block von Sebastian Firnhaber verhindert.,GWD Minden,HC Erlangen,0,0,0,0,0,0,0,0
95,22:07,9:09,Christopher Bissel (HC Erlangen) überwindet den Torwart von (6M) zum neuen Spielstand von 9:9.,GWD Minden,HC Erlangen,0,0,0,0,0,0,0,0
96,21:16,9:08,Christopher Bissel (HC Erlangen) überwindet den Torwart von (LA) zum neuen Spielstand von 9:8.,GWD Minden,HC Erlangen,0,0,0,0,0,0,0,0
97,20:45,,"Gute Torchance, aber Magnus Holpert (GWD Minden) kann diese nicht erfolgreich verwandeln.",GWD Minden,HC Erlangen,0,0,0,0,0,0,0,0
98,20:26,,Zeitstrafe vorbei HC Erlangen.,GWD Minden,HC Erlangen,0,0,0,0,0,1,0,0
99,20:00,,Christoph Steinert von HC Erlangen unterläuft ein technischer Fehler. Der Ballbesitz wechselt.,GWD Minden,HC Erlangen,0,0,0,0,0,1,0,0
100,19:02,,Siebter Spieler eingewechselt HC Erlangen.,GWD Minden,HC Erlangen,0,0,0,1,0,1,0,0
101,18:49,9:07,Jonah Jungmann (GWD Minden) trifft von (6M). Neuer Spielstand in Kampa-Halle: 9:7.,GWD Minden,HC Erlangen,0,0,0,0,0,1,0,0
102,18:19,,Der Schiedsrichter zeigt Nico Büdel (HC Erlangen) die Rote Karte.,GWD Minden,HC Erlangen,0,0,0,0,0,1,1,0
103,18:19,,Carles Asensio Cambra blockt den Wurf von Nikolai Link.,GWD Minden,HC Erlangen,0,0,0,0,0,0,0,0
104,17:32,8:07,Tor! Christoph Steinert (HC Erlangen) netzt ein zum neuen Spielstand von 8:7.,GWD Minden,HC Erlangen,0,0,0,0,0,0,0,0
105,17:20,8:06,"Neuer Spielstand in Minden, 8:6 durch den Treffer 6M von Justus Nicolas Richtzenhain für GWD Minden.",GWD Minden,HC Erlangen,0,0,0,0,0,0,0,0
106,17:01,,Klemen Ferlin (HC Erlangen) mit einer Parade.,GWD Minden,HC Erlangen,0,0,0,0,0,0,0,0
107,16:41,,Koppl/Regner verwarnen Christoph Steinert (HC Erlangen) mit einer Gelben Karte.,GWD Minden,HC Erlangen,0,0,0,0,0,0,0,0
108,15:48,7:06,Hampus Olsson (HC Erlangen) überwindet den Torwart zum neuen Spielstand von 7:6.,GWD Minden,HC Erlangen,0,0,0,0,0,0,0,0
109,15:15,7:05,"Neuer Spielstand in Minden, 7:5 durch den Treffer von Niclas Pieczkowski für GWD Minden.",GWD Minden,HC Erlangen,0,0,0,0,0,0,0,0
110,14:43,6:05,Tor (LA)! Christopher Bissel (HC Erlangen) netzt ein zum neuen Spielstand von 6:5.,GWD Minden,HC Erlangen,0,0,0,0,0,0,0,0
111,14:32,6:04,Niclas Pieczkowski (GWD Minden) trifft zum Spielstand von 6:4 in Kampa-Halle.,GWD Minden,HC Erlangen,0,0,0,0,0,0,0,0
112,13:40,5:04,Christopher Bissel (HC Erlangen) überwindet den Torwart von (LA) zum neuen Spielstand von 5:4.,GWD Minden,HC Erlangen,0,0,0,0,0,0,0,0
113,13:26,5:03,"Neuer Spielstand in Minden, 5:3 durch den Treffer 6M von Tomas Urban für GWD Minden.",GWD Minden,HC Erlangen,0,0,0,0,0,0,0,0
114,12:46,,Klemen Ferlin (HC Erlangen) mit einer Parade.,GWD Minden,HC Erlangen,0,0,0,0,0,0,0,0
115,12:33,,"Parade des Torwarts von GWD Minden, Malte Semisch.",GWD Minden,HC Erlangen,0,0,0,0,0,0,0,0
116,11:25,,Auszeit GWD Minden,GWD Minden,HC Erlangen,1,0,0,0,0,0,0,0
117,11:16,,Der Wurf von GWD Minden wurde geblockt.,GWD Minden,HC Erlangen,0,0,0,0,0,0,0,0
118,10:30,,Antonio Metzner von HC Erlangen unterläuft ein technischer Fehler. Der Ballbesitz wechselt.,GWD Minden,HC Erlangen,0,0,0,0,0,0,0,0
119,9:34,,Niclas Pieczkowski (GWD Minden) bekommt die Gelbe Karte von Koppl/Regner gezeigt.,GWD Minden,HC Erlangen,0,0,0,0,0,0,0,0
120,9:21,,Überragende Parade des Torwarts Klemen Ferlin (HC Erlangen)! Tomas Urban kann den Ball nicht im Tor unterbringen!,GWD Minden,HC Erlangen,0,0,0,0,0,0,0,0
121,8:43,4:03,Nico Büdel (HC Erlangen) trifft von (6M). Neuer Spielstand in Kampa-Halle: 4:3.,GWD Minden,HC Erlangen,0,0,0,0,0,0,0,0
122,8:00,,Fehlwurf von Carles Asensio Cambra (GWD Minden).,GWD Minden,HC Erlangen,0,0,0,0,0,0,0,0
123,7:34,4:02,Hampus Olsson (HC Erlangen) überwindet den Torwart zum neuen Spielstand von 4:2.,GWD Minden,HC Erlangen,0,0,0,0,0,0,0,0
124,7:26,,"Block von Antonio Metzner, der den Torwurf von Magnus Holpert verhindert.",GWD Minden,HC Erlangen,0,0,0,0,0,0,0,0
125,7:12,,Zeitstrafe vorbei GWD Minden,GWD Minden,HC Erlangen,0,0,0,0,1,0,0,0
126,6:35,,Siebter Spieler eingewechselt GWD Minden,GWD Minden,HC Erlangen,0,0,1,0,1,0,0,0
127,6:26,4:01,Der 7-Meter wurde von Christoph Steinert (HC Erlangen) erfolgreich verwandelt.,GWD Minden,HC Erlangen,0,0,0,0,1,0,0,0
128,5:39,,Auszeit HC Erlangen,GWD Minden,HC Erlangen,0,1,0,0,1,0,0,0
129,5:37,4:00,Tor (RM/fern)! Niclas Pieczkowski (GWD Minden) netzt ein zum neuen Spielstand von 4:0.,GWD Minden,HC Erlangen,0,0,0,0,1,0,0,0
130,5:35,,Nico Büdel von HC Erlangen unterläuft ein technischer Fehler. Der Ballbesitz wechselt.,GWD Minden,HC Erlangen,0,0,0,0,1,0,0,0
131,5:10,,Es gibt eine 2 Minuten Strafe für Justus Nicolas Richtzenhain (GWD Minden).,GWD Minden,HC Erlangen,0,0,0,0,1,0,0,1
132,4:38,,"Der Torwart von HC Erlangen, Klemen Ferlin pariert den Wurf.",GWD Minden,HC Erlangen,0,0,0,0,0,0,0,0
133,3:44,3:00,"Neuer Spielstand in Minden, 3:0 durch den Treffer von Tomas Urban für GWD Minden.",GWD Minden,HC Erlangen,0,0,0,0,0,0,0,0
134,3:34,,"Manuel Zehnder (RM/fern) wirft, jedoch neben das Tor.",GWD Minden,HC Erlangen,0,0,0,0,0,0,0,0
135,2:57,2:00,Tor! Justus Nicolas Richtzenhain (GWD Minden) netzt ein zum neuen Spielstand von 2:0.,GWD Minden,HC Erlangen,0,0,0,0,0,0,0,0
136,2:54,,"Der Torwart von HC Erlangen, Klemen Ferlin hält den Wurf von Tomas Urban.",GWD Minden,HC Erlangen,0,0,0,0,0,0,0,0
137,1:42,1:00,Niclas Pieczkowski (GWD Minden) trifft zum Spielstand von 1:0 in Kampa-Halle.,GWD Minden,HC Erlangen,0,0,0,0,0,0,0,0
138,1:12,,Parade von Torwart Malte Semisch (GWD Minden).,GWD Minden,HC Erlangen,0,0,0,0,0,0,0,0
139,0:47,,Es gibt Gelb für Sebastian Firnhaber (HC Erlangen) von Koppl/Regner.,GWD Minden,HC Erlangen,0,0,0,0,0,0,0,0
140,,,,,,0,0,0,0,0,0,0,0