,Time,Score,Event.Description,hometeam,awayteam,Timeout_Hometeam,Timeout_Awayteam,SeventhPlayer_Hometeam,SeventhPlayer_Awayteam,SixthPlayer_Hometeam,SixthPlayer_Awayteam,Penalty_Awayteam,Penalty_Hometeam
1,59:58:00,,"August Baskar Pedersen wirft auf das Tor, trifft aber nur den Pfosten.",Hannover-Burgdorf,SG Flensburg-Handewitt,0,0,0,0,0,0,0,0
2,59:52:00,,Überragende Parade des Torwarts Kevin Møller (SG Flensburg-Handewitt)! Uladzislau Kulesh kann den Ball nicht im Tor unterbringen!,Hannover-Burgdorf,SG Flensburg-Handewitt,0,0,0,0,0,0,0,0
3,59:11:00,25:35:00,Tor! Lasse Kjær Møller (SG Flensburg-Handewitt) netzt ein zum neuen Spielstand von 25:35.,Hannover-Burgdorf,SG Flensburg-Handewitt,0,0,0,0,0,0,0,0
4,58:39:00,,"Der Torwart von SG Flensburg-Handewitt, Kevin Møller hält den Wurf von Ilija Brozovic.",Hannover-Burgdorf,SG Flensburg-Handewitt,0,0,0,0,0,0,0,0
5,57:49:00,25:34:00,Teitur Örn Einarsson (SG Flensburg-Handewitt) trifft zum Spielstand von 25:34 in ZAG Arena.,Hannover-Burgdorf,SG Flensburg-Handewitt,0,0,0,0,0,0,0,0
6,57:18:00,25:33:00,Renars Uscins (Hannover-Burgdorf) trifft von (6M). Neuer Spielstand in ZAG Arena: 25:33.,Hannover-Burgdorf,SG Flensburg-Handewitt,0,0,0,0,0,0,0,0
7,57:02:00,,"Wurf von Uladzislau Kulesh (Hannover-Burgdorf), aber der Ball landet nur am Pfosten.",Hannover-Burgdorf,SG Flensburg-Handewitt,0,0,0,0,0,0,0,0
8,56:50:00,,Zeitstrafe vorbei Hannover-Burgdorf,Hannover-Burgdorf,SG Flensburg-Handewitt,0,0,0,0,1,0,0,0
9,56:27:00,,Siebter Spieler eingewechselt Hannover-Burgdorf,Hannover-Burgdorf,SG Flensburg-Handewitt,0,0,1,0,1,0,0,0
10,56:25:00,24:33:00,"Neuer Spielstand in Hannover, 24:33 durch den Treffer von Lasse Kjær Møller für SG Flensburg-Handewitt.",Hannover-Burgdorf,SG Flensburg-Handewitt,0,0,0,0,1,0,0,0
11,55:52:00,,Uladzislau Kulesh von Hannover-Burgdorf unterläuft ein technischer Fehler. Der Ballbesitz wechselt.,Hannover-Burgdorf,SG Flensburg-Handewitt,0,0,0,0,1,0,0,0
12,55:47:00,,Überragende Parade des Torwarts Kevin Møller (SG Flensburg-Handewitt)! Uladzislau Kulesh kann den Ball nicht im Tor unterbringen!,Hannover-Burgdorf,SG Flensburg-Handewitt,0,0,0,0,1,0,0,0
13,55:14:00,,Auszeit Hannover-Burgdorf,Hannover-Burgdorf,SG Flensburg-Handewitt,1,0,0,0,1,0,0,0
14,54:47:00,,Ilija Brozovic (Hannover-Burgdorf) erhält eine 2 Minuten Strafe.,Hannover-Burgdorf,SG Flensburg-Handewitt,0,0,0,0,1,0,0,1
15,54:46:00,24:32:00,Siebter Spieler eingewechselt Hannover-Burgdorf,Hannover-Burgdorf,SG Flensburg-Handewitt,0,0,1,0,0,0,0,0
16,54:46:00,24:32:00,Tor (6M)! Johannes Golla (SG Flensburg-Handewitt) netzt ein zum neuen Spielstand von 24:32.,Hannover-Burgdorf,SG Flensburg-Handewitt,0,0,0,0,0,0,0,0
17,53:20:00,23:31,Tor (RA)! Teitur Örn Einarsson (SG Flensburg-Handewitt) netzt ein zum neuen Spielstand von 23:31.,Hannover-Burgdorf,SG Flensburg-Handewitt,0,0,0,0,0,0,0,0
18,52:22:00,,Parade von Torwart Kevin Møller (SG Flensburg-Handewitt).,Hannover-Burgdorf,SG Flensburg-Handewitt,0,0,0,0,0,0,0,0
19,51:33:00,23:30,"Neuer Spielstand in Hannover, 23:30 durch den Treffer von Franz Semper für SG Flensburg-Handewitt.",Hannover-Burgdorf,SG Flensburg-Handewitt,0,0,0,0,0,0,0,0
20,51:13:00,,Zeitstrafe vorbei SG Flensburg-Handewitt,Hannover-Burgdorf,SG Flensburg-Handewitt,0,0,0,0,0,1,0,0
21,51:01:00,,Siebter Spieler eingewechselt SG Flensburg-Handewitt,Hannover-Burgdorf,SG Flensburg-Handewitt,0,0,0,1,0,1,0,0
22,50:54:00,23:29,Ilija Brozovic (Hannover-Burgdorf) trifft von (6M). Neuer Spielstand in ZAG Arena: 23:29.,Hannover-Burgdorf,SG Flensburg-Handewitt,0,0,0,0,0,1,0,0
23,50:35:00,,Dario Quenstedt (Hannover-Burgdorf) wurde soeben eingewechselt und soll nun die Abwehr stabilisieren.,Hannover-Burgdorf,SG Flensburg-Handewitt,0,0,0,0,0,1,0,0
24,50:30:00,22:29,Jim Gottfridsson (SG Flensburg-Handewitt) trifft zum Spielstand von 22:29 in ZAG Arena.,Hannover-Burgdorf,SG Flensburg-Handewitt,0,0,0,0,0,1,0,0
25,49:31:00,,Siebter Spieler eingewechselt SG Flensburg-Handewitt,Hannover-Burgdorf,SG Flensburg-Handewitt,0,0,0,1,0,1,0,0
26,49:27:00,22:28,Tor! Uladzislau Kulesh (Hannover-Burgdorf) netzt ein zum neuen Spielstand von 22:28.,Hannover-Burgdorf,SG Flensburg-Handewitt,0,0,0,0,0,1,0,0
27,49:11:00,,"Nach einem harten Foul hat Mads Mensah Larsen (SG Flensburg-Handewitt) nun zwei Minuten Zeit, um sich auszuruhen.",Hannover-Burgdorf,SG Flensburg-Handewitt,0,0,0,0,0,1,1,0
28,48:34:00,21:28,Teitur Örn Einarsson (SG Flensburg-Handewitt) überwindet den Torwart zum neuen Spielstand von 21:28.,Hannover-Burgdorf,SG Flensburg-Handewitt,0,0,0,0,0,0,0,0
29,47:55:00,,Kevin Møller (SG Flensburg-Handewitt) hält den Wurf von Uladzislau Kulesh.,Hannover-Burgdorf,SG Flensburg-Handewitt,0,0,0,0,0,0,0,0
30,47:21:00,21:27,"Neuer Spielstand in Hannover, 21:27 durch den Treffer 6M von Johannes Golla für SG Flensburg-Handewitt.",Hannover-Burgdorf,SG Flensburg-Handewitt,0,0,0,0,0,0,0,0
31,47:17:00,,Jim Gottfridsson (SG Flensburg-Handewitt) scheitert am Torwart Domenico Ebner (Hannover-Burgdorf).,Hannover-Burgdorf,SG Flensburg-Handewitt,0,0,0,0,0,0,0,0
32,46:57:00,21:26,Uladzislau Kulesh (Hannover-Burgdorf) überwindet den Torwart von (6M) zum neuen Spielstand von 21:26.,Hannover-Burgdorf,SG Flensburg-Handewitt,0,0,0,0,0,0,0,0
33,46:40:00,,Zeitstrafe vorbei Hannover-Burgdorf,Hannover-Burgdorf,SG Flensburg-Handewitt,0,0,0,0,1,0,0,0
34,46:34:00,,Siebter Spieler eingewechselt Hannover-Burgdorf,Hannover-Burgdorf,SG Flensburg-Handewitt,0,0,1,0,1,0,0,0
35,46:25:00,,Fehlwurf von Mads Mensah Larsen (SG Flensburg-Handewitt).,Hannover-Burgdorf,SG Flensburg-Handewitt,0,0,0,0,1,0,0,0
36,45:57:00,,Renars Uscins (Hannover-Burgdorf) trifft von (6M). Neuer Spielstand in ZAG Arena: 20:26.,Hannover-Burgdorf,SG Flensburg-Handewitt,0,0,0,0,1,0,0,0
37,44:57:00,20:26,Johannes Golla (SG Flensburg-Handewitt) legt den Treffer von Emil Jakobsen auf. Es steht 19:26.,Hannover-Burgdorf,SG Flensburg-Handewitt,0,0,0,0,1,0,0,0
38,44:56:00,,Siebter Spieler eingewechselt Hannover-Burgdorf,Hannover-Burgdorf,SG Flensburg-Handewitt,0,0,1,0,1,0,0,0
39,44:37:00,,Evgeni Pevnov (Hannover-Burgdorf) erhält wegen eines Regelverstoßes eine 2 Minuten Strafe.,Hannover-Burgdorf,SG Flensburg-Handewitt,0,0,0,0,1,0,0,1
40,44:00:00,,Fehlwurf von Vincent Büchner (Hannover-Burgdorf).,Hannover-Burgdorf,SG Flensburg-Handewitt,0,0,0,0,0,0,0,0
41,43:49:00,19:25,Gøran Søgard Johannessen (SG Flensburg-Handewitt) trifft zum Spielstand von 19:25 in ZAG Arena.,Hannover-Burgdorf,SG Flensburg-Handewitt,0,0,0,0,0,0,0,0
42,42:18:00,19:24,"Neuer Spielstand in Hannover, 19:24 durch den Treffer LA von Emil Jakobsen für SG Flensburg-Handewitt.",Hannover-Burgdorf,SG Flensburg-Handewitt,0,0,0,0,0,0,0,0
43,42:10:00,,Zeitstrafe vorbei SG Flensburg-Handewitt,Hannover-Burgdorf,SG Flensburg-Handewitt,0,0,0,0,0,1,0,0
44,41:46:00,,Siebter Spieler eingewechselt SG Flensburg-Handewitt,Hannover-Burgdorf,SG Flensburg-Handewitt,0,0,0,1,0,1,0,0
45,41:39:00,19:23,Vincent Büchner (Hannover-Burgdorf) überwindet den Torwart von (LA) zum neuen Spielstand von 19:23.,Hannover-Burgdorf,SG Flensburg-Handewitt,0,0,0,0,0,1,0,0
46,41:15:00,18:23,Teitur Örn Einarsson (SG Flensburg-Handewitt) überwindet den Torwart zum neuen Spielstand von 18:23.,Hannover-Burgdorf,SG Flensburg-Handewitt,0,0,0,0,0,1,0,0
47,40:31:00,,Siebter Spieler eingewechselt SG Flensburg-Handewitt,Hannover-Burgdorf,SG Flensburg-Handewitt,0,0,0,1,0,1,0,0
48,40:06:00,,"Nach einem harten Foul hat Jim Gottfridsson (SG Flensburg-Handewitt) nun zwei Minuten Zeit, um sich auszuruhen.",Hannover-Burgdorf,SG Flensburg-Handewitt,0,0,0,0,0,1,1,0
49,39:27:00,18:22,"Neuer Spielstand in Hannover, 18:22 durch den Treffer von Franz Semper für SG Flensburg-Handewitt.",Hannover-Burgdorf,SG Flensburg-Handewitt,0,0,0,0,0,0,0,0
50,38:47:00,,Tor (6M)! Jonathan Edvardsson (Hannover-Burgdorf) netzt ein zum neuen Spielstand von 18:21.,Hannover-Burgdorf,SG Flensburg-Handewitt,0,0,0,0,0,0,0,0
51,37:23:00,,Torwartwechsel bei SG Flensburg-Handewitt. Kevin Møller kommt für Benjamin Buric.,Hannover-Burgdorf,SG Flensburg-Handewitt,0,0,0,0,0,0,0,0
52,37:16:00,17:21,"Tor von der 7-Meter Linie von Maximilian Gerbl (Hannover-Burgdorf), neuer Spielstand 17:21.",Hannover-Burgdorf,SG Flensburg-Handewitt,0,0,0,0,0,0,0,0
53,37:09:00,,SG Flensburg-Handewitt wechselt den Torwart. Benjamin Buric kommt für Kevin Møller.,Hannover-Burgdorf,SG Flensburg-Handewitt,0,0,0,0,0,0,0,0
54,36:59:00,16:21,Tor! Franz Semper (SG Flensburg-Handewitt) netzt ein zum neuen Spielstand von 16:21.,Hannover-Burgdorf,SG Flensburg-Handewitt,0,0,0,0,0,0,0,0
55,36:36:00,,Otto/Piper verwarnen Christian Prokop (Hannover-Burgdorf) mit einer Gelben Karte.,Hannover-Burgdorf,SG Flensburg-Handewitt,0,0,0,0,0,0,0,0
56,36:31:00,,Hannes Feise von Hannover-Burgdorf unterläuft ein technischer Fehler. Der Ballbesitz wechselt.,Hannover-Burgdorf,SG Flensburg-Handewitt,0,0,0,0,0,0,0,0
57,35:35:00,16:20,Franz Semper (SG Flensburg-Handewitt) trifft zum Spielstand von 16:20 in ZAG Arena.,Hannover-Burgdorf,SG Flensburg-Handewitt,0,0,0,0,0,0,0,0
58,34:58:00,16:19,Renars Uscins (Hannover-Burgdorf) überwindet den Torwart zum neuen Spielstand von 16:19.,Hannover-Burgdorf,SG Flensburg-Handewitt,0,0,0,0,0,0,0,0
59,34:29:00,,"Parade des Torwarts von Hannover-Burgdorf, Domenico Ebner.",Hannover-Burgdorf,SG Flensburg-Handewitt,0,0,0,0,0,0,0,0
60,34:19:00,,Der Wurf von SG Flensburg-Handewitt wurde geblockt.,Hannover-Burgdorf,SG Flensburg-Handewitt,0,0,0,0,0,0,0,0
61,33:54:00,,Zeitstrafe vorbei SG Flensburg-Handewitt.,Hannover-Burgdorf,SG Flensburg-Handewitt,0,0,0,0,0,1,0,0
62,33:46:00,,Siebter Spieler eingewechselt SG Flensburg-Handewitt.,Hannover-Burgdorf,SG Flensburg-Handewitt,0,0,0,1,0,1,0,0
63,33:23:00,15:19,Uladzislau Kulesh (Hannover-Burgdorf) trifft von (6M). Neuer Spielstand in ZAG Arena: 15:19.,Hannover-Burgdorf,SG Flensburg-Handewitt,0,0,0,0,0,1,0,0
64,33:14:00,,Emil Jakobsen (SG Flensburg-Handewitt) vergibt den 7-Meter.,Hannover-Burgdorf,SG Flensburg-Handewitt,0,0,0,0,0,1,0,0
65,32:29:00,,Siebter Spieler eingewechselt SG Flensburg-Handewitt.,Hannover-Burgdorf,SG Flensburg-Handewitt,0,0,0,1,0,1,0,0
66,32:21:00,14:19,"Tor von der 7-Meter Linie von Maximilian Gerbl (Hannover-Burgdorf), neuer Spielstand 14:19.",Hannover-Burgdorf,SG Flensburg-Handewitt,0,0,0,0,0,1,0,0
67,31:52:00,,Mads Mensah Larsen (SG Flensburg-Handewitt) erhält eine Zeitstrafe und hat nun zwei Minuten Zeit sich auf der Bank zu beruhigen.,Hannover-Burgdorf,SG Flensburg-Handewitt,0,0,0,0,0,1,1,0
68,31:40:00,13:19,Tor (LA)! Johannes Golla (SG Flensburg-Handewitt) netzt ein zum neuen Spielstand von 13:19.,Hannover-Burgdorf,SG Flensburg-Handewitt,0,0,0,0,0,0,0,0
69,30:51:00,,Kevin Møller (SG Flensburg-Handewitt) mit einer Parade.,Hannover-Burgdorf,SG Flensburg-Handewitt,0,0,0,0,0,0,0,0
70,30:41:00,,Magnus Abelvik Rød von SG Flensburg-Handewitt unterläuft ein technischer Fehler. Der Ballbesitz wechselt.,Hannover-Burgdorf,SG Flensburg-Handewitt,0,0,0,0,0,0,0,0
71,30:39:00,13:18,Tor! Emil Jakobsen (SG Flensburg-Handewitt) netzt ein zum neuen Spielstand von 13:18.,Hannover-Burgdorf,SG Flensburg-Handewitt,0,0,0,0,0,0,0,0
72,30:33:00,,Renars Uscins von Hannover-Burgdorf unterläuft ein technischer Fehler. Der Ballbesitz wechselt.,Hannover-Burgdorf,SG Flensburg-Handewitt,0,0,0,0,0,0,0,0
73,,,HALBZEIT (13:17),Hannover-Burgdorf,SG Flensburg-Handewitt,0,0,0,0,0,0,0,0
74,30:00:00,13:17,"Neuer Spielstand in Hannover, 13:17 durch den Treffer von Franz Semper für SG Flensburg-Handewitt.",Hannover-Burgdorf,SG Flensburg-Handewitt,0,0,0,0,0,0,0,0
75,29:42:00,,Auszeit SG Flensburg-Handewitt,Hannover-Burgdorf,SG Flensburg-Handewitt,0,1,0,0,0,0,0,0
76,29:38:00,13:16,Der 7-Meter wurde von Maximilian Gerbl (Hannover-Burgdorf) erfolgreich verwandelt.,Hannover-Burgdorf,SG Flensburg-Handewitt,0,0,0,0,0,0,0,0
77,28:47:00,,Mads Mensah Larsen von SG Flensburg-Handewitt unterläuft ein technischer Fehler. Der Ballbesitz wechselt.,Hannover-Burgdorf,SG Flensburg-Handewitt,0,0,0,0,0,0,0,0
78,28:45:00,,Zeitstrafe vorbei SG Flensburg-Handewitt,Hannover-Burgdorf,SG Flensburg-Handewitt,0,0,0,0,0,1,0,0
79,28:35:00,,Evgeni Pevnov blockt den Wurf von Mads Mensah Larsen.,Hannover-Burgdorf,SG Flensburg-Handewitt,0,0,0,0,0,1,0,0
80,27:41:00,,Siebter Spieler eingewechselt SG Flensburg-Handewitt,Hannover-Burgdorf,SG Flensburg-Handewitt,0,0,0,1,0,1,0,0
81,27:34:00,12:16,Ilija Brozovic (Hannover-Burgdorf) überwindet den Torwart von (6M) zum neuen Spielstand von 12:16.,Hannover-Burgdorf,SG Flensburg-Handewitt,0,0,0,0,0,1,0,0
82,27:21:00,11:16,"Neuer Spielstand in Hannover, 11:16 durch den Treffer 6M von Franz Semper für SG Flensburg-Handewitt.",Hannover-Burgdorf,SG Flensburg-Handewitt,0,0,0,0,0,1,0,0
83,27:04:00,,Siebter Spieler eingewechselt SG Flensburg-Handewitt,Hannover-Burgdorf,SG Flensburg-Handewitt,0,0,0,1,0,1,0,0
84,26:41:00,,Es gibt eine 2 Minuten Strafe für Jim Gottfridsson (SG Flensburg-Handewitt).,Hannover-Burgdorf,SG Flensburg-Handewitt,0,0,0,0,0,1,1,0
85,26:40:00,11:15,Renars Uscins (Hannover-Burgdorf) überwindet den Torwart zum neuen Spielstand von 11:15.,Hannover-Burgdorf,SG Flensburg-Handewitt,0,0,0,0,0,0,0,0
86,26:00:00,,Domenico Ebner (Hannover-Burgdorf) mit einer Parade.,Hannover-Burgdorf,SG Flensburg-Handewitt,0,0,0,0,0,0,0,0
87,25:33:00,,Überragende Parade des Torwarts Kevin Møller (SG Flensburg-Handewitt)! Renars Uscins kann den Ball nicht im Tor unterbringen!,Hannover-Burgdorf,SG Flensburg-Handewitt,0,0,0,0,0,0,0,0
88,24:31:00,10:15,Tor (6M)! Renars Uscins (Hannover-Burgdorf) netzt ein zum neuen Spielstand von 10:15.,Hannover-Burgdorf,SG Flensburg-Handewitt,0,0,0,0,0,0,0,0
89,24:05:00,,Auszeit Hannover-Burgdorf,Hannover-Burgdorf,SG Flensburg-Handewitt,1,0,0,0,0,0,0,0
90,23:25,,Zeitstrafe vorbei Hannover-Burgdorf,Hannover-Burgdorf,SG Flensburg-Handewitt,0,0,0,0,1,0,0,0
91,23:14,9:15,"Neuer Spielstand in Hannover, 9:15 durch den Treffer LA von Emil Jakobsen für SG Flensburg-Handewitt.",Hannover-Burgdorf,SG Flensburg-Handewitt,0,0,0,0,1,0,0,0
92,22:56,,"Der Torwart von SG Flensburg-Handewitt, Kevin Møller hält den Wurf von Uladzislau Kulesh.",Hannover-Burgdorf,SG Flensburg-Handewitt,0,0,0,0,1,0,0,0
93,22:27,,Siebter Spieler eingewechselt Hannover-Burgdorf,Hannover-Burgdorf,SG Flensburg-Handewitt,0,0,1,0,1,0,0,0
94,22:20,9:14,Franz Semper (SG Flensburg-Handewitt) trifft zum Spielstand von 9:14 in ZAG Arena.,Hannover-Burgdorf,SG Flensburg-Handewitt,0,0,0,0,1,0,0,0
95,21:47,,"Renars Uscins (RR/fern) wirft, jedoch neben das Tor.",Hannover-Burgdorf,SG Flensburg-Handewitt,0,0,0,0,1,0,0,0
96,21:10,,Justus Fischer geht den Gegner zu stark an. Hannover-Burgdorf muss nun die nächsten zwei Minuten mit einem Spieler weniger auskommen.,Hannover-Burgdorf,SG Flensburg-Handewitt,0,0,0,0,1,0,0,1
97,21:10,9:13,Gøran Søgard Johannessen (SG Flensburg-Handewitt) überwindet den Torwart von (6M) zum neuen Spielstand von 9:13.,Hannover-Burgdorf,SG Flensburg-Handewitt,0,0,0,0,0,0,0,0
98,21:09,,Siebter Spieler eingewechselt Hannover-Burgdorf,Hannover-Burgdorf,SG Flensburg-Handewitt,0,0,1,0,0,0,0,0
99,20:39,9:12,Tor! Ilija Brozovic (Hannover-Burgdorf) netzt ein zum neuen Spielstand von 9:12.,Hannover-Burgdorf,SG Flensburg-Handewitt,0,0,0,0,0,0,0,0
100,20:24,,Der Wurfversuch von Uladzislau Kulesh (Hannover-Burgdorf) wurde durch einen Block von Johannes Golla verhindert.,Hannover-Burgdorf,SG Flensburg-Handewitt,0,0,0,0,0,0,0,0
101,19:33,,"Der Trainer von Hannover-Burgdorf, Christian Prokop stellt nun Domenico Ebner zwischen die Pfosten.",Hannover-Burgdorf,SG Flensburg-Handewitt,0,0,0,0,0,0,0,0
102,19:21,8:12,"Neuer Spielstand in Hannover, 8:12 durch den Treffer von Mads Mensah Larsen für SG Flensburg-Handewitt.",Hannover-Burgdorf,SG Flensburg-Handewitt,0,0,0,0,0,0,0,0
103,18:46,8:11,Renars Uscins (Hannover-Burgdorf) trifft von (RM/fern). Neuer Spielstand in ZAG Arena: 8:11.,Hannover-Burgdorf,SG Flensburg-Handewitt,0,0,0,0,0,0,0,0
104,18:10,7:11,"Neuer Spielstand in Hannover, 7:11 durch den Treffer von Teitur Örn Einarsson für SG Flensburg-Handewitt.",Hannover-Burgdorf,SG Flensburg-Handewitt,0,0,0,0,0,0,0,0
105,17:57,7:10,Veit Mävers (Hannover-Burgdorf) trifft zum Spielstand von 7:10 in ZAG Arena.,Hannover-Burgdorf,SG Flensburg-Handewitt,0,0,0,0,0,0,0,0
106,17:30,,Auszeit Hannover-Burgdorf,Hannover-Burgdorf,SG Flensburg-Handewitt,1,0,0,0,0,0,0,0
107,17:29,6:10,Emil Jakobsen (SG Flensburg-Handewitt) überwindet den Torwart zum neuen Spielstand von 6:10.,Hannover-Burgdorf,SG Flensburg-Handewitt,0,0,0,0,0,0,0,0
108,16:11,,Parade von Torwart Dario Quenstedt (Hannover-Burgdorf).,Hannover-Burgdorf,SG Flensburg-Handewitt,0,0,0,0,0,0,0,0
109,16:01,,"Parade des Torwarts von SG Flensburg-Handewitt, Kevin Møller.",Hannover-Burgdorf,SG Flensburg-Handewitt,0,0,0,0,0,0,0,0
110,15:51,,Zeitstrafe vorbei Hannover-Burgdorf,Hannover-Burgdorf,SG Flensburg-Handewitt,0,0,0,0,1,0,0,0
111,15:42,,Kevin Møller (SG Flensburg-Handewitt) mit einer Parade.,Hannover-Burgdorf,SG Flensburg-Handewitt,0,0,0,0,1,0,0,0
112,15:10,,Siebter Spieler eingewechselt Hannover-Burgdorf,Hannover-Burgdorf,SG Flensburg-Handewitt,0,0,1,0,1,0,0,0
113,15:07,6:09,Emil Jakobsen (SG Flensburg-Handewitt) überwindet den Torwart von (LA) zum neuen Spielstand von 6:9.,Hannover-Burgdorf,SG Flensburg-Handewitt,0,0,0,0,1,0,0,0
114,14:35,,Jonathan Edvardsson von Hannover-Burgdorf unterläuft ein technischer Fehler. Der Ballbesitz wechselt.,Hannover-Burgdorf,SG Flensburg-Handewitt,0,0,0,0,1,0,0,0
115,13:38,,Justus Fischer (Hannover-Burgdorf) erhält eine 2 Minuten Strafe.,Hannover-Burgdorf,SG Flensburg-Handewitt,0,0,0,0,1,0,0,1
116,13:37,6:08,"Neuer Spielstand in Hannover, 6:8 durch den Treffer 6M von Magnus Abelvik Rød für SG Flensburg-Handewitt.",Hannover-Burgdorf,SG Flensburg-Handewitt,0,0,0,0,0,0,0,0
117,13:36,,Siebter Spieler eingewechselt Hannover-Burgdorf,Hannover-Burgdorf,SG Flensburg-Handewitt,0,0,1,0,0,0,0,0
118,13:09,,Wurfversuch von Jonathan Edvardsson (Hannover-Burgdorf) aber der Ball landet an der Latte.,Hannover-Burgdorf,SG Flensburg-Handewitt,0,0,0,0,0,0,0,0
119,12:25,,Zeitstrafe vorbei SG Flensburg-Handewitt,Hannover-Burgdorf,SG Flensburg-Handewitt,0,0,0,0,0,1,0,0
120,12:25,6:07,"Tor Renars Uscins, Hannover-Burgdorf",Hannover-Burgdorf,SG Flensburg-Handewitt,0,0,0,0,0,1,0,0
121,12:12,,"Torwurf von Magnus Abelvik Rød (SG Flensburg-Handewitt), aber der Ball trifft nur die Latte.",Hannover-Burgdorf,SG Flensburg-Handewitt,0,0,0,0,0,1,0,0
122,11:22,,Siebter Spieler eingewechselt SG Flensburg-Handewitt,Hannover-Burgdorf,SG Flensburg-Handewitt,0,0,0,1,0,1,0,0
123,11:20,5:07,Tor! Maximilian Gerbl (Hannover-Burgdorf) netzt ein zum neuen Spielstand von 5:7.,Hannover-Burgdorf,SG Flensburg-Handewitt,0,0,0,0,0,1,0,0
124,10:54,4:07,Johan Hansen (SG Flensburg-Handewitt) trifft von (RA). Neuer Spielstand in ZAG Arena: 4:7.,Hannover-Burgdorf,SG Flensburg-Handewitt,0,0,0,0,0,1,0,0
125,10:18,,2-Minuten-Strafe für Johannes Golla. SG Flensburg-Handewitt muss nun die nächsten zwei Minuten mit einerm Spieler weniger auskommen.,Hannover-Burgdorf,SG Flensburg-Handewitt,0,0,0,0,0,1,1,0
126,10:18,4:06,"Neuer Spielstand in Hannover, 4:6 durch den Treffer von Renars Uscins für Hannover-Burgdorf.",Hannover-Burgdorf,SG Flensburg-Handewitt,0,0,0,0,0,0,0,0
127,10:16,,Siebter Spieler eingewechselt SG Flensburg-Handewitt,Hannover-Burgdorf,SG Flensburg-Handewitt,0,0,0,1,0,0,0,0
128,9:42,3:06,Emil Jakobsen (SG Flensburg-Handewitt) trifft von der 7-Meter Linie.,Hannover-Burgdorf,SG Flensburg-Handewitt,0,0,0,0,0,0,0,0
129,9:11,,Magnus Abelvik Rød (SG Flensburg-Handewitt) trifft die Latte.,Hannover-Burgdorf,SG Flensburg-Handewitt,0,0,0,0,0,0,0,0
130,8:51,,"Gute Torchance, aber Magnus Abelvik Rød (SG Flensburg-Handewitt) kann diese nicht erfolgreich verwandeln.",Hannover-Burgdorf,SG Flensburg-Handewitt,0,0,0,0,0,0,0,0
131,8:07,3:05,Maximilian Gerbl (Hannover-Burgdorf) trifft von der 7-Meter Linie und bringt den Spielstand auf 3:5.,Hannover-Burgdorf,SG Flensburg-Handewitt,0,0,0,0,0,0,0,0
132,7:48,,Emil Jakobsen (SG Flensburg-Handewitt) bekommt die Gelbe Karte von Otto/Piper gezeigt.,Hannover-Burgdorf,SG Flensburg-Handewitt,0,0,0,0,0,0,0,0
133,7:20,2:05,Tor! Jim Gottfridsson (SG Flensburg-Handewitt) netzt ein zum neuen Spielstand von 2:5.,Hannover-Burgdorf,SG Flensburg-Handewitt,0,0,0,0,0,0,0,0
134,6:47,,Marian Michalczik (Hannover-Burgdorf) trifft nur den Pfosten.,Hannover-Burgdorf,SG Flensburg-Handewitt,0,0,0,0,0,0,0,0
135,6:16,2:04,Magnus Abelvik Rød (SG Flensburg-Handewitt) trifft zum Spielstand von 2:4 in ZAG Arena.,Hannover-Burgdorf,SG Flensburg-Handewitt,0,0,0,0,0,0,0,0
136,6:01,,Kevin Møller (SG Flensburg-Handewitt) hält den Wurf von Hannes Feise.,Hannover-Burgdorf,SG Flensburg-Handewitt,0,0,0,0,0,0,0,0
137,5:53,2:03,Gøran Søgard Johannessen (SG Flensburg-Handewitt) überwindet den Torwart zum neuen Spielstand von 2:3.,Hannover-Burgdorf,SG Flensburg-Handewitt,0,0,0,0,0,0,0,0
138,5:40,2:02,Tor (6M)! Renars Uscins (Hannover-Burgdorf) netzt ein zum neuen Spielstand von 2:2.,Hannover-Burgdorf,SG Flensburg-Handewitt,0,0,0,0,0,0,0,0
139,4:51,1:02,"Neuer Spielstand in Hannover, 1:2 durch den Treffer 6M von Gøran Søgard Johannessen für SG Flensburg-Handewitt.",Hannover-Burgdorf,SG Flensburg-Handewitt,0,0,0,0,0,0,0,0
140,3:57,,Magnus Abelvik Rød (SG Flensburg-Handewitt) scheitert am Torwart Dario Quenstedt (Hannover-Burgdorf).,Hannover-Burgdorf,SG Flensburg-Handewitt,0,0,0,0,0,0,0,0
141,3:37,,"Der Torwart von Hannover-Burgdorf, Dario Quenstedt pariert den Wurf.",Hannover-Burgdorf,SG Flensburg-Handewitt,0,0,0,0,0,0,0,0
142,3:08,1:01,Hannes Feise (Hannover-Burgdorf) überwindet den Torwart von (LA) zum neuen Spielstand von 1:1.,Hannover-Burgdorf,SG Flensburg-Handewitt,0,0,0,0,0,0,0,0
143,2:28,,Gøran Søgard Johannessen von SG Flensburg-Handewitt wurde mit der Gelben Karte von Otto/Piper verwarnt.,Hannover-Burgdorf,SG Flensburg-Handewitt,0,0,0,0,0,0,0,0
144,2:06,0:01,Gøran Søgard Johannessen (SG Flensburg-Handewitt) trifft von (6M). Neuer Spielstand in ZAG Arena: 0:1.,Hannover-Burgdorf,SG Flensburg-Handewitt,0,0,0,0,0,0,0,0
145,1:40,,Es gibt Gelb für Hannes Feise (Hannover-Burgdorf) von Otto/Piper.,Hannover-Burgdorf,SG Flensburg-Handewitt,0,0,0,0,0,0,0,0
146,0:49,,Der Wurf von Jonathan Edvardsson (Hannover-Burgdorf) landet hinter dem Tor.,Hannover-Burgdorf,SG Flensburg-Handewitt,0,0,0,0,0,0,0,0