Time,Score,Event.Description,Hometeam,Awayteam,Timeout_Hometeam,Timeout_Awayteam,SeventhPlayer_Hometeam,SeventhPlayer_Awayteam,SixthPlayer_Hometeam,SixthPlayer_Awayteam,Penalty_Awayteam,Penalty_Hometeam
59:49:00,30:32:00,Hannes Feise (Hannover-Burgdorf) überwindet den Torwart von (6M) zum neuen Spielstand von 30:32.,Hannover-Burgdorf,Bergischer HC,0,0,0,0,0,0,0,0
59:41:00,29:32:00,Tor! Isak Persson (Bergischer HC) netzt ein zum neuen Spielstand von 29:32.,Hannover-Burgdorf,Bergischer HC,0,0,0,0,0,0,0,0
59:19:00,,"Parade des Torwarts von Bergischer HC, Peter Johannesson.",Hannover-Burgdorf,Bergischer HC,0,0,0,0,0,0,0,0
58:58:00,29:31:00,Tomas Babak (Bergischer HC) trifft zum Spielstand von 29:31 in der ZAG Arena.,Hannover-Burgdorf,Bergischer HC,0,0,0,0,0,0,0,0
58:50:00,,Zeitstrafe vorbei für Bergischer HC.,Hannover-Burgdorf,Bergischer HC,0,0,0,0,0,1,0,0
58:30:00,,"Der Torwart von Bergischer HC, Peter Johannesson, pariert den Wurf.",Hannover-Burgdorf,Bergischer HC,0,0,0,0,0,1,0,0
58:18:00,29:30:00,Tor (6M)! Tomas Babak (Bergischer HC) netzt ein zum neuen Spielstand von 29:30.,Hannover-Burgdorf,Bergischer HC,0,0,0,0,0,1,0,0
58:04:00,,Auszeit für Bergischer HC.,Hannover-Burgdorf,Bergischer HC,0,0,0,0,0,1,0,0
57:44:00,29:29:00,"Neuer Spielstand in Hannover, 29:29 durch den Treffer RA von Maximilian Gerbl für Hannover-Burgdorf.",Hannover-Burgdorf,Bergischer HC,0,0,0,0,0,1,0,0
57:20:00,,Isak Persson (Bergischer HC) scheitert am Torwart Dario Quenstedt (Hannover-Burgdorf).,Hannover-Burgdorf,Bergischer HC,0,0,0,0,0,1,0,0
57:04:00,,Siebter Spieler eingewechselt für Bergischer HC.,Hannover-Burgdorf,Bergischer HC,0,0,0,0,0,1,0,0
56:50:00,28:29:00,Marius Steinhauser (Hannover-Burgdorf) trifft von der 7-Meter Linie und bringt den Spielstand auf 28:29.,Hannover-Burgdorf,Bergischer HC,0,0,0,0,0,1,0,0
56:45:00,,Lukas Stutzke (Bergischer HC) erhält eine Zeitstrafe und hat nun zwei Minuten Zeit sich auf der Bank zu beruhigen.,Hannover-Burgdorf,Bergischer HC,0,0,0,0,0,1,1,0
56:36:00,27:29:00,"Neuer Spielstand in Hannover, 27:29 durch den Treffer von Linus Arnesson für Bergischer HC.",Hannover-Burgdorf,Bergischer HC,0,0,0,0,0,0,0,0
55:32:00,27:28:00,Marius Steinhauser (Hannover-Burgdorf) trifft von der 7-Meter Linie.,Hannover-Burgdorf,Bergischer HC,0,0,0,0,0,0,0,0
55:13:00,,Überragende Parade des Torwarts Dario Quenstedt (Hannover-Burgdorf)! Tom Kare Nikolaisen kann den Ball nicht im Tor unterbringen!,Hannover-Burgdorf,Bergischer HC,0,0,0,0,0,0,0,0
54:56:00,,Auszeit für Bergischer HC.,Hannover-Burgdorf,Bergischer HC,0,0,0,0,0,0,0,0
54:40:00,,Maximilian Gerbl von Hannover-Burgdorf unterläuft ein technischer Fehler. Der Ballbesitz wechselt.,Hannover-Burgdorf,Bergischer HC,0,0,0,0,0,0,0,0
54:07:00,,Der eingewechselte Torwart Peter Johannesson (Bergischer HC) steht nun zwischen den Pfosten.,Hannover-Burgdorf,Bergischer HC,0,0,0,0,0,0,0,0
54:01:00,26:28:00,"Tor von der 7-Meter Linie von Marius Steinhauser (Hannover-Burgdorf), neuer Spielstand 26:28.",Hannover-Burgdorf,Bergischer HC,0,0,0,0,0,0,0,0
53:55:00,,Torwartwechsel bei Bergischer HC. Christopher Rudeck kommt für Peter Johannesson.,Hannover-Burgdorf,Bergischer HC,0,0,0,0,0,0,0,0
53:23:00,25:28:00,Tor (LA)! Noah Beyer (Bergischer HC) netzt ein zum neuen Spielstand von 25:28.,Hannover-Burgdorf,Bergischer HC,0,0,0,0,0,0,0,0
53:21:00,,Auszeit für Hannover-Burgdorf.,Hannover-Burgdorf,Bergischer HC,0,0,0,0,0,0,0,0
53:11:00,,Peter Johannesson (Bergischer HC) hält den Wurf von Evgeni Pevnov.,Hannover-Burgdorf,Bergischer HC,0,0,0,0,0,0,0,0
53:03:00,25:27:00,Noah Beyer (Bergischer HC) überwindet den Torwart von (LA) zum neuen Spielstand von 25:27.,Hannover-Burgdorf,Bergischer HC,0,0,0,0,0,0,0,0
52:24:00,,Zeitstrafe vorbei für Hannover-Burgdorf.,Hannover-Burgdorf,Bergischer HC,0,0,0,0,0,0,0,0
52:15:00,,Dario Quenstedt (Hannover-Burgdorf) mit einer Parade.,Hannover-Burgdorf,Bergischer HC,0,0,0,0,0,0,0,0
52:01:00,25:26:00,"Neuer Spielstand in Hannover, 25:26 durch den Treffer 6M von Evgeni Pevnov für Hannover-Burgdorf.",Hannover-Burgdorf,Bergischer HC,0,0,0,0,0,0,0,0
51:56:00,,Auszeit für Hannover-Burgdorf.,Hannover-Burgdorf,Bergischer HC,0,0,0,0,1,0,0,0
51:41:00,,Siebter Spieler eingewechselt für Hannover-Burgdorf.,Hannover-Burgdorf,Bergischer HC,0,0,0,0,1,0,0,0
50:26:00,,Auszeit für Hannover-Burgdorf.,Hannover-Burgdorf,Bergischer HC,0,0,0,0,1,0,0,0
50:04:00,,Siebter Spieler eingewechselt für Hannover-Burgdorf.,Hannover-Burgdorf,Bergischer HC,0,0,0,0,1,0,0,0
49:59:00,24:26:00,Frederik Ladefoged (Bergischer HC) trifft zum Spielstand von 24:26 in der ZAG Arena.,Hannover-Burgdorf,Bergischer HC,0,0,0,0,1,0,0,0
49:59:00,,Justus Fischer (Hannover-Burgdorf) erhält eine 2 Minuten Strafe.,Hannover-Burgdorf,Bergischer HC,0,0,0,0,1,0,0,1
49:43:00,,Peter Johannesson (Bergischer HC) wurde soeben eingewechselt und soll nun die Abwehr stabilisieren.,Hannover-Burgdorf,Bergischer HC,0,0,0,0,0,0,0,0
49:22:00,24:25:00,Tor! Veit Mävers (Hannover-Burgdorf) netzt ein zum neuen Spielstand von 24:25.,Hannover-Burgdorf,Bergischer HC,0,0,0,0,0,0,0,0
49:11:00,23:25,Djibril M'Bengue (Bergischer HC) trifft von (6M). Neuer Spielstand in der ZAG Arena: 23:25.,Hannover-Burgdorf,Bergischer HC,0,0,0,0,0,0,0,0
48:39:00,23:24,Veit Mävers (Hannover-Burgdorf) überwindet den Torwart zum neuen Spielstand von 23:24.,Hannover-Burgdorf,Bergischer HC,0,0,0,0,0,0,0,0
48:15:00,,Fabian Gutbrod von Bergischer HC unterläuft ein technischer Fehler. Der Ballbesitz wechselt.,Hannover-Burgdorf,Bergischer HC,0,0,0,0,0,0,0,0
47:43:00,,"Marian Michalczik (6M) wirft, jedoch neben das Tor.",Hannover-Burgdorf,Bergischer HC,0,0,0,0,0,0,0,0
47:08:00,22:24,Lukas Stutzke (Bergischer HC) überwindet den Torwart von (RM/fern) zum neuen Spielstand von 22:24.,Hannover-Burgdorf,Bergischer HC,0,0,0,0,0,0,0,0
46:18:00,22:23,"Neuer Spielstand in Hannover, 22:23 durch den Treffer 6M von Justus Fischer für Hannover-Burgdorf.",Hannover-Burgdorf,Bergischer HC,0,0,0,0,0,0,0,0
45:40:00,21:23,Tor! Isak Persson (Bergischer HC) netzt ein zum neuen Spielstand von 21:23.,Hannover-Burgdorf,Bergischer HC,0,0,0,0,0,0,0,0
45:02:00,,Dario Quenstedt (Hannover-Burgdorf) mit einer Parade.,Hannover-Burgdorf,Bergischer HC,0,0,0,0,0,0,0,0
44:30:00,21:22,"Neuer Spielstand in Hannover, 21:22 durch den Treffer von Uladzislau Kulesh für Hannover-Burgdorf.",Hannover-Burgdorf,Bergischer HC,0,0,0,0,0,0,0,0
44:14:00,,"Gute Torchance, aber Arnor Thor Gunnarsson (Bergischer HC) kann diese nicht erfolgreich verwandeln.",Hannover-Burgdorf,Bergischer HC,0,0,0,0,0,0,0,0
43:24:00,20:22,Marian Michalczik (Hannover-Burgdorf) trifft zum Spielstand von 20:22 in ZAG Arena.,Hannover-Burgdorf,Bergischer HC,0,0,0,0,0,0,0,0
42:55:00,19:22,Tomas Babak (Bergischer HC) trifft von (6M). Neuer Spielstand in ZAG Arena: 19:22.,Hannover-Burgdorf,Bergischer HC,0,0,0,0,0,0,0,0
42:21:00,,Zeitstrafe vorbei Bergischer HC,Hannover-Burgdorf,Bergischer HC,0,0,0,0,0,1,0,0
42:19:00,,Siebter Spieler eingewechselt Bergischer HC,Hannover-Burgdorf,Bergischer HC,0,0,0,1,0,1,0,0
42:12:00,,Parade von Torwart Christopher Rudeck (Bergischer HC).,Hannover-Burgdorf,Bergischer HC,0,0,0,0,0,1,0,0
41:57:00,,Siebter Spieler eingewechselt Hannover-Burgdorf,Hannover-Burgdorf,Bergischer HC,0,0,1,0,0,1,0,0
41:55:00,,"Der Trainer von Hannover-Burgdorf, Christian Prokop stellt nun Dario Quenstedt zwischen die Pfosten.",Hannover-Burgdorf,Bergischer HC,0,0,0,0,0,1,0,0
41:50:00,19:21,Linus Arnesson (Bergischer HC) trifft von der 7-Meter Linie und bringt den Spielstand auf 19:21.,Hannover-Burgdorf,Bergischer HC,0,0,0,0,0,1,0,0
41:43:00,,Der eingewechselte Torwart Domenico Ebner (Hannover-Burgdorf) steht nun zwischen den Pfosten.,Hannover-Burgdorf,Bergischer HC,0,0,0,0,0,1,0,0
41:06:00,19:20,Marius Steinhauser (Hannover-Burgdorf) überwindet den Torwart zum neuen Spielstand von 19:20.,Hannover-Burgdorf,Bergischer HC,0,0,0,0,0,1,0,0
40:47:00,,Siebter Spieler eingewechselt Bergischer HC,Hannover-Burgdorf,Bergischer HC,0,0,0,1,0,1,0,0
40:42:00,,Zeitstrafe vorbei Hannover-Burgdorf,Hannover-Burgdorf,Bergischer HC,0,0,0,0,1,1,0,0
40:30:00,,Christopher Rudeck (Bergischer HC) bleibt Sieger im 7-Meter-Duell gegen Marius Steinhauser (Hannover-Burgdorf).,Hannover-Burgdorf,Bergischer HC,0,0,0,0,1,1,0,0
40:22:00,,"Nach einem harten Foul hat Djibril M'Bengue (Bergischer HC) nun zwei Minuten Zeit, um sich auszuruhen.",Hannover-Burgdorf,Bergischer HC,0,0,0,0,1,1,1,0
40:21:00,,Siebter Spieler eingewechselt Hannover-Burgdorf,Hannover-Burgdorf,Bergischer HC,0,0,1,0,1,0,0,0
39:23:00,,Siebter Spieler eingewechselt Hannover-Burgdorf,Hannover-Burgdorf,Bergischer HC,0,0,1,0,1,0,0,0
39:04:00,18:20,Tor (LA)! Noah Beyer (Bergischer HC) netzt ein zum neuen Spielstand von 18:20.,Hannover-Burgdorf,Bergischer HC,0,0,0,0,1,0,0,0
38:41:00,,Hannes Feise geht den Gegner zu stark an. Hannover-Burgdorf muss nun die nächsten zwei Minuten mit einem Spieler weniger auskommen.,Hannover-Burgdorf,Bergischer HC,0,0,0,0,1,0,0,1
38:36:00,18:19,Uladzislau Kulesh (Hannover-Burgdorf) überwindet den Torwart von (6M) zum neuen Spielstand von 18:19.,Hannover-Burgdorf,Bergischer HC,0,0,0,0,0,0,0,0
38:00:00,17:19,"Neuer Spielstand in Hannover, 17:19 durch den Treffer RM/fern von Lukas Stutzke für Bergischer HC.",Hannover-Burgdorf,Bergischer HC,0,0,0,0,0,0,0,0
37:25:00,17:18,Uladzislau Kulesh (Hannover-Burgdorf) trifft zum Spielstand von 17:18 in ZAG Arena.,Hannover-Burgdorf,Bergischer HC,0,0,0,0,0,0,0,0
37:10:00,16:18,Tor! Tom Kare Nikolaisen (Bergischer HC) netzt ein zum neuen Spielstand von 16:18.,Hannover-Burgdorf,Bergischer HC,0,0,0,0,0,0,0,0
36:24:00,,"Gute Torchance, aber Uladzislau Kulesh (Hannover-Burgdorf) kann diese nicht erfolgreich verwandeln.",Hannover-Burgdorf,Bergischer HC,0,0,0,0,0,0,0,0
35:54:00,16:17,"Neuer Spielstand in Hannover, 16:17 durch den Treffer von Djibril M'Bengue für Bergischer HC.",Hannover-Burgdorf,Bergischer HC,0,0,0,0,0,0,0,0
35:10:00,15:16,Tomas Babak (Bergischer HC) trifft zum Spielstand von 15:16 in ZAG Arena.,Hannover-Burgdorf,Bergischer HC,0,0,0,0,0,0,0,0
34:55:00,,Hannes Feise von Hannover-Burgdorf unterläuft ein technischer Fehler. Der Ballbesitz wechselt.,Hannover-Burgdorf,Bergischer HC,0,0,0,0,0,0,0,0
34:40:00,15:15,"Neuer Spielstand in ZAG Arena, 15:15 durch den Treffer von 6M von Ilija Brozovic für Hannover-Burgdorf.",Hannover-Burgdorf,Bergischer HC,0,0,0,0,0,0,0,0
34:23:00,,"Der Torwart von Hannover-Burgdorf, Dario Quenstedt hält den Wurf von Tomas Babak.",Hannover-Burgdorf,Bergischer HC,0,0,0,0,0,0,0,0
33:56:00,14:15,Marian Michalczik (Hannover-Burgdorf) trifft von (6M). Neuer Spielstand in ZAG Arena: 14:15.,Hannover-Burgdorf,Bergischer HC,0,0,0,0,0,0,0,0
32:37:00,,"Tomas Babak wirft auf das Tor, trifft aber nur den Pfosten.",Hannover-Burgdorf,Bergischer HC,0,0,0,0,0,0,0,0
32:04:00,13:15,Uladzislau Kulesh (Hannover-Burgdorf) trifft zum Spielstand von 13:15 in ZAG Arena.,Hannover-Burgdorf,Bergischer HC,0,0,0,0,0,0,0,0
31:28:00,12:15,Lukas Stutzke (Bergischer HC) überwindet den Torwart von (6M) zum neuen Spielstand von 12:15.,Hannover-Burgdorf,Bergischer HC,0,0,0,0,0,0,0,0
30:40:00,12:14,Christopher Rudeck (Bergischer HC) hält den Wurf von Hannes Feise.,Hannover-Burgdorf,Bergischer HC,0,0,0,0,0,0,0,0
HALBZ,12:13,,Hannover-Burgdorf,Bergischer HC,0,0,0,0,0,0,0,0
29:57:00,,"Wurfversuch von Tomas Babak (Bergischer HC), aber der Ball landet an der Latte.",Hannover-Burgdorf,Bergischer HC,0,0,0,0,0,0,0,0
29:37:00,,Zeitstrafe vorbei Bergischer HC,Hannover-Burgdorf,Bergischer HC,0,0,0,0,0,1,0,0
29:32:00,12:13,Ilija Brozovic (Hannover-Burgdorf) überwindet den Torwart zum neuen Spielstand von 12:13.,Hannover-Burgdorf,Bergischer HC,0,0,0,0,0,1,0,0
29:01:00,,Fehlwurf von Arnor Thor Gunnarsson (Bergischer HC).,Hannover-Burgdorf,Bergischer HC,0,0,0,0,0,1,0,0
28:41:00,,Christian Prokop (Hannover-Burgdorf) bekommt die Gelbe Karte von Kolb/Kauth gezeigt.,Hannover-Burgdorf,Bergischer HC,0,0,0,0,0,1,0,0
28:38:00,,Zeitstrafe vorbei Hannover-Burgdorf,Hannover-Burgdorf,Bergischer HC,0,0,0,0,1,1,0,0
28:37:00,,Siebter Spieler eingewechselt Bergischer HC,Hannover-Burgdorf,Bergischer HC,0,0,0,1,1,1,0,0
28:30:00,,Branko Vujovic von Hannover-Burgdorf unterläuft ein technischer Fehler. Der Ballbesitz wechselt.,Hannover-Burgdorf,Bergischer HC,0,0,0,0,1,1,0,0
27:57:00,,Siebter Spieler eingewechselt Bergischer HC,Hannover-Burgdorf,Bergischer HC,0,0,0,1,1,1,0,0
27:55:00,,Nun wird Christopher Rudeck für Bergischer HC im Tor stehen.,Hannover-Burgdorf,Bergischer HC,0,0,0,0,1,1,0,0
27:44:00,11:13,11:13:00 Der 7-Meter wurde von Marius Steinhauser (Hannover-Burgdorf) erfolgreich verwandelt.,Hannover-Burgdorf,Bergischer HC,0,0,0,0,1,1,0,0
27:39:00,,Frederik Ladefoged (Bergischer HC) erhält wegen eines Regelverstoßes eine 2 Minuten Strafe.,Hannover-Burgdorf,Bergischer HC,0,0,0,0,1,1,1,0
27:35:00,,Bergischer HC wechselt den Torwart. Peter Johannesson kommt für Christopher Rudeck.,Hannover-Burgdorf,Bergischer HC,0,0,0,0,1,0,0,0
27:10:00,,Auszeit Hannover-Burgdorf,Hannover-Burgdorf,Bergischer HC,1,0,0,0,1,0,0,0
27:09:00,10:13,Tor (6M)! Tomas Babak (Bergischer HC) netzt ein zum neuen Spielstand von 10:13.,Hannover-Burgdorf,Bergischer HC,0,0,0,0,1,0,0,0
26:59:00,,Zeitstrafe vorbei Hannover-Burgdorf,Hannover-Burgdorf,Bergischer HC,0,0,0,0,1,0,0,0
26:49:00,,"Marius Steinhauser (6M) wirft, jedoch neben das Tor.",Hannover-Burgdorf,Bergischer HC,0,0,0,0,0,0,0,0
26:34:00,,Siebter Spieler eingewechselt Hannover-Burgdorf,Hannover-Burgdorf,Bergischer HC,0,0,1,0,1,0,0,0
26:27:00,,"Nach einem harten Foul hat Renars Uscins (Hannover-Burgdorf) nun zwei Minuten Zeit, um sich auszuruhen.",Hannover-Burgdorf,Bergischer HC,0,0,0,0,1,0,0,1
26:27:00,10:12,Tor! Frederik Ladefoged (Bergischer HC) netzt ein zum neuen Spielstand von 10:12.,Hannover-Burgdorf,Bergischer HC,0,0,0,0,1,0,0,0
26:16:00,,Zeitstrafe vorbei Bergischer HC,Hannover-Burgdorf,Bergischer HC,0,0,0,0,1,1,0,0
26:01:00,,Lukas Stutzke blockt den Wurf von Veit Mävers.,Hannover-Burgdorf,Bergischer HC,0,0,0,0,1,1,0,0
25:27:00,10:11,Siebter Spieler eingewechselt Hannover-Burgdorf,Hannover-Burgdorf,Bergischer HC,0,0,1,0,1,1,0,0
25:02:00,,2-Minuten-Strafe für Marian Michalczik. Hannover-Burgdorf muss nun die nächsten zwei Minuten mit einem Spieler weniger auskommen.,Hannover-Burgdorf,Bergischer HC,0,0,0,0,1,1,0,1
24:22:00,10:10,10:10:00 Der 7-Meter wurde von Marius Steinhauser (Hannover-Burgdorf) erfolgreich verwandelt.,Hannover-Burgdorf,Bergischer HC,0,0,0,0,0,1,0,0
24:16:00,,Tom Kare Nikolaisen (Bergischer HC) erhält eine 2 Minuten Strafe.,Hannover-Burgdorf,Bergischer HC,0,0,0,0,0,1,1,0
23:43,9:10,"Neuer Spielstand in Hannover, 9:10 durch den Treffer 6M von Lukas Stutzke für Bergischer HC.",Hannover-Burgdorf,Bergischer HC,0,0,0,0,0,0,0,0
23:28,,Zeitstrafe vorbei Hannover-Burgdorf,Hannover-Burgdorf,Bergischer HC,0,0,0,0,1,0,0,0
23:10,,Siebter Spieler eingewechselt Hannover-Burgdorf,Hannover-Burgdorf,Bergischer HC,0,0,1,0,1,0,0,0
23:02,9:09,Tor! Frederik Ladefoged (Bergischer HC) netzt ein zum neuen Spielstand von 9:9.,Hannover-Burgdorf,Bergischer HC,0,0,0,0,1,0,0,0
22:31,,"Parade des Torwarts von Bergischer HC, Christopher Rudeck.",Hannover-Burgdorf,Bergischer HC,0,0,0,0,1,0,0,0
21:49,,Siebter Spieler eingewechselt Hannover-Burgdorf,Hannover-Burgdorf,Bergischer HC,0,0,1,0,1,0,0,0
21:38,,Frederik Ladefoged (Bergischer HC) scheitert am Torwart Dario Quenstedt (Hannover-Burgdorf).,Hannover-Burgdorf,Bergischer HC,0,0,0,0,1,0,0,0
21:26,,Es gibt eine 2 Minuten Strafe für Ilija Brozovic (Hannover-Burgdorf).,Hannover-Burgdorf,Bergischer HC,0,0,0,0,1,0,0,1
20:10,9:08,9:08:00 Marius Steinhauser (Hannover-Burgdorf) trifft von (RA). Neuer Spielstand in ZAG Arena: 9:8.,Hannover-Burgdorf,Bergischer HC,0,0,0,0,0,0,0,0
19:57,,"Der Torwart von Hannover-Burgdorf, Dario Quenstedt pariert den Wurf.",Hannover-Burgdorf,Bergischer HC,0,0,0,0,0,0,0,0
19:42,8:08,Linus Arnesson (Bergischer HC) trifft zum Spielstand von 8:8 in ZAG Arena.,Hannover-Burgdorf,Bergischer HC,0,0,0,0,0,0,0,0
19:17,,Auszeit Bergischer HC,Hannover-Burgdorf,Bergischer HC,0,1,0,0,0,0,0,0
19:07,,"Der Torwart von Bergischer HC, Christopher Rudeck hält den Wurf von Renars Uscins.",Hannover-Burgdorf,Bergischer HC,0,0,0,0,0,0,0,0
18:20,,Arnor Thor Gunnarsson (Bergischer HC) überwindet den Torwart von (RA) zum neuen Spielstand von 7:6.,Hannover-Burgdorf,Bergischer HC,0,0,0,0,0,0,0,0
18:09,,Parade von Torwart Christopher Rudeck (Bergischer HC).,Hannover-Burgdorf,Bergischer HC,0,0,0,0,0,0,0,0
17:02,8:07,Dario Quenstedt (Hannover-Burgdorf) mit einer Parade.,Hannover-Burgdorf,Bergischer HC,0,0,0,0,0,0,0,0
15:50,8:06,Uladzislau Kulesh (Hannover-Burgdorf) überwindet den Torwart zum neuen Spielstand von 8:6.,Hannover-Burgdorf,Bergischer HC,0,0,0,0,0,0,0,0
14:55,7:06,Tor (RA)! Arnor Thor Gunnarsson (Bergischer HC) netzt ein zum neuen Spielstand von 7:6.,Hannover-Burgdorf,Bergischer HC,0,0,0,0,0,0,0,0
14:43,,Marian Michalczik von Hannover-Burgdorf unterläuft ein technischer Fehler. Der Ballbesitz wechselt.,Hannover-Burgdorf,Bergischer HC,0,0,0,0,0,0,0,0
14:04,,"Torwurf von Lukas Stutzke (Bergischer HC), aber der Ball trifft nur die Latte.",Hannover-Burgdorf,Bergischer HC,0,0,0,0,0,0,0,0
13:12,,Marian Michalczik von Hannover-Burgdorf wurde mit der Gelben Karte von Kolb/Kauth verwarnt.,Hannover-Burgdorf,Bergischer HC,0,0,0,0,0,0,0,0
12:52,,Überragende Parade des Torwarts Christopher Rudeck (Bergischer HC)! Justus Fischer kann den Ball nicht im Tor unterbringen!,Hannover-Burgdorf,Bergischer HC,0,0,0,0,0,0,0,0
12:15,,Tomas Babak von Bergischer HC unterläuft ein technischer Fehler. Der Ballbesitz wechselt.,Hannover-Burgdorf,Bergischer HC,0,0,0,0,0,0,0,0
11:33,,Dario Quenstedt (Hannover-Burgdorf) mit einer Parade.,Hannover-Burgdorf,Bergischer HC,0,0,0,0,0,0,0,0
10:54,7:05,Marius Steinhauser (Hannover-Burgdorf) trifft von der 7-Meter Linie.,Hannover-Burgdorf,Bergischer HC,0,0,0,0,0,0,0,0
10:37,,Es gibt Gelb für Linus Arnesson (Bergischer HC) von Kolb/Kauth.,Hannover-Burgdorf,Bergischer HC,0,0,0,0,0,0,0,0
9:43,6:05,"Tor von der 7-Meter Linie von Linus Arnesson (Bergischer HC), neuer Spielstand 6:5.",Hannover-Burgdorf,Bergischer HC,0,0,0,0,0,0,0,0
9:28,6:04,"Neuer Spielstand in Hannover, 6:4 durch den Treffer von Marius Steinhauser für Hannover-Burgdorf.",Hannover-Burgdorf,Bergischer HC,0,0,0,0,0,0,0,0
8:54,5:04,"Neuer Spielstand in Hannover, 5:4 durch den Treffer 6M von Uladzislau Kulesh für Hannover-Burgdorf.",Hannover-Burgdorf,Bergischer HC,0,0,0,0,0,0,0,0
7:36,4:04,Tomas Babak (Bergischer HC) trifft zum Spielstand von 4:4 in ZAG Arena.,Hannover-Burgdorf,Bergischer HC,0,0,0,0,0,0,0,0
7:24,,Hannes Feise von Hannover-Burgdorf unterläuft ein technischer Fehler. Der Ballbesitz wechselt.,Hannover-Burgdorf,Bergischer HC,0,0,0,0,0,0,0,0
6:48,4:03,Djibril M'Bengue (Bergischer HC) überwindet den Torwart von (6M) zum neuen Spielstand von 4:3.,Hannover-Burgdorf,Bergischer HC,0,0,0,0,0,0,0,0
6:05,4:02,"Neuer Spielstand in Hannover, 4:2 durch den Treffer 6M von Ilija Brozovic für Hannover-Burgdorf.",Hannover-Burgdorf,Bergischer HC,0,0,0,0,0,0,0,0
4:49,,Maximilian Gerbl (Hannover-Burgdorf) vergibt den 7-Meter.,Hannover-Burgdorf,Bergischer HC,0,0,0,0,0,0,0,0
3:44,,Zeitstrafe vorbei Bergischer HC.,Hannover-Burgdorf,Bergischer HC,0,0,0,0,0,1,0,0
3:14,,Siebter Spieler eingewechselt Bergischer HC.,Hannover-Burgdorf,Bergischer HC,0,0,0,1,0,1,0,0
3:02,3:02,Ilija Brozovic (Hannover-Burgdorf) überwindet den Torwart zum neuen Spielstand von 3:2.,Hannover-Burgdorf,Bergischer HC,0,0,0,0,0,1,0,0
2:48,2:02,Tomas Babak (Bergischer HC) trifft von (6M). Neuer Spielstand in ZAG Arena: 2:2.,Hannover-Burgdorf,Bergischer HC,0,0,0,0,0,1,0,0
2:15,,Der Wurf von Renars Uscins (Hannover-Burgdorf) landet hinter dem Tor.,Hannover-Burgdorf,Bergischer HC,0,0,0,0,0,1,0,0
2:01,2:01,"Neuer Spielstand in Hannover, 2:1 durch den Treffer von Renars Uscins für Hannover-Burgdorf.",Hannover-Burgdorf,Bergischer HC,0,0,0,0,0,1,0,0
1:47,,Frederik Ladefoged (Bergischer HC) erhält eine Zeitstrafe und hat nun zwei Minuten Zeit sich auf der Bank zu beruhigen.,Hannover-Burgdorf,Bergischer HC,0,0,0,0,0,1,1,0
1:44,,Siebter Spieler eingewechselt Bergischer HC.,Hannover-Burgdorf,Bergischer HC,0,0,0,1,0,0,0,0
1:39,1:01,Tor! Frederik Ladefoged (Bergischer HC) netzt ein zum neuen Spielstand von 1:1.,Hannover-Burgdorf,Bergischer HC,0,0,0,0,0,0,0,0
0:59,1:00,Tor (RM/fern)! Uladzislau Kulesh (Hannover-Burgdorf) netzt ein zum neuen Spielstand von 1:0.,Hannover-Burgdorf,Bergischer HC,0,0,0,0,0,0,0,0