,Time,Score,Event.Description,Hometeam,Awayteam,Timeout_Hometeam,Timeout_Awayteam,SeventhPlayer_Hometeam,SeventhPlayer_Awayteam,SixthPlayer_Hometeam,SixthPlayer_Awayteam,Penalty_Awayteam,Penalty_Hometeam
1,60:00:00,,Parade von Torwart Klemen Ferlin (HC Erlangen).,Hannover-Burgdorf,HC Erlangen,0,0,0,0,0,0,0,0
2,59:54:00,,Auszeit Hannover-Burgdorf,Hannover-Burgdorf,HC Erlangen,1,0,0,0,0,0,0,0
3,59:21:00,,"Parade des Torwarts von HC Erlangen, Klemen Ferlin.",Hannover-Burgdorf,HC Erlangen,0,0,0,0,0,0,0,0
4,58:51:00,29:28:00,Christoph Steinert (HC Erlangen) trifft von der 7-Meter Linie.,Hannover-Burgdorf,HC Erlangen,0,0,0,0,0,0,0,0
5,58:41:00,,"Der Torwart von Hannover-Burgdorf, Dario Quenstedt hält den Wurf von Lutz Heiny.",Hannover-Burgdorf,HC Erlangen,0,0,0,0,0,0,0,0
6,58:06:00,,Auszeit HC Erlangen,Hannover-Burgdorf,HC Erlangen,0,1,0,0,0,0,0,0
7,58:01:00,,Der Wurf von HC Erlangen wurde geblockt.,Hannover-Burgdorf,HC Erlangen,0,0,0,0,0,0,0,0
8,57:52:00,29:27:00,"Neuer Spielstand in Hannover, 29:27 durch den Treffer 6M von Renars Uscins für Hannover-Burgdorf.",Hannover-Burgdorf,HC Erlangen,0,0,0,0,0,0,0,0
9,57:19:00,28:27:00,"Tor von der 7-Meter Linie von Christoph Steinert (HC Erlangen), neuer Spielstand 28:27.",Hannover-Burgdorf,HC Erlangen,0,0,0,0,0,0,0,0
10,56:59:00,28:26:00,Marian Michalczik (Hannover-Burgdorf) trifft zum Spielstand von 28:26 in ZAG Arena.,Hannover-Burgdorf,HC Erlangen,0,0,0,0,0,0,0,0
11,55:48:00,,"Antonio Metzner wirft auf das Tor, trifft aber nur den Pfosten.",Hannover-Burgdorf,HC Erlangen,0,0,0,0,0,0,0,0
12,55:08:00,27:26:00,Tor! Marian Michalczik (Hannover-Burgdorf) netzt ein zum neuen Spielstand von 27:26.,Hannover-Burgdorf,HC Erlangen,0,0,0,0,0,0,0,0
13,54:09:00,26:26:00,Tor! Tim Zechel (HC Erlangen) netzt ein zum neuen Spielstand von 26:26.,Hannover-Burgdorf,HC Erlangen,0,0,0,0,0,0,0,0
14,53:25:00,,Parade von Torwart Klemen Ferlin (HC Erlangen).,Hannover-Burgdorf,HC Erlangen,0,0,0,0,0,0,0,0
15,52:52:00,,"Parade des Torwarts von Hannover-Burgdorf, Dario Quenstedt.",Hannover-Burgdorf,HC Erlangen,0,0,0,0,0,0,0,0
16,52:26:00,,Überragende Parade des Torwarts Dario Quenstedt (Hannover-Burgdorf)! Johannes Sellin kann den Ball nicht im Tor unterbringen!,Hannover-Burgdorf,HC Erlangen,0,0,0,0,0,0,0,0
17,51:57:00,26:25:00,"Neuer Spielstand in Hannover, 26:25 durch den Treffer 6M von Ilija Brozovic für Hannover-Burgdorf.",Hannover-Burgdorf,HC Erlangen,0,0,0,0,0,0,0,0
18,51:20:00,,Sebastian Firnhaber (HC Erlangen) scheitert am Torwart Dario Quenstedt (Hannover-Burgdorf).,Hannover-Burgdorf,HC Erlangen,0,0,0,0,0,0,0,0
19,50:41:00,25:25:00,Tor (6M)! Antonio Metzner (HC Erlangen) netzt ein zum neuen Spielstand von 25:25.,Hannover-Burgdorf,HC Erlangen,0,0,0,0,0,0,0,0
20,50:00:00,25:24:00,Jonathan Edvardsson (Hannover-Burgdorf) überwindet den Torwart von (6M) zum neuen Spielstand von 25:24.,Hannover-Burgdorf,HC Erlangen,0,0,0,0,0,0,0,0
21,49:46:00,,Zeitstrafe vorbei HC Erlangen,Hannover-Burgdorf,HC Erlangen,0,0,0,0,0,1,0,0
22,49:42:00,24:24:00,"Neuer Spielstand in Hannover, 24:24 durch den Treffer von Simon Jeppsson für HC Erlangen.",Hannover-Burgdorf,HC Erlangen,0,0,0,0,0,1,0,0
23,49:10:00,,Siebter Spieler eingewechselt HC Erlangen,Hannover-Burgdorf,HC Erlangen,0,0,0,1,0,1,0,0
24,48:59:00,,"Gute Torchance, aber Marian Michalczik (Hannover-Burgdorf) kann diese nicht erfolgreich verwandeln.",Hannover-Burgdorf,HC Erlangen,0,0,0,0,0,1,0,0
25,48:30:00,,Lutz Heiny von HC Erlangen unterläuft ein technischer Fehler. Der Ballbesitz wechselt.,Hannover-Burgdorf,HC Erlangen,0,0,0,0,0,1,0,0
26,48:05:00,,Siebter Spieler eingewechselt HC Erlangen,Hannover-Burgdorf,HC Erlangen,0,0,0,1,0,1,0,0
27,47:57:00,24:23:00,Ilija Brozovic (Hannover-Burgdorf) trifft von (6M). Neuer Spielstand in ZAG Arena: 24:23.,Hannover-Burgdorf,HC Erlangen,0,0,0,0,0,1,0,0
28,47:43:00,,Steffen Fäth (HC Erlangen) erhält eine Zeitstrafe und hat nun zwei Minuten Zeit sich auf der Bank zu beruhigen.,Hannover-Burgdorf,HC Erlangen,0,0,0,0,0,1,1,0
29,46:42:00,23:23,Christopher Bissel (HC Erlangen) trifft zum Spielstand von 23:23 in ZAG Arena.,Hannover-Burgdorf,HC Erlangen,0,0,0,0,0,0,0,0
30,46:01:00,23:22,Der 7-Meter wurde von Christoph Steinert (HC Erlangen) erfolgreich verwandelt.,Hannover-Burgdorf,HC Erlangen,0,0,0,0,0,0,0,0
31,45:21:00,,Zeitstrafe vorbei HC Erlangen,Hannover-Burgdorf,HC Erlangen,0,0,0,0,0,1,0,0
32,45:08:00,,Veit Mävers (Hannover-Burgdorf) scheitert von der 7-Meter Linie.,Hannover-Burgdorf,HC Erlangen,0,0,0,0,0,1,0,0
33,45:08:00,23:21,Maximilian Gerbl (Hannover-Burgdorf) überwindet den Torwart zum neuen Spielstand von 23:21.,Hannover-Burgdorf,HC Erlangen,0,0,0,0,0,1,0,0
34,44:51:00,,Zeitstrafe vorbei HC Erlangen,Hannover-Burgdorf,HC Erlangen,0,0,0,0,0,1,0,0
35,44:32:00,,Siebter Spieler eingewechselt HC Erlangen,Hannover-Burgdorf,HC Erlangen,0,0,0,1,0,1,0,0
36,44:20:00,,Der 7-Meter von Veit Mävers (Hannover-Burgdorf) landet nicht im Tor.,Hannover-Burgdorf,HC Erlangen,0,0,0,0,0,1,0,0
37,44:04:00,22:21,Christoph Steinert (HC Erlangen) überwindet den Torwart von (6M) zum neuen Spielstand von 22:21.,Hannover-Burgdorf,HC Erlangen,0,0,0,0,0,1,0,0
38,44:01:00,,Der Strafwurf von Christoph Steinert wurde von Dario Quenstedt (Hannover-Burgdorf) gehalten.,Hannover-Burgdorf,HC Erlangen,0,0,0,0,0,1,0,0
39,43:10:00,,Siebter Spieler eingewechselt HC Erlangen,Hannover-Burgdorf,HC Erlangen,0,0,0,1,0,1,0,0
40,43:02:00,22:20,"Neuer Spielstand in Hannover, 22:20 durch den Treffer LA von Hannes Feise für Hannover-Burgdorf.",Hannover-Burgdorf,HC Erlangen,0,0,0,0,0,1,0,0
41,42:47:00,,"Der disqualifizierte Nico Büdel muss das Spielfeld verlassen, aber HC Erlangen wird nach 2 Minuten...",Hannover-Burgdorf,HC Erlangen,0,0,0,0,0,1,1,0
42,42:47:00,,Nico Büdel (HC Erlangen) erhält eine 2 Minuten Strafe.,Hannover-Burgdorf,HC Erlangen,0,0,0,0,0,1,1,0
43,42:15:00,21:20,Sebastian Firnhaber (HC Erlangen) überwindet den Torwart zum neuen Spielstand von 21:20.,Hannover-Burgdorf,HC Erlangen,0,0,0,0,0,0,0,0
44,41:43:00,21:19,Maximilian Gerbl (Hannover-Burgdorf) trifft von der 7-Meter Linie.,Hannover-Burgdorf,HC Erlangen,0,0,0,0,0,0,0,0
45,41:05:00,20:19,Tor (6M)! Tim Zechel (HC Erlangen) netzt ein zum neuen Spielstand von 20:19.,Hannover-Burgdorf,HC Erlangen,0,0,0,0,0,0,0,0
46,40:50:00,,Klemen Ferlin (HC Erlangen) mit einer Parade.,Hannover-Burgdorf,HC Erlangen,0,0,0,0,0,0,0,0
47,40:38:00,,Der Wurf von Tim Zechel (HC Erlangen) landet hinter dem Tor.,Hannover-Burgdorf,HC Erlangen,0,0,0,0,0,0,0,0
48,40:14:00,,Klemen Ferlin (HC Erlangen) mit einer Parade.,Hannover-Burgdorf,HC Erlangen,0,0,0,0,0,0,0,0
49,39:50:00,,Auszeit Hannover-Burgdorf.,Hannover-Burgdorf,HC Erlangen,1,0,0,0,0,0,0,0
50,38:52:00,,Der eingewechselte Torwart Dario Quenstedt (Hannover-Burgdorf) steht nun zwischen den Pfosten.,Hannover-Burgdorf,HC Erlangen,0,0,0,0,0,0,0,0
51,38:39:00,20:18,Lutz Heiny (HC Erlangen) trifft von (6M). Neuer Spielstand in ZAG Arena: 20:18.,Hannover-Burgdorf,HC Erlangen,0,0,0,0,0,0,0,0
52,37:52:00,20:17,Tor! Branko Vujovic (Hannover-Burgdorf) netzt ein zum neuen Spielstand von 20:17.,Hannover-Burgdorf,HC Erlangen,0,0,0,0,0,0,0,0
53,37:45:00,19:17,"Neuer Spielstand in Hannover, 19:17 durch den Treffer von Christopher Bissel für HC Erlangen.",Hannover-Burgdorf,HC Erlangen,0,0,0,0,0,0,0,0
54,37:02:00,19:16,Lutz Heiny (HC Erlangen) trifft zum Spielstand von 19:16 in ZAG Arena.,Hannover-Burgdorf,HC Erlangen,0,0,0,0,0,0,0,0
55,36:54:00,,"Der Torwart von Hannover-Burgdorf, Domenico Ebner hält den Wurf von Lutz Heiny.",Hannover-Burgdorf,HC Erlangen,0,0,0,0,0,0,0,0
56,36:50:00,,HC Erlangen wechselt den Torwart. Klemen Ferlin kommt für Bertram Obling.,Hannover-Burgdorf,HC Erlangen,0,0,0,0,0,0,0,0
57,36:29:00,19:15,Branko Vujovic (Hannover-Burgdorf) überwindet den Torwart zum neuen Spielstand von 19:15.,Hannover-Burgdorf,HC Erlangen,0,0,0,0,0,0,0,0
58,35:48:00,18:15,Christoph Steinert (HC Erlangen) überwindet den Torwart von (RA) zum neuen Spielstand von 18:15.,Hannover-Burgdorf,HC Erlangen,0,0,0,0,0,0,0,0
59,35:08:00,18:14,"Tor von der 7-Meter Linie von Maximilian Gerbl (Hannover-Burgdorf), neuer Spielstand 18:14.",Hannover-Burgdorf,HC Erlangen,0,0,0,0,0,0,0,0
60,34:41:00,17:14,"Neuer Spielstand in Hannover, 17:14 durch den Treffer von Christopher Bissel für HC Erlangen.",Hannover-Burgdorf,HC Erlangen,0,0,0,0,0,0,0,0
61,34:27:00,,"Gute Torchance, aber Branko Vujovic (Hannover-Burgdorf) kann diese nicht erfolgreich verwandeln.",Hannover-Burgdorf,HC Erlangen,0,0,0,0,0,0,0,0
62,33:31:00,17:13,"Neuer Spielstand in Hannover, 17:13 durch den Treffer 6M von Lutz Heiny für HC Erlangen.",Hannover-Burgdorf,HC Erlangen,0,0,0,0,0,0,0,0
63,32:58:00,17:12,Marian Michalczik (Hannover-Burgdorf) trifft zum Spielstand von 17:12 in ZAG Arena.,Hannover-Burgdorf,HC Erlangen,0,0,0,0,0,0,0,0
64,32:48:00,16:12,Tor (6M)! Lutz Heiny (HC Erlangen) netzt ein zum neuen Spielstand von 16:12.,Hannover-Burgdorf,HC Erlangen,0,0,0,0,0,0,0,0
65,32:09:00,16:11,Tor! Hannes Feise (Hannover-Burgdorf) netzt ein zum neuen Spielstand von 16:11.,Hannover-Burgdorf,HC Erlangen,0,0,0,0,0,0,0,0
66,31:48:00,,"Wurf von Antonio Metzner (HC Erlangen), aber der Ball landet nur am Pfosten.",Hannover-Burgdorf,HC Erlangen,0,0,0,0,0,0,0,0
67,31:12:00,15:11,Marian Michalczik (Hannover-Burgdorf) trifft von (6M). Neuer Spielstand in ZAG Arena: 15:11.,Hannover-Burgdorf,HC Erlangen,0,0,0,0,0,0,0,0
68,,14:11,HALBZEIT (14:11),Hannover-Burgdorf,HC Erlangen,0,0,0,0,0,0,0,0
69,29:46:00,14:11,Steffen Fäth (HC Erlangen) trifft zum Spielstand von 14:11 in ZAG Arena.,Hannover-Burgdorf,HC Erlangen,0,0,0,0,0,0,0,0
70,29:04:00,,"Torwurf von Hannes Feise (Hannover-Burgdorf), aber der Ball trifft nur die Latte.",Hannover-Burgdorf,HC Erlangen,0,0,0,0,0,0,0,0
71,28:31:00,14:10,Tor! Christopher Bissel (HC Erlangen) netzt ein zum neuen Spielstand von 14:10.,Hannover-Burgdorf,HC Erlangen,0,0,0,0,0,0,0,0
72,28:30:00,,Zeitstrafe vorbei HC Erlangen,Hannover-Burgdorf,HC Erlangen,0,0,0,0,0,1,0,0
73,28:21:00,,Domenico Ebner (Hannover-Burgdorf) hält den Wurf von Antonio Metzner.,Hannover-Burgdorf,HC Erlangen,0,0,0,0,0,1,0,0
74,27:54:00,,Siebter Spieler eingewechselt HC Erlangen,Hannover-Burgdorf,HC Erlangen,0,0,0,1,0,1,0,0
75,27:41:00,,"Der Torwart von HC Erlangen, Bertram Obling pariert den Wurf.",Hannover-Burgdorf,HC Erlangen,0,0,0,0,0,1,0,0
76,27:25:00,14:09,Tor (RA)! Christoph Steinert (HC Erlangen) netzt ein zum neuen Spielstand von 14:9.,Hannover-Burgdorf,HC Erlangen,0,0,0,0,0,1,0,0
77,26:31:00,,Siebter Spieler eingewechselt HC Erlangen,Hannover-Burgdorf,HC Erlangen,0,0,0,1,0,1,0,0
78,26:19:00,,Maximilian Gerbl (Hannover-Burgdorf) vergibt den 7-Meter.,Hannover-Burgdorf,HC Erlangen,0,0,0,0,0,1,0,0
79,26:14:00,,"Nach einem harten Foul hat Tim Zechel (HC Erlangen) nun zwei Minuten Zeit, um sich auszuruhen.",Hannover-Burgdorf,HC Erlangen,0,0,0,0,0,1,1,0
80,25:32:00,,Auszeit Hannover-Burgdorf,Hannover-Burgdorf,HC Erlangen,1,0,0,0,0,0,0,0
81,25:28:00,,Sebastian Firnhaber (HC Erlangen) überwindet den Torwart zum neuen Spielstand von 14:8.,Hannover-Burgdorf,HC Erlangen,0,0,0,0,0,0,0,0
82,24:17:00,14:08,Christopher Bissel (HC Erlangen) überwindet den Torwart von (LA) zum neuen Spielstand von 14:7.,Hannover-Burgdorf,HC Erlangen,0,0,0,0,0,0,0,0
83,23:26,14:07,Renars Uscins (Hannover-Burgdorf) trifft von (6M). Neuer Spielstand in ZAG Arena: 14:6.,Hannover-Burgdorf,HC Erlangen,0,0,0,0,0,0,0,0
84,23:26,14:06,"Neuer Spielstand in Hannover, 13:6 durch den Treffer von Antonio Metzner für HC Erlangen.",Hannover-Burgdorf,HC Erlangen,0,0,0,0,0,0,0,0
85,22:52,13:06,"Neuer Spielstand in Hannover, 13:5 durch den Treffer 6M von Veit Mävers für Hannover-Burgdorf.",Hannover-Burgdorf,HC Erlangen,0,0,0,0,0,0,0,0
86,22:52,,Zeitstrafe vorbei Hannover-Burgdorf,Hannover-Burgdorf,HC Erlangen,0,0,0,0,1,0,0,0
87,21:34,,Auszeit HC Erlangen,Hannover-Burgdorf,HC Erlangen,0,1,0,0,1,0,0,0
88,21:34,12:05,Vincent Büchner (Hannover-Burgdorf) trifft zum Spielstand von 12:5 in ZAG Arena.,Hannover-Burgdorf,HC Erlangen,0,0,0,0,1,0,0,0
89,21:09,11:05,Renars Uscins (Hannover-Burgdorf) überwindet den Torwart zum neuen Spielstand von 11:5.,Hannover-Burgdorf,HC Erlangen,0,0,0,0,1,0,0,0
90,20:06,,"Chance für Steffen Fäth (HC Erlangen), er trifft aber nur den Pfosten.",Hannover-Burgdorf,HC Erlangen,0,0,0,0,1,0,0,0
91,20:06,,Es gibt eine 2 Minuten Strafe für Justus Fischer (Hannover-Burgdorf).,Hannover-Burgdorf,HC Erlangen,0,0,0,0,1,0,0,1
92,19:53,,Domenico Ebner (Hannover-Burgdorf) mit einer Parade.,Hannover-Burgdorf,HC Erlangen,0,0,0,0,0,0,0,0
93,19:14,,Renars Uscins von Hannover-Burgdorf unterläuft ein technischer Fehler. Der Ballbesitz wechselt.,Hannover-Burgdorf,HC Erlangen,0,0,0,0,0,0,0,0
94,18:29,10:05,Christoph Steinert (HC Erlangen) trifft von der 7-Meter Linie und bringt den Spielstand auf 10:5.,Hannover-Burgdorf,HC Erlangen,0,0,0,0,0,0,0,0
95,18:26,,Es gibt Gelb für Raúl Alonso (HC Erlangen) von Tonnies/Schulze.,Hannover-Burgdorf,HC Erlangen,0,0,0,0,0,0,0,0
96,18:10,,Zeitstrafe vorbei HC Erlangen,Hannover-Burgdorf,HC Erlangen,0,0,0,0,0,1,0,0
97,18:02,,Siebter Spieler eingewechselt HC Erlangen,Hannover-Burgdorf,HC Erlangen,0,0,0,1,0,1,0,0
98,17:54,10:04,Marian Michalczik (Hannover-Burgdorf) trifft von (6M). Neuer Spielstand in ZAG Arena: 10:4.,Hannover-Burgdorf,HC Erlangen,0,0,0,0,0,1,0,0
99,17:30,,"Parade des Torwarts von Hannover-Burgdorf, Domenico Ebner.",Hannover-Burgdorf,HC Erlangen,0,0,0,0,0,1,0,0
100,16:55,,Domenico Ebner (Hannover-Burgdorf) hält den Wurf von Johannes Sellin.,Hannover-Burgdorf,HC Erlangen,0,0,0,0,0,1,0,0
101,16:32,,Siebter Spieler eingewechselt HC Erlangen,Hannover-Burgdorf,HC Erlangen,0,0,0,1,0,1,0,0
102,16:23,9:04,Tor! Maximilian Gerbl (Hannover-Burgdorf) netzt ein zum neuen Spielstand von 9:4.,Hannover-Burgdorf,HC Erlangen,0,0,0,0,0,1,0,0
103,16:07,,Nico Büdel (HC Erlangen) erhält wegen eines Regelverstoßes eine 2 Minuten Strafe.,Hannover-Burgdorf,HC Erlangen,0,0,0,0,0,1,1,0
104,15:10,8:04,Simon Jeppsson (HC Erlangen) überwindet den Torwart von (6M) zum neuen Spielstand von 8:4.,Hannover-Burgdorf,HC Erlangen,0,0,0,0,0,0,0,0
105,15:05,,"Der Trainer von HC Erlangen, Raúl Alonso stellt nun Bertram Obling zwischen die Pfosten.",Hannover-Burgdorf,HC Erlangen,0,0,0,0,0,0,0,0
106,14:28,,Tim Zechel von HC Erlangen unterläuft ein technischer Fehler. Der Ballbesitz wechselt.,Hannover-Burgdorf,HC Erlangen,0,0,0,0,0,0,0,0
107,14:02,8:03,Tor (6M)! Vincent Büchner (Hannover-Burgdorf) netzt ein zum neuen Spielstand von 8:3.,Hannover-Burgdorf,HC Erlangen,0,0,0,0,0,0,0,0
108,13:54,,Parade von Torwart Domenico Ebner (Hannover-Burgdorf).,Hannover-Burgdorf,HC Erlangen,0,0,0,0,0,0,0,0
109,13:22,,Ilija Brozovic von Hannover-Burgdorf unterläuft ein technischer Fehler. Der Ballbesitz wechselt.,Hannover-Burgdorf,HC Erlangen,0,0,0,0,0,0,0,0
110,12:40,7:03,"Neuer Spielstand in Hannover, 7:3 durch den Treffer 6M von Antonio Metzner für HC Erlangen.",Hannover-Burgdorf,HC Erlangen,0,0,0,0,0,0,0,0
111,12:25,7:02,"Neuer Spielstand in Hannover, 7:2 durch den Treffer von Jonathan Edvardsson für Hannover-Burgdorf.",Hannover-Burgdorf,HC Erlangen,0,0,0,0,0,0,0,0
112,11:50,,Simon Jeppsson (HC Erlangen) scheitert am Torwart Domenico Ebner (Hannover-Burgdorf).,Hannover-Burgdorf,HC Erlangen,0,0,0,0,0,0,0,0
113,11:24,,Auszeit HC Erlangen,Hannover-Burgdorf,HC Erlangen,0,1,0,0,0,0,0,0
114,11:24,6:02,Maximilian Gerbl (Hannover-Burgdorf) trifft von (6M). Neuer Spielstand in ZAG Arena: 6:2.,Hannover-Burgdorf,HC Erlangen,0,0,0,0,0,0,0,0
115,10:44,,Tim Zechel von HC Erlangen unterläuft ein technischer Fehler. Der Ballbesitz wechselt.,Hannover-Burgdorf,HC Erlangen,0,0,0,0,0,1,0,0
116,10:10,,Siebter Spieler eingewechselt HC Erlangen,Hannover-Burgdorf,HC Erlangen,0,0,0,1,0,1,0,0
117,10:00,5:02,Ilija Brozovic (Hannover-Burgdorf) trifft zum Spielstand von 5:2 in ZAG Arena.,Hannover-Burgdorf,HC Erlangen,0,0,0,0,0,1,0,0
118,9:40,,"Der Torwart von Hannover-Burgdorf, Domenico Ebner hält den Wurf von Antonio Metzner.",Hannover-Burgdorf,HC Erlangen,0,0,0,0,0,1,0,0
119,9:02,,Siebter Spieler eingewechselt HC Erlangen,Hannover-Burgdorf,HC Erlangen,0,0,0,1,0,1,0,0
120,8:52,4:02,"Neuer Spielstand in Hannover, 4:2 durch den Treffer 6M von Ilija Brozovic für Hannover-Burgdorf.",Hannover-Burgdorf,HC Erlangen,0,0,0,0,0,1,0,0
121,8:31,,Sebastian Firnhaber (HC Erlangen) erhält eine Zeitstrafe und hat nun zwei Minuten Zeit sich auf der Bank zu beruhigen.,Hannover-Burgdorf,HC Erlangen,0,0,0,0,0,1,1,0
122,7:40,,Fehlwurf von Johannes Sellin (HC Erlangen).,Hannover-Burgdorf,HC Erlangen,0,0,0,0,0,0,0,0
123,7:21,,Zeitstrafe vorbei HC Erlangen,Hannover-Burgdorf,HC Erlangen,0,0,0,0,0,1,0,0
124,7:15,,Siebter Spieler eingewechselt HC Erlangen,Hannover-Burgdorf,HC Erlangen,0,0,0,1,0,1,0,0
125,7:03,3:02,Tor! Ilija Brozovic (Hannover-Burgdorf) netzt ein zum neuen Spielstand von 3:2.,Hannover-Burgdorf,HC Erlangen,0,0,0,0,0,1,0,0
126,6:41,,Zeitstrafe vorbei Hannover-Burgdorf,Hannover-Burgdorf,HC Erlangen,0,0,0,0,1,1,0,0
127,6:41,2:02,Steffen Fäth (HC Erlangen) überwindet den Torwart zum neuen Spielstand von 2:2.,Hannover-Burgdorf,HC Erlangen,0,0,0,0,1,1,0,0
128,6:24,,Siebter Spieler eingewechselt HC Erlangen,Hannover-Burgdorf,HC Erlangen,0,0,0,1,1,1,0,0
129,6:15,2:01,Maximilian Gerbl (Hannover-Burgdorf) überwindet den Torwart von (RA) zum neuen Spielstand von 2:1.,Hannover-Burgdorf,HC Erlangen,0,0,0,0,1,1,0,0
130,5:21,,Nico Büdel geht den Gegner zu stark an. HC Erlangen muss nun die nächsten zwei Minuten mit einem Spieler weniger auskommen.,Hannover-Burgdorf,HC Erlangen,0,0,0,0,1,1,1,0
131,4:55,,Siebter Spieler eingewechselt Hannover-Burgdorf,Hannover-Burgdorf,HC Erlangen,0,0,1,0,1,0,0,0
132,4:44,,Simon Jeppsson von HC Erlangen unterläuft ein technischer Fehler. Der Ballbesitz wechselt.,Hannover-Burgdorf,HC Erlangen,0,0,0,0,1,0,0,0
133,4:31,,2-Minuten-Strafe für Marian Michalczik. Hannover-Burgdorf muss nun die nächsten zwei Minuten mit einem Spieler weniger auskommen.,Hannover-Burgdorf,HC Erlangen,0,0,0,0,1,0,0,1
134,3:27,,Domenico Ebner (Hannover-Burgdorf) mit einer Parade.,Hannover-Burgdorf,HC Erlangen,0,0,0,0,0,0,0,0
135,2:41,,"Der Torwart von Hannover-Burgdorf, Domenico Ebner pariert den Wurf.",Hannover-Burgdorf,HC Erlangen,0,0,0,0,0,0,0,0
136,2:35,,Überragende Parade des Torwarts Domenico Ebner (Hannover-Burgdorf)! Johannes Sellin kann den Ball nicht im Tor unterbringen!,Hannover-Burgdorf,HC Erlangen,0,0,0,0,0,0,0,0
137,1:58,1:01,"Neuer Spielstand in Hannover, 1:1 durch den Treffer von Jonathan Edvardsson für Hannover-Burgdorf.",Hannover-Burgdorf,HC Erlangen,0,0,0,0,0,0,0,0
138,0:01,1:48,Tor (6M)! Antonio Metzner (HC Erlangen) netzt ein zum neuen Spielstand von 0:1.,Hannover-Burgdorf,HC Erlangen,0,0,0,0,0,0,0,0
139,0:43,,Tonnies/Schulze verwarnen Jonathan Edvardsson (Hannover-Burgdorf) mit einer Gelben Karte.,Hannover-Burgdorf,HC Erlangen,0,0,0,0,0,0,0,0