Time,Score,Event.Description,Hometeam,Awayteam,Timeout_Hometeam,Timeout_Awayteam,SeventhPlayer_Hometeam,SeventhPlayer_Awayteam,SixthPlayer_Hometeam,SixthPlayer_Awayteam,Penalty_Awayteam,Penalty_Hometeam
60:00:00,,Christopher Rudeck (Bergischer HC) mit einer Parade beim 7-Meter.,HSG Wetzlar,Bergischer HC,0,0,0,0,1,0,0,0
59:12:00,,Siebter Spieler eingewechselt HSG Wetzlar,HSG Wetzlar,Bergischer HC,0,0,1,0,1,0,0,0
59:07:00,22:28,Tobias Schmitz (Bergischer HC) überwindet den Torwart von (LA) zum neuen Spielstand von 22:28.,HSG Wetzlar,Bergischer HC,0,0,0,0,1,0,0,0
58:53:00,,Jovica Nikolic (HSG Wetzlar) erhält wegen eines Regelverstoßes eine 2 Minuten Strafe.,HSG Wetzlar,Bergischer HC,0,0,0,0,1,0,0,1
58:11:00,,"Der Torwart von Bergischer HC, Christopher Rudeck pariert den Wurf.",HSG Wetzlar,Bergischer HC,0,0,0,0,0,0,0,0
58:02:00,,Siebter Spieler eingewechselt HSG Wetzlar,HSG Wetzlar,Bergischer HC,0,0,1,0,0,0,0,0
57:45:00,,Lukas Stutzke von Bergischer HC unterläuft ein technischer Fehler. Der Ballbesitz wechselt.,HSG Wetzlar,Bergischer HC,0,0,0,0,0,0,0,0
57:25:00,,Der Wurf von Lenny Rubin (HSG Wetzlar) landet hinter dem Tor.,HSG Wetzlar,Bergischer HC,0,0,0,0,0,0,0,0
57:07:00,,Siebter Spieler eingewechselt HSG Wetzlar,HSG Wetzlar,Bergischer HC,0,0,1,0,0,0,0,0
56:49:00,22:27,Noah Beyer (Bergischer HC) trifft zum Spielstand von 22:27 in Buderus Arena Wetzlar.,HSG Wetzlar,Bergischer HC,0,0,0,0,0,0,0,0
56:28:00,,"Der Torwart von Bergischer HC, Christopher Rudeck pariert den gegebenen 7-Meter.",HSG Wetzlar,Bergischer HC,0,0,0,0,0,0,0,0
56:06:00,22:26,Lukas Stutzke (Bergischer HC) legt den Treffer von Isak Persson auf. Es steht 22:26.,HSG Wetzlar,Bergischer HC,0,0,0,0,0,0,0,0
55:35:00,,Auszeit Bergischer HC,HSG Wetzlar,Bergischer HC,0,1,0,0,0,0,0,0
55:08:00,,Frederik Ladefoged von Bergischer HC unterläuft ein technischer Fehler. Der Ballbesitz wechselt.,HSG Wetzlar,Bergischer HC,0,0,0,0,0,0,0,0
55:05:00,22:25,Tor für HSG Wetzlar durch Erik Schmidt nach einem Pass von Magnus Fredriksen.,HSG Wetzlar,Bergischer HC,0,0,0,0,0,0,0,0
54:24:00,,Christopher Rudeck (Bergischer HC) hält den Wurf von Domen Novak.,HSG Wetzlar,Bergischer HC,0,0,0,0,0,0,0,0
53:52:00,21:25,Tor! Noah Beyer (Bergischer HC) netzt ein zum neuen Spielstand von 21:25.,HSG Wetzlar,Bergischer HC,0,0,0,0,0,0,0,0
53:07:00,,Lenny Rubin (HSG Wetzlar) trifft die Latte.,HSG Wetzlar,Bergischer HC,0,0,0,0,0,0,0,0
52:15:00,,"Gute Torchance, aber Alexander Weck (Bergischer HC) kann diese nicht erfolgreich verwandeln.",HSG Wetzlar,Bergischer HC,0,0,0,0,0,0,0,0
51:46:00,21:24,"Neuer Spielstand in Wetzlar, 21:24 durch den Treffer von Lenny Rubin für HSG Wetzlar.",HSG Wetzlar,Bergischer HC,0,0,0,0,0,0,0,0
50:58:00,,Christopher Rudeck (Bergischer HC) mit einer Parade.,HSG Wetzlar,Bergischer HC,0,0,0,0,0,0,0,0
50:23:00,,Auszeit HSG Wetzlar,HSG Wetzlar,Bergischer HC,1,0,0,0,0,0,0,0
49:41:00,,Zeitstrafe vorbei HSG Wetzlar,HSG Wetzlar,Bergischer HC,0,0,0,0,1,0,0,0
49:38:00,20:24,Der 7-Meter wurde von Noah Beyer (Bergischer HC) erfolgreich verwandelt.,HSG Wetzlar,Bergischer HC,0,0,0,0,1,0,0,0
48:59:00,20:23,"Tor! Es war Lenny Rubin (HSG Wetzlar), der das Tor von Erik Schmidt vorbereitete.",HSG Wetzlar,Bergischer HC,0,0,0,0,1,0,0,0
48:15:00,,Zeitstrafe vorbei HSG Wetzlar,HSG Wetzlar,Bergischer HC,0,0,0,0,1,0,0,0
47:49:00,,Siebter Spieler eingewechselt HSG Wetzlar,HSG Wetzlar,Bergischer HC,0,0,1,0,1,0,0,0
47:44:00,19:22,Noah Beyer (Bergischer HC) trifft von der 7-Meter Linie und bringt den Spielstand auf 19:23.,HSG Wetzlar,Bergischer HC,0,0,0,0,1,0,0,0
47:40:00,,Domen Novak (HSG Wetzlar) erhält eine 2 Minuten Strafe.,HSG Wetzlar,Bergischer HC,0,0,0,0,1,0,0,1
47:12:00,19:22,Magnus Fredriksen (HSG Wetzlar) überwindet den Torwart zum neuen Spielstand von 19:22.,HSG Wetzlar,Bergischer HC,0,0,0,0,1,0,0,0
46:35:00,,Siebter Spieler eingewechselt HSG Wetzlar,HSG Wetzlar,Bergischer HC,0,0,1,0,1,0,0,0
46:27:00,,"Der Torwart von HSG Wetzlar, Anadin Suljakovic hält den Wurf von Isak Persson.",HSG Wetzlar,Bergischer HC,0,0,0,0,1,0,0,0
46:16:00,,2-Minuten-Strafe für Filip Kuzmanovski. HSG Wetzlar muss nun die nächsten zwei Minuten mit einem Spieler weniger auskommen.,HSG Wetzlar,Bergischer HC,0,0,0,0,1,0,0,1
45:44:00,,Lattenkracher von Stefan Cavor (HSG Wetzlar).,HSG Wetzlar,Bergischer HC,0,0,0,0,0,0,0,0
45:07:00,,Zeitstrafe vorbei Bergischer HC,HSG Wetzlar,Bergischer HC,0,0,0,0,0,1,0,0
45:05:00,,Zeitstrafe vorbei HSG Wetzlar,HSG Wetzlar,Bergischer HC,0,0,0,0,1,1,0,0
44:57:00,18:22,"Neuer Spielstand in Wetzlar, 18:22 durch den Treffer RA von Isak Persson für Bergischer HC.",HSG Wetzlar,Bergischer HC,0,0,0,0,1,1,0,0
44:41:00,,Siebter Spieler eingewechselt Bergischer HC,HSG Wetzlar,Bergischer HC,0,0,0,1,1,1,0,0
44:28:00,,Stefan Cavor (HSG Wetzlar) scheitert am Torwart Christopher Rudeck (Bergischer HC).,HSG Wetzlar,Bergischer HC,0,0,0,0,1,1,0,0
44:18:00,,Siebter Spieler eingewechselt HSG Wetzlar,HSG Wetzlar,Bergischer HC,0,0,1,0,1,1,0,0
44:13:00,18:21,Tor! Isak Persson (Bergischer HC) netzt ein zum neuen Spielstand von 18:21.,HSG Wetzlar,Bergischer HC,0,0,0,0,1,1,0,0
43:52:00,,Siebter Spieler eingewechselt Bergischer HC,HSG Wetzlar,Bergischer HC,0,0,0,1,1,1,0,0
43:48:00,,Zeitstrafe vorbei Bergischer HC,HSG Wetzlar,Bergischer HC,0,0,0,0,1,1,0,0
43:36:00,,Filip Kuzmanovski von HSG Wetzlar unterläuft ein technischer Fehler. Der Ballbesitz wechselt.,HSG Wetzlar,Bergischer HC,0,0,0,0,1,1,0,0
43:25:00,,Auszeit HSG Wetzlar,HSG Wetzlar,Bergischer HC,1,0,0,0,1,1,0,0
43:25:00,,Siebter Spieler eingewechselt HSG Wetzlar,HSG Wetzlar,Bergischer HC,0,0,1,0,1,1,0,0
43:25:00,,HSG Wetzlar wechselt den Torwart. Anadin Suljakovic kommt für Till Klimpke.,HSG Wetzlar,Bergischer HC,0,0,0,0,1,1,0,0
43:23:00,18:20,Noah Beyer (Bergischer HC) trifft von (LA). Neuer Spielstand in Buderus Arena Wetzlar: 18:20.,HSG Wetzlar,Bergischer HC,0,0,0,0,1,1,0,0
43:02:00,,Siebter Spieler eingewechselt Bergischer HC,HSG Wetzlar,Bergischer HC,0,0,0,1,1,1,0,0
43:02:00,,Jovica Nikolic (HSG Wetzlar) erhält eine Zeitstrafe und hat nun zwei Minuten Zeit sich auf der Bank zu beruhigen.,HSG Wetzlar,Bergischer HC,0,0,0,0,1,1,0,1
43:02:00,,Es gibt eine 2 Minuten Strafe für Frederik Ladefoged (Bergischer HC).,HSG Wetzlar,Bergischer HC,0,0,0,0,0,1,1,0
42:35:00,,Zeitstrafe vorbei Bergischer HC,HSG Wetzlar,Bergischer HC,0,0,0,0,0,1,0,0
42:15:00,,Siebter Spieler eingewechselt Bergischer HC,HSG Wetzlar,Bergischer HC,0,0,0,1,0,1,0,0
41:59:00,,Jonas Schelker von HSG Wetzlar unterläuft ein technischer Fehler. Der Ballbesitz wechselt.,HSG Wetzlar,Bergischer HC,0,0,0,0,0,1,0,0
41:44:00,18:19,"Neuer Spielstand in Wetzlar, 18:19 durch den Treffer von Lukas Stutzke für Bergischer HC.",HSG Wetzlar,Bergischer HC,0,0,0,0,0,1,0,0
41:41:00,,Siebter Spieler eingewechselt Bergischer HC,HSG Wetzlar,Bergischer HC,0,0,0,1,0,1,0,0
41:08:00,,Stefan Cavor von HSG Wetzlar unterläuft ein technischer Fehler. Der Ballbesitz wechselt.,HSG Wetzlar,Bergischer HC,0,0,0,0,0,1,0,0
40:52:00,,"Nach einem harten Foul hat Frederik Ladefoged (Bergischer HC) nun zwei Minuten Zeit, um sich auszuruhen.",HSG Wetzlar,Bergischer HC,0,0,0,0,0,1,1,0
40:30:00,,Lukas Stutzke von Bergischer HC unterläuft ein technischer Fehler. Der Ballbesitz wechselt.,HSG Wetzlar,Bergischer HC,0,0,0,0,0,0,0,0
39:52:00,,Domen Novak (HSG Wetzlar) verwandelt einen Tempogegenstoß.,HSG Wetzlar,Bergischer HC,0,0,0,0,0,0,0,0
38:56:00,,"Der Torwart von Bergischer HC, Christopher Rudeck pariert den Wurf.",HSG Wetzlar,Bergischer HC,0,0,0,0,0,0,0,0
38:37:00,,Der Wurfversuch von Hendrik Wagner (HSG Wetzlar) wurde durch einen Block von Frederik Ladefoged verhindert.,HSG Wetzlar,Bergischer HC,0,0,0,0,0,0,0,0
38:03:00,17:18,Alexander Weck (Bergischer HC) überwindet den Torwart von (RM/fern) zum neuen Spielstand von 17:18.,HSG Wetzlar,Bergischer HC,0,0,0,0,0,0,0,0
37:04:00,,Stefan Cavor von HSG Wetzlar unterläuft ein technischer Fehler. Der Ballbesitz wechselt.,HSG Wetzlar,Bergischer HC,0,0,0,0,0,0,0,0
36:31:00,17:17,Noah Beyer (Bergischer HC) trifft von der 7-Meter Linie.,HSG Wetzlar,Bergischer HC,0,0,0,0,0,0,0,0
35:28:00,17:16,Tor (RM/fern)! Stefan Cavor (HSG Wetzlar) netzt ein zum neuen Spielstand von 17:16.,HSG Wetzlar,Bergischer HC,0,0,0,0,0,0,0,0
34:55:00,,Noah Beyer von Bergischer HC unterläuft ein technischer Fehler. Der Ballbesitz wechselt.,HSG Wetzlar,Bergischer HC,0,0,0,0,0,0,0,0
34:18:00,16:16,Magnus Fredriksen (HSG Wetzlar) trifft zum Spielstand von 16:16 in Buderus Arena Wetzlar.,HSG Wetzlar,Bergischer HC,0,0,0,0,0,0,0,0
33:04:00,15:16,Alexander Weck (Bergischer HC) überwindet den Torwart zum neuen Spielstand von 15:16.,HSG Wetzlar,Bergischer HC,0,0,0,0,0,0,0,0
32:33:00,15:15,Tor! Stefan Cavor (HSG Wetzlar) netzt ein zum neuen Spielstand von 15:15.,HSG Wetzlar,Bergischer HC,0,0,0,0,0,0,0,0
31:47:00,14:15,"Neuer Spielstand in Wetzlar, 14:15 durch den Treffer 6M von Djibril M'Bengue für Bergischer HC.",HSG Wetzlar,Bergischer HC,0,0,0,0,0,0,0,0
31:04:00,14:14,Magnus Fredriksen (HSG Wetzlar) legt den Treffer von Erik Schmidt auf. Es steht 14:14.,HSG Wetzlar,Bergischer HC,0,0,0,0,0,0,0,0
30:28:00,13:14,Die Vorbereitung von Alexander Weck (Bergischer HC) führt zum Treffer durch Frederik Ladefoged.,HSG Wetzlar,Bergischer HC,0,0,0,0,0,0,0,0
30:28:00,13:14,HALBZEIT (13:13),HSG Wetzlar,Bergischer HC,0,0,0,0,0,0,0,0
29:58:00,,"Chance für Filip Kuzmanovski (HSG Wetzlar), er trifft aber nur den Pfosten.",HSG Wetzlar,Bergischer HC,0,0,0,0,0,0,0,0
28:44:00,13:13,Emil Mellegard (HSG Wetzlar) trifft zum Spielstand von 13:13 in Buderus Arena Wetzlar.,HSG Wetzlar,Bergischer HC,0,0,0,0,0,0,0,0
28:32:00,,"Der Torwart von HSG Wetzlar, Till Klimpke hält den Wurf von Elias Scholtes.",HSG Wetzlar,Bergischer HC,0,0,0,0,0,0,0,0
28:21:00,,Christopher Rudeck (Bergischer HC) mit einer Parade.,HSG Wetzlar,Bergischer HC,0,0,0,0,0,0,0,0
28:12:00,,Der Wurf von HSG Wetzlar wurde geblockt.,HSG Wetzlar,Bergischer HC,0,0,0,0,0,0,0,0
27:09:00,12:13,Lukas Stutzke (Bergischer HC) trifft von (6M). Neuer Spielstand in Buderus Arena Wetzlar: 12:13.,HSG Wetzlar,Bergischer HC,0,0,0,0,0,0,0,0
26:50:00,,Torwartwechsel bei HSG Wetzlar. Till Klimpke kommt für Anadin Suljakovic.,HSG Wetzlar,Bergischer HC,0,0,0,0,0,0,0,0
26:48:00,12:12,Filip Kuzmanovski (HSG Wetzlar) überwindet den Torwart zum neuen Spielstand von 12:12.,HSG Wetzlar,Bergischer HC,0,0,0,0,0,0,0,0
26:46:00,,Zeitstrafe vorbei HSG Wetzlar.,HSG Wetzlar,Bergischer HC,0,0,0,0,1,0,0,0
26:13:00,,Auszeit HSG Wetzlar.,HSG Wetzlar,Bergischer HC,1,0,0,0,1,0,0,0
25:44:00,11:12,"Neuer Spielstand in Wetzlar, 11:12 durch den Treffer von Isak Persson für Bergischer HC.",HSG Wetzlar,Bergischer HC,0,0,0,0,1,0,0,0
24:53:00,,Siebter Spieler eingewechselt HSG Wetzlar.,HSG Wetzlar,Bergischer HC,0,0,1,0,1,0,0,0
24:43:00,11:11,Der 7-Meter wurde von Noah Beyer (Bergischer HC) erfolgreich verwandelt.,HSG Wetzlar,Bergischer HC,0,0,0,0,1,0,0,0
24:39:00,,"Der Trainer von HSG Wetzlar, Hrvoje Horvat stellt nun Anadin Suljakovic zwischen die Pfosten.",HSG Wetzlar,Bergischer HC,0,0,0,0,1,0,0,0
24:39:00,,2-Minuten-Strafe für Lenny Rubin. HSG Wetzlar muss nun die nächsten zwei Minuten mit einem Spieler weniger auskommen.,HSG Wetzlar,Bergischer HC,0,0,0,0,1,0,0,1
24:31:00,,Erik Schmidt von HSG Wetzlar unterläuft ein technischer Fehler. Der Ballbesitz wechselt.,HSG Wetzlar,Bergischer HC,0,0,0,0,0,0,0,0
23:50,11:10,Tor (6M)! Frederik Ladefoged (Bergischer HC) netzt ein zum neuen Spielstand von 11:10.,HSG Wetzlar,Bergischer HC,0,0,0,0,0,0,0,0
23:19,11:09,Stefan Cavor (HSG Wetzlar) überwindet den Torwart von (6M) zum neuen Spielstand von 11:9.,HSG Wetzlar,Bergischer HC,0,0,0,0,0,0,0,0
22:52,,Elias Scholtes von Bergischer HC unterläuft ein technischer Fehler. Der Ballbesitz wechselt.,HSG Wetzlar,Bergischer HC,0,0,0,0,0,0,0,0
22:13,,Parade von Torwart Christopher Rudeck (Bergischer HC).,HSG Wetzlar,Bergischer HC,0,0,0,0,0,0,0,0
22:02,10:09,Lukas Stutzke (Bergischer HC) tankt sich durch und erzielt einen Treffer zum 10:9.,HSG Wetzlar,Bergischer HC,0,0,0,0,0,0,0,0
21:51,,Auszeit Bergischer HC.,HSG Wetzlar,Bergischer HC,0,1,0,0,0,0,0,0
21:15,10:08,Domen Novak (HSG Wetzlar) durchbricht die Abwehr und trifft zum 10:8.,HSG Wetzlar,Bergischer HC,0,0,0,0,0,0,0,0
20:38,9:08,Lukas Stutzke (Bergischer HC) trifft von (RM/fern). Neuer Spielstand in Buderus Arena Wetzlar: 9:8.,HSG Wetzlar,Bergischer HC,0,0,0,0,0,0,0,0
20:32,,Christopher Rudeck (Bergischer HC) hält den Wurf von Adam Nyfjäll.,HSG Wetzlar,Bergischer HC,0,0,0,0,0,0,0,0
19:30,,"Parade des Torwarts von HSG Wetzlar, Till Klimpke.",HSG Wetzlar,Bergischer HC,0,0,0,0,0,0,0,0
18:05,9:07,"Tor! Es war Jonas Schelker (HSG Wetzlar), der das Tor von Erik Schmidt vorbereitete.",HSG Wetzlar,Bergischer HC,0,0,0,0,0,0,0,0
18:00,,Zeitstrafe vorbei Bergischer HC.,HSG Wetzlar,Bergischer HC,0,0,0,0,0,1,0,0
17:54,,Christopher Rudeck (Bergischer HC) mit einer Parade.,HSG Wetzlar,Bergischer HC,0,0,0,0,0,1,0,0
17:09,,"Elias Scholtes (RM/fern) wirft, jedoch neben das Tor.",HSG Wetzlar,Bergischer HC,0,0,0,0,0,1,0,0
16:16,,Siebter Spieler eingewechselt Bergischer HC.,HSG Wetzlar,Bergischer HC,0,0,0,1,0,1,0,0
16:10,8:07,"Neuer Spielstand in Wetzlar, 8:7 durch den Treffer 6M von Stefan Cavor für HSG Wetzlar.",HSG Wetzlar,Bergischer HC,0,0,0,0,0,1,0,0
15:58,,Alexander Weck (Bergischer HC) erhält eine 2 Minuten Strafe.,HSG Wetzlar,Bergischer HC,0,0,0,0,0,1,1,0
15:47,7:07,Frederik Ladefoged (Bergischer HC) überwindet den Torwart zum neuen Spielstand von 7:7.,HSG Wetzlar,Bergischer HC,0,0,0,0,0,0,0,0
15:44,,Überragende Parade des Torwarts Till Klimpke (HSG Wetzlar)! Alexander Weck kann den Ball nicht im Tor unterbringen!,HSG Wetzlar,Bergischer HC,0,0,0,0,0,0,0,0
14:31,7:06,Tor! Stefan Cavor (HSG Wetzlar) netzt ein zum neuen Spielstand von 7:6.,HSG Wetzlar,Bergischer HC,0,0,0,0,0,0,0,0
13:31,,Die Vorbereitung von Djibril M'Bengue (Bergischer HC) führt zum Treffer durch Isak Persson.,HSG Wetzlar,Bergischer HC,0,0,0,0,0,0,0,0
13:06,6:05,Tor für HSG Wetzlar durch Domen Novak nach einem Pass von Hendrik Wagner.,HSG Wetzlar,Bergischer HC,0,0,0,0,0,0,0,0
12:35,5:05,"Neuer Spielstand in Wetzlar, 5:5 durch den Treffer von Alexander Weck für Bergischer HC.",HSG Wetzlar,Bergischer HC,0,0,0,0,0,0,0,0
12:25,,Hendrik Wagner (HSG Wetzlar) trifft nur den Pfosten.,HSG Wetzlar,Bergischer HC,0,0,0,0,0,0,0,0
11:51,,Christopher Rudeck (Bergischer HC) hält den Wurf von Lenny Rubin.,HSG Wetzlar,Bergischer HC,0,0,0,0,0,0,0,0
11:29,,"Parade des Torwarts von Bergischer HC, Christopher Rudeck.",HSG Wetzlar,Bergischer HC,0,0,0,0,0,0,0,0
10:42,,Till Klimpke (HSG Wetzlar) mit einer Parade.,HSG Wetzlar,Bergischer HC,0,0,0,0,0,0,0,0
10:13,5:04,"Tor von der 7-Meter Linie von Domen Novak (HSG Wetzlar), neuer Spielstand 5:4.",HSG Wetzlar,Bergischer HC,0,0,0,0,0,0,0,0
9:53,,"Der Torwart von HSG Wetzlar, Till Klimpke hält den Wurf von Noah Beyer.",HSG Wetzlar,Bergischer HC,0,0,0,0,0,0,0,0
9:07,4:04,Domen Novak (HSG Wetzlar) trifft von der 7-Meter Linie.,HSG Wetzlar,Bergischer HC,0,0,0,0,0,0,0,0
7:53,,Parade von Torwart Till Klimpke (HSG Wetzlar).,HSG Wetzlar,Bergischer HC,0,0,0,0,0,0,0,0
7:27,3:04,Magnus Fredriksen (HSG Wetzlar) tankt sich durch und trifft!,HSG Wetzlar,Bergischer HC,0,0,0,0,0,0,0,0
7:12,2:04,"Tor von der 7-Meter Linie von Noah Beyer (Bergischer HC), neuer Spielstand 2:4.",HSG Wetzlar,Bergischer HC,0,0,0,0,0,0,0,0
7:11,,Zeitstrafe vorbei HSG Wetzlar.,HSG Wetzlar,Bergischer HC,0,0,0,0,1,0,0,0
6:17,,Siebter Spieler eingewechselt HSG Wetzlar.,HSG Wetzlar,Bergischer HC,0,0,1,0,1,0,0,0
6:06,,Alexander Weck (Bergischer HC) scheitert am Torwart Till Klimpke (HSG Wetzlar).,HSG Wetzlar,Bergischer HC,0,0,0,0,1,0,0,0
5:32,,Der Strafwurf von Domen Novak wurde von Christopher Rudeck (Bergischer HC) gehalten.,HSG Wetzlar,Bergischer HC,0,0,0,0,1,0,0,0
4:48,2:03,Noah Beyer (Bergischer HC) trifft von der 7-Meter Linie und bringt den Spielstand auf 2:3.,HSG Wetzlar,Bergischer HC,0,0,0,0,1,0,0,0
4:44,,Erik Schmidt geht den Gegner zu stark an. HSG Wetzlar muss nun die nächsten zwei Minuten mit einem Spieler weniger auskommen.,HSG Wetzlar,Bergischer HC,0,0,0,0,1,0,0,1
4:30,,"Block von Lenny Rubin, der den Torwurf von Alexander Weck verhindert.",HSG Wetzlar,Bergischer HC,0,0,0,0,0,0,0,0
3:25,2:02,Der 7-Meter wurde von Domen Novak (HSG Wetzlar) erfolgreich verwandelt.,HSG Wetzlar,Bergischer HC,0,0,0,0,0,0,0,0
2:02,1:02,Erik Schmidt (HSG Wetzlar) trifft zum Spielstand von 1:2 in Buderus Arena Wetzlar.,HSG Wetzlar,Bergischer HC,0,0,0,0,0,0,0,0
2:09,,Tom Kare Nikolaisen von Bergischer HC wurde mit der Gelben Karte von Koppl/Regner verwarnt.,HSG Wetzlar,Bergischer HC,0,0,0,0,0,0,0,0
1:31,0:02,Tor (6M)! Isak Persson (Bergischer HC) netzt ein zum neuen Spielstand von 0:2.,HSG Wetzlar,Bergischer HC,0,0,0,0,0,0,0,0
1:27,,Christopher Rudeck (Bergischer HC) mit einer Parade.,HSG Wetzlar,Bergischer HC,0,0,0,0,0,0,0,0
1:20,0:01,Alexander Weck (Bergischer HC) überwindet den Torwart von (RR/fern) zum neuen Spielstand von 0:1.,HSG Wetzlar,Bergischer HC,0,0,0,0,0,0,0,0
0:35,,"Der Torwart von Bergischer HC, Christopher Rudeck pariert den Wurf.",HSG Wetzlar,Bergischer HC,0,0,0,0,0,0,0,0