,Time,Score,Event.Description,Hometeam,Awayteam,Timeout_Hometeam,Timeout_Awayteam,SeventhPlayer_Hometeam,SeventhPlayer_Awayteam,SixthPlayer_Hometeam,SixthPlayer_Awayteam,Penalty_Awayteam,Penalty_Hometeam
1,59:52:00,25:31:00,Jovica Nikolic (HSG Wetzlar) überwindet den Torwart zum neuen Spielstand von 25:31.,HSG Wetzlar,THW Kiel,0,0,0,0,0,1,0,0
2,59:44:00,24:31:00,Niclas Ekberg (THW Kiel) trifft von (RA). Neuer Spielstand in Buderus Arena: 24:31.,HSG Wetzlar,THW Kiel,0,0,0,0,0,1,0,0
3,59:29:00,,Siebter Spieler eingewechselt THW Kiel,HSG Wetzlar,THW Kiel,0,0,0,1,0,1,0,0
4,59:11:00,,Parade von Torwart Niklas Landin (THW Kiel).,HSG Wetzlar,THW Kiel,0,0,0,0,0,1,0,0
5,59:02:00,,Es gibt eine 2 Minuten Strafe für Karl Wallinius (THW Kiel).,HSG Wetzlar,THW Kiel,0,0,0,0,0,1,1,0
6,58:36:00,,"Block von Karl Wallinius, der den Torwurf von Jovica Nikolic verhindert.",HSG Wetzlar,THW Kiel,0,0,0,0,0,0,0,0
7,58:28:00,,"Der Torwart von HSG Wetzlar, Till Klimpke pariert den Wurf.",HSG Wetzlar,THW Kiel,0,0,0,0,0,0,0,0
8,57:43:00,24:30:00,Tor (LA)! Lukas Becher (HSG Wetzlar) netzt ein zum neuen Spielstand von 24:30.,HSG Wetzlar,THW Kiel,0,0,0,0,0,0,0,0
9,57:35:00,,Harald Reinkind (THW Kiel) scheitert am Torwart Till Klimpke (HSG Wetzlar).,HSG Wetzlar,THW Kiel,0,0,0,0,0,0,0,0
10,56:59:00,,Lenny Rubin von HSG Wetzlar unterläuft ein technischer Fehler. Der Ballbesitz wechselt.,HSG Wetzlar,THW Kiel,0,0,0,0,0,0,0,0
11,56:45:00,,Tor! Niclas Ekberg (THW Kiel) netzt ein zum neuen Spielstand von 23:30.,HSG Wetzlar,THW Kiel,0,0,0,0,0,0,0,0
12,55:48:00,23:30,Niklas Landin (THW Kiel) hält den Wurf von Lars Weissgerber.,HSG Wetzlar,THW Kiel,0,0,0,0,0,0,0,0
13,55:38:00,23:29,"Neuer Spielstand in Wetzlar, 23:29 durch den Treffer 6M von Harald Reinkind für THW Kiel.",HSG Wetzlar,THW Kiel,0,0,0,0,0,0,0,0
14,54:47:00,23:28,Lars Weissgerber (HSG Wetzlar) überwindet den Torwart von (RA) zum neuen Spielstand von 23:28.,HSG Wetzlar,THW Kiel,0,0,0,0,0,0,0,0
15,54:12:00,,Magnus Landin (THW Kiel) trifft von der 7-Meter Linie.,HSG Wetzlar,THW Kiel,0,0,0,0,0,0,0,0
16,53:30:00,,Lenny Rubin blockt den Wurf von Nikola Bilyk.,HSG Wetzlar,THW Kiel,0,0,0,0,0,0,0,0
17,53:07:00,,Auszeit THW Kiel,HSG Wetzlar,THW Kiel,0,1,0,0,0,0,0,0
18,52:38:00,22:27,Adam Nyfjäll (HSG Wetzlar) trifft zum Spielstand von 22:27 in Buderus Arena.,HSG Wetzlar,THW Kiel,0,0,0,0,0,0,0,0
19,52:23:00,,Nikola Bilyk (THW Kiel) überwindet den Torwart zum neuen Spielstand von 21:27.,HSG Wetzlar,THW Kiel,0,0,0,0,0,0,0,0
20,51:57:00,21:26,"Neuer Spielstand in Wetzlar, 21:26 durch den Treffer von Adam Nyfjäll für HSG Wetzlar.",HSG Wetzlar,THW Kiel,0,0,0,0,0,0,0,0
21,51:09:00,,"Wurf von Lars Weissgerber (HSG Wetzlar), aber der Ball landet nur am Pfosten.",HSG Wetzlar,THW Kiel,0,0,0,0,0,0,0,0
22,50:37:00,20:26,Magnus Landin (THW Kiel) trifft von der 7-Meter Linie und bringt den Spielstand auf 20:26.,HSG Wetzlar,THW Kiel,0,0,0,0,0,0,0,0
23,49:36:00,20:25,Lenny Rubin (HSG Wetzlar) überwindet den Torwart zum neuen Spielstand von 20:25.,HSG Wetzlar,THW Kiel,0,0,0,0,0,0,0,0
24,48:43:00,19:25,Nikola Bilyk (THW Kiel) überwindet den Torwart von (6M) zum neuen Spielstand von 19:25.,HSG Wetzlar,THW Kiel,0,0,0,0,0,0,0,0
25,48:13:00,,Niklas Landin (THW Kiel) mit einer Parade.,HSG Wetzlar,THW Kiel,0,0,0,0,0,0,0,0
26,47:36:00,19:24,Tor (6M)! Hendrik Pekeler (THW Kiel) netzt ein zum neuen Spielstand von 19:24.,HSG Wetzlar,THW Kiel,0,0,0,0,0,0,0,0
27,47:27:00,19:23,Jovica Nikolic (HSG Wetzlar) trifft zum Spielstand von 19:23 in Buderus Arena.,HSG Wetzlar,THW Kiel,0,0,0,0,0,0,0,0
28,46:39:00,18:23,"Neuer Spielstand in Wetzlar, 18:23 durch den Treffer RL/fern von Sander Sagosen für THW Kiel.",HSG Wetzlar,THW Kiel,0,0,0,0,0,0,0,0
29,46:08:00,,"Parade des Torwarts von THW Kiel, Niklas Landin.",HSG Wetzlar,THW Kiel,0,0,0,0,0,0,0,0
30,45:41:00,,Auszeit HSG Wetzlar,HSG Wetzlar,THW Kiel,1,0,0,0,0,0,0,0
31,45:32:00,18:22,"Neuer Spielstand in Wetzlar, 18:22 durch den Treffer von Nikola Bilyk für THW Kiel.",HSG Wetzlar,THW Kiel,0,0,0,0,0,0,0,0
32,44:58:00,,"Parade des Torwarts von THW Kiel, Niklas Landin.",HSG Wetzlar,THW Kiel,0,0,0,0,0,0,0,0
33,44:27:00,18:21,Niclas Ekberg (THW Kiel) trifft von (RA). Neuer Spielstand in Buderus Arena: 18:21.,HSG Wetzlar,THW Kiel,0,0,0,0,0,0,0,0
34,44:23:00,,Zeitstrafe vorbei HSG Wetzlar,HSG Wetzlar,THW Kiel,0,0,0,0,1,0,0,0
35,44:03:00,18:20,Tor! Jovica Nikolic (HSG Wetzlar) netzt ein zum neuen Spielstand von 18:20.,HSG Wetzlar,THW Kiel,0,0,0,0,1,0,0,0
36,43:11:00,,"Harald Reinkind wirft auf das Tor, trifft aber nur den Pfosten.",HSG Wetzlar,THW Kiel,0,0,0,0,1,0,0,0
37,42:54:00,,Zeitstrafe vorbei THW Kiel,HSG Wetzlar,THW Kiel,0,0,0,0,1,1,0,0
38,42:42:00,,Wurf daneben HSG Wetzlar,HSG Wetzlar,THW Kiel,0,0,0,0,1,1,0,0
39,42:37:00,,Till Klimpke (HSG Wetzlar) mit einer Parade.,HSG Wetzlar,THW Kiel,0,0,0,0,1,1,0,0
40,42:19:00,,"Nach einem harten Foul hat Lars Weissgerber (HSG Wetzlar) nun zwei Minuten Zeit, um sich auszuruhen.",HSG Wetzlar,THW Kiel,0,0,0,0,1,1,0,1
41,42:15:00,,Siebter Spieler eingewechselt THW Kiel,HSG Wetzlar,THW Kiel,0,0,0,1,0,1,0,0
42,42:06:00,,Lenny Rubin von HSG Wetzlar unterläuft ein technischer Fehler. Der Ballbesitz wechselt.,HSG Wetzlar,THW Kiel,0,0,0,0,0,1,0,0
43,41:27:00,17:20,Tor (6M)! Sander Sagosen (THW Kiel) netzt ein zum neuen Spielstand von 17:20.,HSG Wetzlar,THW Kiel,0,0,0,0,0,1,0,0
44,40:57:00,,Siebter Spieler eingewechselt THW Kiel,HSG Wetzlar,THW Kiel,0,0,0,1,0,1,0,0
45,40:43:00,17:19,Der 7-Meter wurde von Lars Weissgerber (HSG Wetzlar) erfolgreich verwandelt.,HSG Wetzlar,THW Kiel,0,0,0,0,0,1,0,0
46,40:39:00,,Petter Øverby (THW Kiel) erhält eine 2 Minuten Strafe.,HSG Wetzlar,THW Kiel,0,0,0,0,0,1,1,0
47,40:29:00,16:19,"Neuer Spielstand in Wetzlar, 16:19 durch den Treffer LA von Rune Dahmke für THW Kiel.",HSG Wetzlar,THW Kiel,0,0,0,0,0,0,0,0
48,40:13:00,16:18,"Neuer Spielstand in Wetzlar, 16:18 durch den Treffer von Erik Schmidt für HSG Wetzlar.",HSG Wetzlar,THW Kiel,0,0,0,0,0,0,0,0
49,39:17:00,15:18,Rune Dahmke (THW Kiel) trifft von (6M). Neuer Spielstand in Buderus Arena: 15:18.,HSG Wetzlar,THW Kiel,0,0,0,0,0,0,0,0
50,39:13:00,,Till Klimpke (HSG Wetzlar) mit einer Parade.,HSG Wetzlar,THW Kiel,0,0,0,0,0,0,0,0
51,38:23:00,,Fehlwurf von Harald Reinkind (THW Kiel).,HSG Wetzlar,THW Kiel,0,0,0,0,0,0,0,0
52,37:31:00,,Der Wurf von THW Kiel wurde geblockt.,HSG Wetzlar,THW Kiel,0,0,0,0,0,0,0,0
53,37:20:00,,Parade von Torwart Niklas Landin (THW Kiel).,HSG Wetzlar,THW Kiel,0,0,0,0,0,0,0,0
54,36:48:00,,"Der Towart von HSG Wetzlar, Till Klimpke pariert den gegebenen 7-Meter.",HSG Wetzlar,THW Kiel,0,0,0,0,0,0,0,0
55,36:06:00,,Till Klimpke (HSG Wetzlar) hält den Wurf von Patrick Wiencek.,HSG Wetzlar,THW Kiel,0,0,0,0,0,0,0,0
56,35:58:00,15:17,Tor! Lenny Rubin (HSG Wetzlar) netzt ein zum neuen Spielstand von 15:17.,HSG Wetzlar,THW Kiel,0,0,0,0,0,0,0,0
57,35:20:00,,Rune Dahmke von THW Kiel unterläuft ein technischer Fehler. Der Ballbesitz wechselt.,HSG Wetzlar,THW Kiel,0,0,0,0,0,0,0,0
58,34:41:00,,"Der Torwart von HSG Wetzlar, Till Klimpke pariert den Wurf.",HSG Wetzlar,THW Kiel,0,0,0,0,0,0,0,0
59,33:20:00,14:17,Nikola Bilyk (THW Kiel) überwindet den Torwart von (6M) zum neuen Spielstand von 14:17.,HSG Wetzlar,THW Kiel,0,0,0,0,0,0,0,0
60,32:18:00,,Jonas Schelker von HSG Wetzlar unterläuft ein technischer Fehler. Der Ballbesitz wechselt.,HSG Wetzlar,THW Kiel,0,0,0,0,0,0,0,0
61,31:37:00,14:16,Harald Reinkind (THW Kiel) trifft zum Spielstand von 14:16 in Buderus Arena.,HSG Wetzlar,THW Kiel,0,0,0,0,0,0,0,0
62,31:23:00,14:15,Jovica Nikolic (HSG Wetzlar) überwindet den Torwart zum neuen Spielstand von 14:15.,HSG Wetzlar,THW Kiel,0,0,0,0,0,0,0,0
63,30:40:00,,Niclas Ekberg von THW Kiel unterläuft ein technischer Fehler. Der Ballbesitz wechselt.,HSG Wetzlar,THW Kiel,0,0,0,0,0,0,0,0
64,HALBZ,,,HSG Wetzlar,THW Kiel,0,0,0,0,0,0,0,0
65,29:59:00,,Domen Novak vergibt den Strafwurf für HSG Wetzlar.,HSG Wetzlar,THW Kiel,0,0,0,0,0,0,0,0
66,29:45:00,,HSG Wetzlar wechselt den Torwart. Till Klimpke kommt für Anadin Suljakovic.,HSG Wetzlar,THW Kiel,0,0,0,0,0,0,0,0
67,29:41:00,,Der 7-Meter wurde von Sander Sagosen (THW Kiel) erfolgreich verwandelt.,HSG Wetzlar,THW Kiel,0,0,0,0,0,0,0,0
68,29:32:00,,Der eingewechselte Torwart Anadin Suljakovic (HSG Wetzlar) steht nun zwischen den Pfosten.,HSG Wetzlar,THW Kiel,0,0,0,0,0,0,0,0
69,28:54:00,,Überragende Parade des Torwarts Niklas Landin (THW Kiel)! Lenny Rubin kann den Ball nicht im Tor unterbringen!,HSG Wetzlar,THW Kiel,0,0,0,0,0,0,0,0
70,28:29:00,,Zeitstrafe vorbei THW Kiel,HSG Wetzlar,THW Kiel,0,0,0,0,0,1,0,0
71,28:20:00,,Sander Sagosen von THW Kiel unterläuft ein technischer Fehler. Der Ballbesitz wechselt.,HSG Wetzlar,THW Kiel,0,0,0,0,0,1,0,0
72,27:55:00,,Siebter Spieler eingewechselt THW Kiel,HSG Wetzlar,THW Kiel,0,0,0,1,0,1,0,0
73,27:44:00,,Vladan Lipovina (HSG Wetzlar) scheitert am Torwart Niklas Landin (THW Kiel).,HSG Wetzlar,THW Kiel,0,0,0,0,0,1,0,0
74,27:26:00,13:14,Tor (6M)! Patrick Wiencek (THW Kiel) netzt ein zum neuen Spielstand von 13:14.,HSG Wetzlar,THW Kiel,0,0,0,0,0,1,0,0
75,26:55:00,,Siebter Spieler eingewechselt THW Kiel,HSG Wetzlar,THW Kiel,0,0,0,1,0,1,0,0
76,26:43:00,,"Der Torwart von THW Kiel, Niklas Landin hält den Wurf von Domen Novak.",HSG Wetzlar,THW Kiel,0,0,0,0,0,1,0,0
77,26:27:00,,2-Minuten-Strafe für Magnus Landin. THW Kiel muss nun die nächsten zwei Minuten mit einem Spieler weniger auskommen.,HSG Wetzlar,THW Kiel,0,0,0,0,0,1,1,0
78,26:22:00,13:13,Nikola Bilyk (THW Kiel) trifft zum Spielstand von 13:13 in Buderus Arena.,HSG Wetzlar,THW Kiel,0,0,0,0,0,0,0,0
79,25:43:00,,Niklas Landin (THW Kiel) mit einer Parade.,HSG Wetzlar,THW Kiel,0,0,0,0,0,0,0,0
80,25:35:00,,Der Wurfversuch von Harald Reinkind (THW Kiel) wurde durch einen Block von Adam Nyfjäll verhindert.,HSG Wetzlar,THW Kiel,0,0,0,0,0,0,0,0
81,25:25:00,13:12,Domen Novak (HSG Wetzlar) überwindet den Torwart zum neuen Spielstand von 13:12.,HSG Wetzlar,THW Kiel,0,0,0,0,0,0,0,0
82,25:15:00,,"Parade des Torwarts von HSG Wetzlar, Till Klimpke.",HSG Wetzlar,THW Kiel,0,0,0,0,0,0,0,0
83,24:29:00,,Hendrik Wagner (HSG Wetzlar) scheitert am Torwart Niklas Landin (THW Kiel).,HSG Wetzlar,THW Kiel,0,0,0,0,0,0,0,0
84,24:01:00,12:12,"Tor von der 7-Meter Linie von Sander Sagosen (THW Kiel), neuer Spielstand 12:12.",HSG Wetzlar,THW Kiel,0,0,0,0,0,0,0,0
85,23:42,12:11,"Neuer Spielstand in Wetzlar, 12:11 durch den Treffer RA von Domen Novak für HSG Wetzlar.",HSG Wetzlar,THW Kiel,0,0,0,0,0,0,0,0
86,23:04,,Auszeit HSG Wetzlar,HSG Wetzlar,THW Kiel,1,0,0,0,0,0,0,0
87,23:03,,Zeitstrafe vorbei HSG Wetzlar,HSG Wetzlar,THW Kiel,0,0,0,0,1,0,0,0
88,23:01,11:11,Niclas Ekberg (THW Kiel) überwindet den Torwart von (RA) zum neuen Spielstand von 11:11.,HSG Wetzlar,THW Kiel,0,0,0,0,1,0,0,0
89,22:18,11:10,"Neuer Spielstand in Wetzlar, 11:10 durch den Treffer von Patrick Wiencek für THW Kiel.",HSG Wetzlar,THW Kiel,0,0,0,0,1,0,0,0
90,22:06,,Lenny Rubin von HSG Wetzlar unterläuft ein technischer Fehler. Der Ballbesitz wechselt.,HSG Wetzlar,THW Kiel,0,0,0,0,1,0,0,0
91,21:17,,Siebter Spieler eingewechselt HSG Wetzlar,HSG Wetzlar,THW Kiel,0,0,1,0,1,0,0,0
92,21:06,,Till Klimpke (HSG Wetzlar) mit einer Parade beim 7-Meter.,HSG Wetzlar,THW Kiel,0,0,0,0,1,0,0,0
93,21:00,,"Nach einem harten Foul hat Erik Schmidt (HSG Wetzlar) nun zwei Minuten Zeit, um sich auszuruhen.",HSG Wetzlar,THW Kiel,0,0,0,0,1,0,0,1
94,20:19,,"Der Torwart von THW Kiel, Niklas Landin hält den Wurf von Vladan Lipovina.",HSG Wetzlar,THW Kiel,0,0,0,0,0,0,0,0
95,19:55,,Zeitstrafe vorbei HSG Wetzlar,HSG Wetzlar,THW Kiel,0,0,0,0,1,0,0,0
96,19:08,,Siebter Spieler eingewechselt HSG Wetzlar,HSG Wetzlar,THW Kiel,0,0,1,0,1,0,0,0
97,19:00,11:09,Magnus Landin (THW Kiel) trifft von (LA). Neuer Spielstand in Buderus Arena: 11:9.,HSG Wetzlar,THW Kiel,0,0,0,0,1,0,0,0
98,18:34,11:08,Tor! Emil Mellegard (HSG Wetzlar) netzt ein zum neuen Spielstand von 11:8.,HSG Wetzlar,THW Kiel,0,0,0,0,1,0,0,0
99,17:58,,Siebter Spieler eingewechselt HSG Wetzlar,HSG Wetzlar,THW Kiel,0,0,1,0,1,0,0,0
100,17:52,,Der Spieler Niclas Ekberg von THW Kiel vergibt den 7-Meter.,HSG Wetzlar,THW Kiel,0,0,0,0,1,0,0,0
101,17:46,,Jovica Nikolic geht den Gegner zu stark an. HSG Wetzlar muss nun die nächsten zwei Minuten mit einem Spieler weniger auskommen.,HSG Wetzlar,THW Kiel,0,0,0,0,1,0,0,1
102,17:27,,Es gibt Gelb für Lenny Rubin (HSG Wetzlar) von Reich/Brodbeck.,HSG Wetzlar,THW Kiel,0,0,0,0,0,0,0,0
103,16:57,10:08,Lenny Rubin (HSG Wetzlar) überwindet den Torwart von (6M) zum neuen Spielstand von 10:8.,HSG Wetzlar,THW Kiel,0,0,0,0,0,0,0,0
104,16:12,9:08,Niclas Ekberg (THW Kiel) trifft von der 7-Meter Linie und bringt den Spielstand auf 9:8.,HSG Wetzlar,THW Kiel,0,0,0,0,0,0,0,0
105,16:11,,Torwartwechsel bei THW Kiel. Niklas Landin kommt für Tomas Mrkva.,HSG Wetzlar,THW Kiel,0,0,0,0,0,0,0,0
106,15:14,9:07,Tor (RM/fern)! Lenny Rubin (HSG Wetzlar) netzt ein zum neuen Spielstand von 9:7.,HSG Wetzlar,THW Kiel,0,0,0,0,0,0,0,0
107,14:35,8:07,Sander Sagosen (THW Kiel) trifft von (6M). Neuer Spielstand in Buderus Arena: 8:7.,HSG Wetzlar,THW Kiel,0,0,0,0,0,0,0,0
108,13:31,,Tomas Mrkva (THW Kiel) hält den Wurf von Domen Novak.,HSG Wetzlar,THW Kiel,0,0,0,0,0,0,0,0
109,13:23,8:06,Tor! Patrick Wiencek (THW Kiel) netzt ein zum neuen Spielstand von 8:6.,HSG Wetzlar,THW Kiel,0,0,0,0,0,0,0,0
110,13:01,,Till Klimpke (HSG Wetzlar) mit einer Parade.,HSG Wetzlar,THW Kiel,0,0,0,0,0,0,0,0
111,12:22,8:05,Domen Novak (HSG Wetzlar) überwindet den Torwart zum neuen Spielstand von 8:5.,HSG Wetzlar,THW Kiel,0,0,0,0,0,0,0,0
112,11:56,,Siebter Spieler eingewechselt THW Kiel.,HSG Wetzlar,THW Kiel,0,0,0,1,0,0,0,0
113,11:37,7:05,Jonas Schelker (HSG Wetzlar) trifft zum Spielstand von 7:5 in Buderus Arena.,HSG Wetzlar,THW Kiel,0,0,0,0,0,0,0,0
114,10:32,6:05,"Neuer Spielstand in Wetzlar, 6:5 durch den Treffer 6M von Harald Reinkind für THW Kiel.",HSG Wetzlar,THW Kiel,0,0,0,0,0,0,0,0
115,10:11,,Zeitstrafe vorbei THW Kiel.,HSG Wetzlar,THW Kiel,0,0,0,0,0,1,0,0
116,9:51,,"Gute Torchance, aber Emil Mellegard (HSG Wetzlar) kann diese nicht erfolgreich verwandeln.",HSG Wetzlar,THW Kiel,0,0,0,0,0,1,0,0
117,9:45,6:04,"Neuer Spielstand in Wetzlar, 6:4 durch den Treffer von Patrick Wiencek für THW Kiel.",HSG Wetzlar,THW Kiel,0,0,0,0,0,1,0,0
118,9:25,,"Block von Erik Schmidt, der den Torwurf von Harald Reinkind verhindert.",HSG Wetzlar,THW Kiel,0,0,0,0,0,1,0,0
119,9:04,,"Chance für Till Klimpke (HSG Wetzlar), er trifft aber nur den Pfosten.",HSG Wetzlar,THW Kiel,0,0,0,0,0,1,0,0
120,8:52,,"Der Torwart von HSG Wetzlar, Till Klimpke pariert den Wurf.",HSG Wetzlar,THW Kiel,0,0,0,0,0,1,0,0
121,8:22,,Siebter Spieler eingewechselt THW Kiel.,HSG Wetzlar,THW Kiel,0,0,0,1,0,1,0,0
122,8:12,6:03,Domen Novak (HSG Wetzlar) trifft von der 7-Meter Linie.,HSG Wetzlar,THW Kiel,0,0,0,0,0,1,0,0
123,8:08,,Es gibt eine 2 Minuten Strafe für Nikola Bilyk (THW Kiel).,HSG Wetzlar,THW Kiel,0,0,0,0,0,1,1,0
124,7:50,,Der Wurf von Nikola Bilyk (THW Kiel) landet hinter dem Tor.,HSG Wetzlar,THW Kiel,0,0,0,0,0,0,0,0
125,6:47,,Zeitstrafe vorbei THW Kiel.,HSG Wetzlar,THW Kiel,0,0,0,0,0,1,0,0
126,6:38,,Überragende Parade des Torwarts Tomas Mrkva (THW Kiel)! Domen Novak kann den Ball nicht im Tor unterbringen!,HSG Wetzlar,THW Kiel,0,0,0,0,0,1,0,0
127,6:19,5:03,Magnus Landin (THW Kiel) überwindet den Torwart von (LA) zum neuen Spielstand von 5:3.,HSG Wetzlar,THW Kiel,0,0,0,0,0,1,0,0
128,5:54,,Siebter Spieler eingewechselt THW Kiel,HSG Wetzlar,THW Kiel,0,0,0,1,0,1,0,0
129,5:43,5:02,Tor (RL/fern)! Lenny Rubin (HSG Wetzlar) netzt ein zum neuen Spielstand von 5:2.,HSG Wetzlar,THW Kiel,0,0,0,0,0,1,0,0
130,5:28,,Zeitstrafe vorbei HSG Wetzlar,HSG Wetzlar,THW Kiel,0,0,0,0,1,1,0,0
131,5:18,,Parade von Torwart Till Klimpke (HSG Wetzlar).,HSG Wetzlar,THW Kiel,0,0,0,0,1,1,0,0
132,5:07,,Siebter Spieler eingewechselt THW Kiel,HSG Wetzlar,THW Kiel,0,0,0,1,1,1,0,0
133,5:02,4:02,Tor! Domen Novak (HSG Wetzlar) netzt ein zum neuen Spielstand von 4:2.,HSG Wetzlar,THW Kiel,0,0,0,0,1,1,0,0
134,4:45,,Patrick Wiencek (THW Kiel) erhält eine Zeitstrafe und hat nun zwei Minuten Zeit sich auf der Bank zu beruhigen.,HSG Wetzlar,THW Kiel,0,0,0,0,1,1,1,0
135,3:59,,Siebter Spieler eingewechselt HSG Wetzlar,HSG Wetzlar,THW Kiel,0,0,1,0,1,0,0,0
136,3:58,3:02,Magnus Landin (THW Kiel) trifft zum Spielstand von 3:2 in Buderus Arena.,HSG Wetzlar,THW Kiel,0,0,0,0,1,0,0,0
137,3:21,,Hendrik Wagner (HSG Wetzlar) erhält wegen eines Regelverstoßes eine 2 Minuten Strafe.,HSG Wetzlar,THW Kiel,0,0,0,0,1,0,0,1
138,2:39,3:01,"Neuer Spielstand in Wetzlar, 3:1 durch den Treffer von Emil Mellegard für HSG Wetzlar.",HSG Wetzlar,THW Kiel,0,0,0,0,0,0,0,0
139,2:01,2:01,"Neuer Spielstand in Wetzlar, 2:1 durch den Treffer 6M von Harald Reinkind für THW Kiel.",HSG Wetzlar,THW Kiel,0,0,0,0,0,0,0,0
140,1:28,2:00,Jonas Schelker (HSG Wetzlar) trifft von (6M). Neuer Spielstand in Buderus Arena: 2:0.,HSG Wetzlar,THW Kiel,0,0,0,0,0,0,0,0
141,1:23,,Erik Schmidt blockt den Wurf von Domagoj Duvnjak.,HSG Wetzlar,THW Kiel,0,0,0,0,0,0,0,0
142,0:40,1:00,Jovica Nikolic (HSG Wetzlar) überwindet den Torwart zum neuen Spielstand von 1:0.,HSG Wetzlar,THW Kiel,0,0,0,0,0,0,0,0