Time,Score,Event.Description,Hometeam,Awayteam,Timeout_Hometeam,Timeout_Awayteam,SeventhPlayer_Hometeam,SeventhPlayer_Awayteam,SixthPlayer_Hometeam,SixthPlayer_Awayteam,Penalty_Awayteam,Penalty_Hometeam
59:57:00,,"Parade des Torwarts von SC DHfK Leipzig, Kristian Sæverås.",SC DHfK Leipzig,GWD Minden,0,0,0,0,0,0,0,0
59:53:00,,Auszeit GWD Minden,SC DHfK Leipzig,GWD Minden,0,1,0,0,0,0,0,0
59:46:00,31:31:00,Matej Klima (SC DHfK Leipzig) trifft von (6M). Neuer Spielstand in QUARTERBACK Immobilien ARENA: 31:31.,SC DHfK Leipzig,GWD Minden,0,0,0,0,0,0,0,0
59:27:00,,Auszeit SC DHfK Leipzig,SC DHfK Leipzig,GWD Minden,1,0,0,0,0,0,0,0
58:52:00,30:31:00,Tor! Niclas Pieczkowski (GWD Minden) netzt ein zum neuen Spielstand von 30:31.,SC DHfK Leipzig,GWD Minden,0,0,0,0,0,0,0,0
58:16:00,30:30:00,Lucas Krzikalla (SC DHfK Leipzig) trifft von der 7-Meter Linie und bringt den Spielstand auf 30:30.,SC DHfK Leipzig,GWD Minden,0,0,0,0,0,0,0,0
57:44:00,29:30:00,Mohamed Amine Darmoul (GWD Minden) trifft zum Spielstand von 29:30 in QUARTERBACK Immobilien ARENA.,SC DHfK Leipzig,GWD Minden,0,0,0,0,0,0,0,0
56:52:00,,Parade von Torwart Yahav Shamir (GWD Minden).,SC DHfK Leipzig,GWD Minden,0,0,0,0,0,0,0,0
56:22:00,29:29:00,Mohamed Amine Darmoul (GWD Minden) überwindet den Torwart von (6M) zum neuen Spielstand von 29:29.,SC DHfK Leipzig,GWD Minden,0,0,0,0,0,0,0,0
56:05:00,29:28:00,Der 7-Meter wurde von Lucas Krzikalla (SC DHfK Leipzig) erfolgreich verwandelt.,SC DHfK Leipzig,GWD Minden,0,0,0,0,0,0,0,0
55:15:00,28:28:00,"Neuer Spielstand in Leipzig, 28:28 durch den Treffer LA von Mats Korte für GWD Minden.",SC DHfK Leipzig,GWD Minden,0,0,0,0,0,0,0,0
55:03:00,,Parade von Torwart Yahav Shamir (GWD Minden).,SC DHfK Leipzig,GWD Minden,0,0,0,0,0,0,0,0
54:30:00,28:27:00,Tor (RL/fern)! Philipp Ahouansou (GWD Minden) netzt ein zum neuen Spielstand von 28:27.,SC DHfK Leipzig,GWD Minden,0,0,0,0,0,0,0,0
54:22:00,,"Parade des Torwarts von GWD Minden, Yahav Shamir.",SC DHfK Leipzig,GWD Minden,0,0,0,0,0,0,0,0
53:19:00,28:26:00,"Neuer Spielstand in Leipzig, 28:26 durch den Treffer von Mats Korte für GWD Minden.",SC DHfK Leipzig,GWD Minden,0,0,0,0,0,0,0,0
52:16:00,,Auszeit SC DHfK Leipzig,SC DHfK Leipzig,GWD Minden,1,0,0,0,0,0,0,0
52:05:00,,Yahav Shamir (GWD Minden) mit einer Parade.,SC DHfK Leipzig,GWD Minden,0,0,0,0,0,0,0,0
51:54:00,,"Gute Torchance, aber Sime Ivic (SC DHfK Leipzig) kann diese nicht erfolgreich verwandeln.",SC DHfK Leipzig,GWD Minden,0,0,0,0,0,0,0,0
51:17:00,,Kristian Sæverås (SC DHfK Leipzig) mit einer Parade.,SC DHfK Leipzig,GWD Minden,0,0,0,0,0,0,0,0
51:06:00,28:24:00,Luca Witzke (SC DHfK Leipzig) trifft zum Spielstand von 28:24 in QUARTERBACK Immobilien ARENA.,SC DHfK Leipzig,GWD Minden,0,0,0,0,0,0,0,0
50:41:00,,Moritz Preuss (SC DHfK Leipzig) scheitert am Torwart Yahav Shamir (GWD Minden).,SC DHfK Leipzig,GWD Minden,0,0,0,0,0,0,0,0
50:06:00,27:24:00,Tor (6M)! Philipp Ahouansou (GWD Minden) netzt ein zum neuen Spielstand von 27:24.,SC DHfK Leipzig,GWD Minden,0,0,0,0,0,0,0,0
48:27:00,27:23:00,Sime Ivic (SC DHfK Leipzig) überwindet den Torwart von (RM/fern) zum neuen Spielstand von 27:23.,SC DHfK Leipzig,GWD Minden,0,0,0,0,0,0,0,0
47:30:00,26:23:00,Sveinn Johannsson (GWD Minden) überwindet den Torwart zum neuen Spielstand von 26:23.,SC DHfK Leipzig,GWD Minden,0,0,0,0,0,0,0,0
47:13:00,,Auszeit GWD Minden,SC DHfK Leipzig,GWD Minden,0,1,0,0,0,0,0,0
47:10:00,,Der eingewechselte Torwart Yahav Shamir (GWD Minden) steht nun zwischen den Pfosten.,SC DHfK Leipzig,GWD Minden,0,0,0,0,0,0,0,0
46:47:00,26:22:00,"Neuer Spielstand in Leipzig, 26:22 durch den Treffer von Oskar Sunnefeldt für SC DHfK Leipzig.",SC DHfK Leipzig,GWD Minden,0,0,0,0,0,0,0,0
46:05:00,25:22:00,"Neuer Spielstand in Leipzig, 25:22 durch den Treffer 6M von Sveinn Johannsson für GWD Minden.",SC DHfK Leipzig,GWD Minden,0,0,0,0,0,0,0,0
46:02:00,,Zeitstrafe vorbei SC DHfK Leipzig,SC DHfK Leipzig,GWD Minden,0,0,0,0,1,0,0,0
45:53:00,25:21:00,Patrick Wiesmach (SC DHfK Leipzig) trifft von (RA). Neuer Spielstand in QUARTERBACK Immobilien ARENA: 25:21.,SC DHfK Leipzig,GWD Minden,0,0,0,0,1,0,0,0
45:04:00,24:21:00,Tor! Mats Korte (GWD Minden) netzt ein zum neuen Spielstand von 24:21.,SC DHfK Leipzig,GWD Minden,0,0,0,0,1,0,0,0
44:31:00,24:20:00,Oskar Sunnefeldt (SC DHfK Leipzig) trifft zum Spielstand von 24:20 in QUARTERBACK Immobilien ARENA.,SC DHfK Leipzig,GWD Minden,0,0,0,0,1,0,0,0
44:02:00,,Siebter Spieler eingewechselt SC DHfK Leipzig,SC DHfK Leipzig,GWD Minden,0,0,1,0,1,0,0,0
43:53:00,,Mathias Bitsch von GWD Minden unterläuft ein technischer Fehler. Der Ballbesitz wechselt.,SC DHfK Leipzig,GWD Minden,0,0,0,0,1,0,0,0
43:47:00,,Matej Klima (SC DHfK Leipzig) erhält eine Zeitstrafe und hat nun zwei Minuten Zeit sich auf der Bank zu beruhigen.,SC DHfK Leipzig,GWD Minden,0,0,0,0,1,0,0,1
43:27:00,,Überragende Parade des Torwarts Kristian Sæverås (SC DHfK Leipzig)! Mathias Bitsch kann den Ball nicht im Tor unterbringen!,SC DHfK Leipzig,GWD Minden,0,0,0,0,0,0,0,0
42:43:00,23:20,Tor (6M)! Lukas Binder (SC DHfK Leipzig) netzt ein zum neuen Spielstand von 23:20.,SC DHfK Leipzig,GWD Minden,0,0,0,0,0,0,0,0
42:34:00,,Niclas Pieczkowski (GWD Minden) trifft von (RM/fern). Neuer Spielstand in QUARTERBACK Immobilien ARENA: 22:20.,SC DHfK Leipzig,GWD Minden,0,0,0,0,0,0,0,0
41:48:00,22:19,Sime Ivic (SC DHfK Leipzig) überwindet den Torwart zum neuen Spielstand von 22:19.,SC DHfK Leipzig,GWD Minden,0,0,0,0,0,0,0,0
40:53:00,,"Der Torwart von SC DHfK Leipzig, Kristian Sæverås hält den Wurf von Sveinn Johannsson.",SC DHfK Leipzig,GWD Minden,0,0,0,0,0,0,0,0
40:48:00,,Kristian Sæverås (SC DHfK Leipzig) hält den Wurf von Mathias Bitsch.,SC DHfK Leipzig,GWD Minden,0,0,0,0,0,0,0,0
39:59:00,,"Der Torwart von SC DHfK Leipzig, Kristian Sæverås pariert den Wurf.",SC DHfK Leipzig,GWD Minden,0,0,0,0,0,0,0,0
39:20:00,21:19,Patrick Wiesmach (SC DHfK Leipzig) überwindet den Torwart von (RA) zum neuen Spielstand von 21:19.,SC DHfK Leipzig,GWD Minden,0,0,0,0,0,0,0,0
39:13:00,,Besard Hakaj (GWD Minden) trifft nur den Pfosten.,SC DHfK Leipzig,GWD Minden,0,0,0,0,0,0,0,0
39:03:00,,"Der Torwart von GWD Minden, Malte Semisch hält den Wurf von Lukas Binder.",SC DHfK Leipzig,GWD Minden,0,0,0,0,0,0,0,0
38:02:00,20:19,Tor! Sime Ivic (SC DHfK Leipzig) netzt ein zum neuen Spielstand von 20:19.,SC DHfK Leipzig,GWD Minden,0,0,0,0,0,0,0,0
36:59:00,19:19,"Neuer Spielstand in Leipzig, 19:19 durch den Treffer RR/fern von Niclas Pieczkowski für GWD Minden.",SC DHfK Leipzig,GWD Minden,0,0,0,0,0,0,0,0
36:13:00,19:18,"Neuer Spielstand in Leipzig, 19:18 durch den Treffer von Matej Klima für SC DHfK Leipzig.",SC DHfK Leipzig,GWD Minden,0,0,0,0,0,0,0,0
35:33:00,18:18,Tor (6M)! Mathias Bitsch (GWD Minden) netzt ein zum neuen Spielstand von 18:18.,SC DHfK Leipzig,GWD Minden,0,0,0,0,0,0,0,0
34:49:00,18:17,Luca Witzke (SC DHfK Leipzig) überwindet den Torwart von (6M) zum neuen Spielstand von 18:17.,SC DHfK Leipzig,GWD Minden,0,0,0,0,0,0,0,0
34:13:00,17:17,Mohamed Amine Darmoul (GWD Minden) trifft von der 7-Meter Linie und bringt den Spielstand auf 17:17.,SC DHfK Leipzig,GWD Minden,0,0,0,0,0,0,0,0
33:38:00,17:16,"Neuer Spielstand in Leipzig, 17:16 durch den Treffer RM/fern von Luca Witzke für SC DHfK Leipzig.",SC DHfK Leipzig,GWD Minden,0,0,0,0,0,0,0,0
32:39:00,16:16,Mats Korte (GWD Minden) überwindet den Torwart zum neuen Spielstand von 16:16.,SC DHfK Leipzig,GWD Minden,0,0,0,0,0,0,0,0
32:32:00,,Matej Klima von SC DHfK Leipzig unterläuft ein technischer Fehler. Der Ballbesitz wechselt.,SC DHfK Leipzig,GWD Minden,0,0,0,0,0,0,0,0
31:58:00,16:15,"Neuer Spielstand in Leipzig, 16:15 durch den Treffer von Besard Hakaj für GWD Minden.",SC DHfK Leipzig,GWD Minden,0,0,0,0,0,0,0,0
31:18:00,16:14,"Tor von der 7-Meter Linie von Lucas Krzikalla (SC DHfK Leipzig), neuer Spielstand 16:14.",SC DHfK Leipzig,GWD Minden,0,0,0,0,0,0,0,0
,,HALBZEIT (15:14),SC DHfK Leipzig,GWD Minden,0,0,0,0,0,0,0,0
29:32:00,15:14,Besard Hakaj (GWD Minden) trifft zum Spielstand von 15:14 in QUARTERBACK Immobilien ARENA.,SC DHfK Leipzig,GWD Minden,0,0,0,0,0,0,0,0
29:30:00,,Der Wurfversuch von Luka Sebetic (GWD Minden) wurde durch einen Block von Maciej Gebala verhindert.,SC DHfK Leipzig,GWD Minden,0,0,0,0,0,0,0,0
28:58:00,,Zeitstrafe vorbei GWD Minden,SC DHfK Leipzig,GWD Minden,0,0,0,0,0,1,0,0
28:48:00,,Siebter Spieler eingewechselt GWD Minden,SC DHfK Leipzig,GWD Minden,0,0,0,1,0,1,0,0
28:39:00,,Der Strafwurf von Sime Ivic wurde von Malte Semisch (GWD Minden) gehalten.,SC DHfK Leipzig,GWD Minden,0,0,0,0,0,1,0,0
27:16:00,,Siebter Spieler eingewechselt GWD Minden,SC DHfK Leipzig,GWD Minden,0,0,0,1,0,1,0,0
27:03:00,15:13,Luca Witzke (SC DHfK Leipzig) trifft von (6M). Neuer Spielstand in QUARTERBACK Immobilien ARENA: 15:13.,SC DHfK Leipzig,GWD Minden,0,0,0,0,0,1,0,0
27:01:00,,Zeitstrafe vorbei GWD Minden,SC DHfK Leipzig,GWD Minden,0,0,0,0,0,1,0,0
26:56:00,,Doruk Pehlivan geht den Gegner zu stark an. GWD Minden muss nun die nächsten zwei Minuten mit einem Spieler weniger auskommen.,SC DHfK Leipzig,GWD Minden,0,0,0,0,0,1,1,0
26:14:00,,"Der Towart von SC DHfK Leipzig, Kristian Sæverås pariert den gegebenen 7-Meter.",SC DHfK Leipzig,GWD Minden,0,0,0,0,0,1,0,0
25:27:00,,Siebter Spieler eingewechselt GWD Minden,SC DHfK Leipzig,GWD Minden,0,0,0,1,0,1,0,0
25:15:00,14:13,Tor! Patrick Wiesmach (SC DHfK Leipzig) netzt ein zum neuen Spielstand von 14:13.,SC DHfK Leipzig,GWD Minden,0,0,0,0,0,1,0,0
24:58:00,,Sveinn Johannsson (GWD Minden) erhält wegen eines Regelverstoßes eine 2 Minuten Strafe.,SC DHfK Leipzig,GWD Minden,0,0,0,0,0,1,1,0
24:27:00,13:13,Luka Sebetic (GWD Minden) trifft von (6M). Neuer Spielstand in QUARTERBACK Immobilien ARENA: 13:13.,SC DHfK Leipzig,GWD Minden,0,0,0,0,0,0,0,0
23:25,13:12,Mohamed Amine Darmoul (GWD Minden) überwindet den Torwart zum neuen Spielstand von 13:12.,SC DHfK Leipzig,GWD Minden,0,0,0,0,0,0,0,0
22:41,,"Der Torwart von GWD Minden, Malte Semisch pariert den Wurf.",SC DHfK Leipzig,GWD Minden,0,0,0,0,0,0,0,0
22:32,,"Wurf von Mathias Bitsch (GWD Minden), aber der Ball landet nur am Pfosten.",SC DHfK Leipzig,GWD Minden,0,0,0,0,0,0,0,0
22:13,,Auszeit GWD Minden,SC DHfK Leipzig,GWD Minden,0,1,0,0,0,0,0,0
21:59,13:11,Tor (6M)! Patrick Wiesmach (SC DHfK Leipzig) netzt ein zum neuen Spielstand von 13:11.,SC DHfK Leipzig,GWD Minden,0,0,0,0,0,0,0,0
21:01,12:11,Lukas Binder (SC DHfK Leipzig) überwindet den Torwart von (LA) zum neuen Spielstand von 12:11.,SC DHfK Leipzig,GWD Minden,0,0,0,0,0,0,0,0
20:54,,Philipp Ahouansou mit dem Lattenkracher. Was für ein Pech.,SC DHfK Leipzig,GWD Minden,0,0,0,0,0,0,0,0
20:07,,Niclas Heitkamp (SC DHfK Leipzig) scheitert am Torwart Malte Semisch (GWD Minden).,SC DHfK Leipzig,GWD Minden,0,0,0,0,0,0,0,0
19:10,11:11,Mats Korte (GWD Minden) trifft von der 7-Meter Linie.,SC DHfK Leipzig,GWD Minden,0,0,0,0,0,0,0,0
18:29,,Zeitstrafe vorbei GWD Minden,SC DHfK Leipzig,GWD Minden,0,0,0,0,0,1,0,0
18:05,11:10,Lukas Binder (SC DHfK Leipzig) trifft zum Spielstand von 11:10 in QUARTERBACK Immobilien ARENA.,SC DHfK Leipzig,GWD Minden,0,0,0,0,0,1,0,0
18:03,,"Parade des Torwarts von SC DHfK Leipzig, Kristian Sæverås.",SC DHfK Leipzig,GWD Minden,0,0,0,0,0,1,0,0
17:13,,Siebter Spieler eingewechselt GWD Minden,SC DHfK Leipzig,GWD Minden,0,0,0,1,0,1,0,0
16:59,10:10,Tor! Luca Witzke (SC DHfK Leipzig) netzt ein zum neuen Spielstand von 10:10.,SC DHfK Leipzig,GWD Minden,0,0,0,0,0,1,0,0
16:22,,"Nach einem harten Foul hat Sveinn Johannsson (GWD Minden) nun zwei Minuten Zeit, um sich auszuruhen.",SC DHfK Leipzig,GWD Minden,0,0,0,0,0,1,1,0
16:08,,Auszeit SC DHfK Leipzig,SC DHfK Leipzig,GWD Minden,1,0,0,0,0,0,0,0
15:50,,"Neuer Spielstand in Leipzig, 9:10 durch den Treffer 6M von Sveinn Johannsson für GWD Minden.",SC DHfK Leipzig,GWD Minden,0,0,0,0,0,0,0,0
15:19,,Malte Semisch (GWD Minden) mit einer Parade.,SC DHfK Leipzig,GWD Minden,0,0,0,0,0,0,0,0
15:06,,Fehlwurf von Niclas Pieczkowski (GWD Minden).,SC DHfK Leipzig,GWD Minden,0,0,0,0,0,0,0,0
14:00,,Zeitstrafe vorbei SC DHfK Leipzig,SC DHfK Leipzig,GWD Minden,0,0,0,0,1,0,0,0
13:53,9:09,"Neuer Spielstand in Leipzig, 9:9 durch den Treffer von Maciej Gebala für SC DHfK Leipzig.",SC DHfK Leipzig,GWD Minden,0,0,0,0,1,0,0,0
13:22,,Siebter Spieler eingewechselt SC DHfK Leipzig,SC DHfK Leipzig,GWD Minden,0,0,1,0,1,0,0,0
13:09,,"Philipp Ahouansou (6M) wirft, jedoch neben das Tor.",SC DHfK Leipzig,GWD Minden,0,0,0,0,1,0,0,0
12:47,,Maciej Gebala von SC DHfK Leipzig unterläuft ein technischer Fehler. Der Ballbesitz wechselt.,SC DHfK Leipzig,GWD Minden,0,0,0,0,1,0,0,0
12:27,,Siebter Spieler eingewechselt SC DHfK Leipzig,SC DHfK Leipzig,GWD Minden,0,0,1,0,1,0,0,0
12:14,8:09,Sveinn Johannsson (GWD Minden) überwindet den Torwart zum neuen Spielstand von 8:9.,SC DHfK Leipzig,GWD Minden,0,0,0,0,1,0,0,0
11:58,,2-Minuten-Strafe für Patrick Wiesmach. SC DHfK Leipzig muss nun die nächsten zwei Minuten mit einem Spieler weniger auskommen.,SC DHfK Leipzig,GWD Minden,0,0,0,0,1,0,0,1
11:57,,Malte Semisch (GWD Minden) hält den Wurf von Patrick Wiesmach.,SC DHfK Leipzig,GWD Minden,0,0,0,0,0,0,0,0
10:51,8:08,Besard Hakaj (GWD Minden) trifft von (6M). Neuer Spielstand in QUARTERBACK Immobilien ARENA: 8:8.,SC DHfK Leipzig,GWD Minden,0,0,0,0,0,0,0,0
8:08,7:06,Tor! Philipp Ahouansou (GWD Minden) netzt ein zum neuen Spielstand von 7:6.,SC DHfK Leipzig,GWD Minden,0,0,0,0,0,0,0,0
7:58,6:04,7:58 Der Wurf von Matej Klima (SC DHfK Leipzig) landet hinter dem Tor.,SC DHfK Leipzig,GWD Minden,0,0,0,0,0,0,0,0
6:26,,Tor (6M)! Philipp Ahouansou (GWD Minden) netzt ein zum neuen Spielstand von 6:4.,SC DHfK Leipzig,GWD Minden,0,0,0,0,0,0,0,0
5:49,,5:49 Der Wurf von Matej Klima (SC DHfK Leipzig) landet hinter dem Tor.,SC DHfK Leipzig,GWD Minden,0,0,0,0,0,0,0,0
5:40,,Fehlwurf von Philipp Ahouansou (GWD Minden).,SC DHfK Leipzig,GWD Minden,0,0,0,0,0,0,0,0
5:29,5:03,Tor! Oskar Sunnefeldt (SC DHfK Leipzig) netzt ein zum neuen Spielstand von 5:3.,SC DHfK Leipzig,GWD Minden,0,0,0,0,0,0,0,0
4:54,4:03,"Neuer Spielstand in Leipzig, 4:3 durch den Treffer 6M von Mathias Bitsch für GWD Minden.",SC DHfK Leipzig,GWD Minden,0,0,0,0,0,0,0,0
4:46,4:02,"Neuer Spielstand in Leipzig, 4:2 durch den Treffer von Luca Witzke für SC DHfK Leipzig.",SC DHfK Leipzig,GWD Minden,0,0,0,0,0,0,0,0
4:36,,Überragende Parade des Torwarts Kristian Sæverås (SC DHfK Leipzig)! Niclas Pieczkowski kann den Ball nicht im Tor unterbringen!,SC DHfK Leipzig,GWD Minden,0,0,0,0,0,0,0,0
4:26,,"Gute Torchance, aber Matej Klima (SC DHfK Leipzig) kann diese nicht erfolgreich verwandeln.",SC DHfK Leipzig,GWD Minden,0,0,0,0,0,0,0,0
3:54,,Parade von Torwart Kristian Sæverås (SC DHfK Leipzig).,SC DHfK Leipzig,GWD Minden,0,0,0,0,0,0,0,0
3:20,3:02,Lukas Binder (SC DHfK Leipzig) überwindet den Torwart zum neuen Spielstand von 3:2.,SC DHfK Leipzig,GWD Minden,0,0,0,0,0,0,0,0
2:59,,Zupanovic/Thone verwarnen Simon Ernst (SC DHfK Leipzig) mit einer Gelben Karte.,SC DHfK Leipzig,GWD Minden,0,0,0,0,0,0,0,0
2:11,2:02,Lukas Binder (SC DHfK Leipzig) trifft zum Spielstand von 2:2 in QUARTERBACK Immobilien ARENA.,SC DHfK Leipzig,GWD Minden,0,0,0,0,0,0,0,0
1:16,,Philipp Ahouansou (GWD Minden) trifft von (RL/fern). Neuer Spielstand in QUARTERBACK Immobilien ARENA: 1:2.,SC DHfK Leipzig,GWD Minden,0,0,0,0,0,0,0,0
1:05,1:01,Luca Witzke (SC DHfK Leipzig) überwindet den Torwart von (6M) zum neuen Spielstand von 1:1.,SC DHfK Leipzig,GWD Minden,0,0,0,0,0,0,0,0
0:54,0:01,Tor (6M)! Niclas Pieczkowski (GWD Minden) netzt ein zum neuen Spielstand von 0:1.,SC DHfK Leipzig,GWD Minden,0,0,0,0,0,0,0,0
0:36,,"Niclas Pieczkowski (RM/fern) wirft, jedoch neben das Tor.",SC DHfK Leipzig,GWD Minden,0,0,0,0,0,0,0,0