Time,Score,Event.Description,Hometeam,Awayteam,Timeout_Hometeam,Timeout_Awayteam,SeventhPlayer_Hometeam,SeventhPlayer_Awayteam,SixthPlayer_Hometeam,SixthPlayer_Awayteam,Penalty_Awayteam,Penalty_Hometeam
59:58:00,,"Tor! Es war Mathias Gidsel (Füchse Berlin), der das Tor von Max Darj vorbereitete.",SC Magdeburg,Füchse Berlin,0,0,0,0,0,0,0,0
59:46:00,,Kay Smits von SC Magdeburg unterläuft ein technischer Fehler. Der Ballbesitz wechselt.,SC Magdeburg,Füchse Berlin,0,0,0,0,0,0,0,0
58:56:00,,Mathias Gidsel (Füchse Berlin) tankt sich durch und erzielt einen Treffer zum 34:28.,SC Magdeburg,Füchse Berlin,0,0,0,0,0,0,0,0
58:15:00,34:27:00,Tor für SC Magdeburg durch Lukas Mertens nach einem Pass von Philipp Weber.,SC Magdeburg,Füchse Berlin,0,0,0,0,0,0,0,0
57:21:00,,"Max Darj (6M) wirft, jedoch neben das Tor.",SC Magdeburg,Füchse Berlin,0,0,0,0,0,0,0,0
56:56:00,34:26:00,"Tor! Es war Gisli Thorgeir Kristjansson (SC Magdeburg), der das Tor von Oscar Bergendahl vorbereitete.",SC Magdeburg,Füchse Berlin,0,0,0,0,0,0,0,0
56:55:00,,Zeitstrafe vorbei SC Magdeburg,SC Magdeburg,Füchse Berlin,0,0,0,0,1,0,0,0
54:50:00,33:26:00,Die Vorbereitung von Fabian Wiede (Füchse Berlin) führt zum Treffer durch Robert Weber.,SC Magdeburg,Füchse Berlin,0,0,0,0,1,0,0,0
54:41:00,,Oscar Bergendahl von SC Magdeburg unterläuft ein technischer Fehler. Der Ballbesitz wechselt.,SC Magdeburg,Füchse Berlin,0,0,0,0,1,0,0,0
54:24:00,,Siebter Spieler eingewechselt SC Magdeburg,SC Magdeburg,Füchse Berlin,0,0,1,0,1,0,0,0
54:12:00,32:26:00,"Tor von der 7-Meter Linie von Robert Weber (Füchse Berlin), neuer Spielstand 32:26.",SC Magdeburg,Füchse Berlin,0,0,0,0,1,0,0,0
54:10:00,,Tim Hornke (SC Magdeburg) erhält eine 2 Minuten Strafe.,SC Magdeburg,Füchse Berlin,0,0,0,0,1,0,0,1
53:43:00,32:25:00,Kay Smits (SC Magdeburg) überwindet den Torwart von (RM/fern) zum neuen Spielstand von 32:25.,SC Magdeburg,Füchse Berlin,0,0,0,0,0,0,0,0
53:20:00,,Auszeit SC Magdeburg,SC Magdeburg,Füchse Berlin,1,0,0,0,0,0,0,0
53:03:00,31:25:00,Tor! Fabian Wiede (Füchse Berlin) netzt ein zum neuen Spielstand von 31:25.,SC Magdeburg,Füchse Berlin,0,0,0,0,0,0,0,0
52:53:00,,Kay Smits von SC Magdeburg unterläuft ein technischer Fehler. Der Ballbesitz wechselt.,SC Magdeburg,Füchse Berlin,0,0,0,0,0,0,0,0
52:38:00,,Mike Jensen (SC Magdeburg) wurde soeben eingewechselt und soll nun die Abwehr stabilisieren.,SC Magdeburg,Füchse Berlin,0,0,0,0,0,0,0,0
52:21:00,31:24:00,"Neuer Spielstand in Magdeburg, 31:24 durch den Treffer von Robert Weber für Füchse Berlin.",SC Magdeburg,Füchse Berlin,0,0,0,0,0,0,0,0
51:44:00,31:23:00,Gisli Thorgeir Kristjansson (SC Magdeburg) trifft von (RM/fern). Neuer Spielstand in GETEC Arena: 31:23.,SC Magdeburg,Füchse Berlin,0,0,0,0,0,0,0,0
51:07:00,30:23:00,Tor! Fabian Wiede (Füchse Berlin) netzt ein zum neuen Spielstand von 30:23.,SC Magdeburg,Füchse Berlin,0,0,0,0,0,0,0,0
50:57:00,,"Der Torwart von Füchse Berlin, Dejan Milosavljev pariert den Wurf.",SC Magdeburg,Füchse Berlin,0,0,0,0,0,0,0,0
50:19:00,30:22:00,"Neuer Spielstand in Magdeburg, 30:22 durch den Treffer LA von Milos Vujovic für Füchse Berlin.",SC Magdeburg,Füchse Berlin,0,0,0,0,0,0,0,0
49:46:00,,Gisli Thorgeir Kristjansson von SC Magdeburg unterläuft ein technischer Fehler. Der Ballbesitz wechselt.,SC Magdeburg,Füchse Berlin,0,0,0,0,0,0,0,0
48:46:00,30:21:00,"Neuer Spielstand in Magdeburg, 30:21 durch den Treffer von Jacob Holm für Füchse Berlin.",SC Magdeburg,Füchse Berlin,0,0,0,0,0,0,0,0
48:44:00,30:20:00,Gisli Thorgeir Kristjansson (SC Magdeburg) überwindet den Torwart von (6M) zum neuen Spielstand von 30:20.,SC Magdeburg,Füchse Berlin,0,0,0,0,0,0,0,0
47:46:00,29:20:00,Tor (RM/fern)! Mathias Gidsel (Füchse Berlin) netzt ein zum neuen Spielstand von 29:20.,SC Magdeburg,Füchse Berlin,0,0,0,0,0,0,0,0
47:19:00,29:19:00,Philipp Weber (SC Magdeburg) trifft von (6M). Neuer Spielstand in GETEC Arena: 29:19.,SC Magdeburg,Füchse Berlin,0,0,0,0,0,0,0,0
46:45:00,28:19:00,Robert Weber (Füchse Berlin) überwindet den Torwart zum neuen Spielstand von 28:19.,SC Magdeburg,Füchse Berlin,0,0,0,0,0,0,0,0
46:33:00,28:18:00,Gisli Thorgeir Kristjansson (SC Magdeburg) trifft zum Spielstand von 28:18 in GETEC Arena.,SC Magdeburg,Füchse Berlin,0,0,0,0,0,0,0,0
46:08:00,,Nun wird Nikola Portner für SC Magdeburg im Tor stehen.,SC Magdeburg,Füchse Berlin,0,0,0,0,0,0,0,0
45:55:00,27:18:00,Der 7-Meter wurde von Robert Weber (Füchse Berlin) erfolgreich verwandelt.,SC Magdeburg,Füchse Berlin,0,0,0,0,0,0,0,0
45:49:00,,Yves Grafenhorst von SC Magdeburg wurde mit der Gelben Karte von Reich/Brodbeck verwarnt.,SC Magdeburg,Füchse Berlin,0,0,0,0,0,0,0,0
45:45:00,,Der eingewechselte Torwart Mike Jensen (SC Magdeburg) steht nun zwischen den Pfosten.,SC Magdeburg,Füchse Berlin,0,0,0,0,0,0,0,0
45:19:00,27:17:00,"Neuer Spielstand in Magdeburg, 27:17 durch den Treffer von Tim Hornke für SC Magdeburg.",SC Magdeburg,Füchse Berlin,0,0,0,0,0,0,0,0
44:41:00,26:17:00,Jacob Holm (Füchse Berlin) legt den Treffer von Milos Vujovic auf. Es steht 26:17.,SC Magdeburg,Füchse Berlin,0,0,0,0,0,0,0,0
44:07:00,26:16:00,Oscar Bergendahl (SC Magdeburg) trifft zum Spielstand von 26:16 in GETEC Arena.,SC Magdeburg,Füchse Berlin,0,0,0,0,0,0,0,0
43:30:00,25:16:00,Jacob Holm (Füchse Berlin) überwindet den Torwart zum neuen Spielstand von 25:16.,SC Magdeburg,Füchse Berlin,0,0,0,0,0,0,0,0
43:19:00,,Auszeit Füchse Berlin,SC Magdeburg,Füchse Berlin,0,1,0,0,0,0,0,0
43:03:00,25:15:00,Kay Smits (SC Magdeburg) trifft von (6M). Neuer Spielstand in GETEC Arena: 25:15.,SC Magdeburg,Füchse Berlin,0,0,0,0,0,0,0,0
42:31:00,24:15:00,Tim Hornke (SC Magdeburg) überwindet den Torwart von (RA) zum neuen Spielstand von 24:15.,SC Magdeburg,Füchse Berlin,0,0,0,0,0,0,0,0
42:20:00,,Paul Drux (Füchse Berlin) scheitert am Torwart Nikola Portner (SC Magdeburg).,SC Magdeburg,Füchse Berlin,0,0,0,0,0,0,0,0
41:29:00,23:15,"Tor von der 7-Meter Linie von Kay Smits (SC Magdeburg), neuer Spielstand 23:15.",SC Magdeburg,Füchse Berlin,0,0,0,0,0,0,0,0
40:13:00,22:15,Tor (6M)! Mathias Gidsel (Füchse Berlin) netzt ein zum neuen Spielstand von 22:15.,SC Magdeburg,Füchse Berlin,0,0,0,0,0,0,0,0
39:59:00,,"Wurf von Lukas Mertens (SC Magdeburg), aber der Ball landet nur am Pfosten.",SC Magdeburg,Füchse Berlin,0,0,0,0,0,0,0,0
39:28:00,,Zeitstrafe vorbei SC Magdeburg,SC Magdeburg,Füchse Berlin,0,0,0,0,1,0,0,0
39:26:00,,Siebter Spieler eingewechselt SC Magdeburg,SC Magdeburg,Füchse Berlin,0,0,1,0,1,0,0,0
39:22:00,22:14,Tor! Paul Drux (Füchse Berlin) netzt ein zum neuen Spielstand von 22:14.,SC Magdeburg,Füchse Berlin,0,0,0,0,1,0,0,0
39:12:00,,Auszeit Füchse Berlin,SC Magdeburg,Füchse Berlin,0,1,0,0,1,0,0,0
39:10:00,,Torwartwechsel bei Füchse Berlin. Dejan Milosavljev kommt für Victor Kireev.,SC Magdeburg,Füchse Berlin,0,0,0,0,1,0,0,0
39:05:00,22:13,"Neuer Spielstand in Magdeburg, 22:13 durch den Treffer 6M von Gisli Thorgeir Kristjansson für SC Magdeburg.",SC Magdeburg,Füchse Berlin,0,0,0,0,1,0,0,0
38:35:00,,Siebter Spieler eingewechselt SC Magdeburg,SC Magdeburg,Füchse Berlin,0,0,1,0,1,0,0,0
38:22:00,,Parade von Torwart Nikola Portner (SC Magdeburg).,SC Magdeburg,Füchse Berlin,0,0,0,0,1,0,0,0
38:09:00,21:13,Tor (6M)! Gisli Thorgeir Kristjansson (SC Magdeburg) netzt ein zum neuen Spielstand von 21:13.,SC Magdeburg,Füchse Berlin,0,0,0,0,1,0,0,0
38:04:00,,Siebter Spieler eingewechselt SC Magdeburg,SC Magdeburg,Füchse Berlin,0,0,1,0,1,0,0,0
38:02:00,,Nikola Portner (SC Magdeburg) wurde soeben eingewechselt und soll nun die Abwehr stabilisieren.,SC Magdeburg,Füchse Berlin,0,0,0,0,1,0,0,0
37:32:00,,Mike Jensen (SC Magdeburg) bleibt Sieger im 7-Meter-Duell gegen Milos Vujovic (Füchse Berlin).,SC Magdeburg,Füchse Berlin,0,0,0,0,1,0,0,0
37:27:00,,SC Magdeburg wechselt den Torwart. Mike Jensen kommt für Nikola Portner.,SC Magdeburg,Füchse Berlin,0,0,0,0,1,0,0,0
37:27:00,,Oscar Bergendahl geht den Gegner zu stark an. SC Magdeburg muss nun die nächsten zwei Minuten mit einem Spieler weniger auskommen.,SC Magdeburg,Füchse Berlin,0,0,0,0,1,0,0,1
37:15:00,20:13,Lukas Mertens (SC Magdeburg) trifft von (6M). Neuer Spielstand in GETEC Arena: 20:13.,SC Magdeburg,Füchse Berlin,0,0,0,0,0,0,0,0
36:41:00,19:13,Kay Smits (SC Magdeburg) trifft von der 7-Meter Linie.,SC Magdeburg,Füchse Berlin,0,0,0,0,0,0,0,0
36:22:00,18:13,Robert Weber (Füchse Berlin) überwindet den Torwart von (RA) zum neuen Spielstand von 18:13.,SC Magdeburg,Füchse Berlin,0,0,0,0,0,0,0,0
35:51:00,,Gisli Thorgeir Kristjansson von SC Magdeburg unterläuft ein technischer Fehler. Der Ballbesitz wechselt.,SC Magdeburg,Füchse Berlin,0,0,0,0,0,0,0,0
35:46:00,,"Parade des Torwarts von SC Magdeburg, Nikola Portner.",SC Magdeburg,Füchse Berlin,0,0,0,0,0,0,0,0
34:37:00,,"Der Trainer von Füchse Berlin, Jaron Siewert stellt nun Victor Kireev zwischen die Pfosten.",SC Magdeburg,Füchse Berlin,0,0,0,0,0,0,0,0
34:20:00,18:12,Gisli Thorgeir Kristjansson (SC Magdeburg) trifft zum Spielstand von 18:12 in GETEC Arena.,SC Magdeburg,Füchse Berlin,0,0,0,0,0,0,0,0
33:44:00,17:12,"Neuer Spielstand in Magdeburg, 17:12 durch den Treffer von Mijajlo Marsenic für Füchse Berlin.",SC Magdeburg,Füchse Berlin,0,0,0,0,0,0,0,0
33:01:00,17:11,Tor! Gisli Thorgeir Kristjansson (SC Magdeburg) netzt ein zum neuen Spielstand von 17:11.,SC Magdeburg,Füchse Berlin,0,0,0,0,0,0,0,0
32:52:00,,Robert Weber von Füchse Berlin unterläuft ein technischer Fehler. Der Ballbesitz wechselt.,SC Magdeburg,Füchse Berlin,0,0,0,0,0,0,0,0
32:45:00,,Der Wurf von SC Magdeburg wurde geblockt.,SC Magdeburg,Füchse Berlin,0,0,0,0,0,0,0,0
31:20:00,16:11,Der 7-Meter wurde von Kay Smits (SC Magdeburg) erfolgreich verwandelt.,SC Magdeburg,Füchse Berlin,0,0,0,0,0,0,0,0
30:14:00,,Zeitstrafe vorbei SC Magdeburg,SC Magdeburg,Füchse Berlin,0,0,0,0,1,0,0,0
30:02:00,,Siebter Spieler eingewechselt SC Magdeburg,SC Magdeburg,Füchse Berlin,0,0,1,0,1,0,0,0
Halft,15:11,,SC Magdeburg,Füchse Berlin,0,0,0,0,1,0,0,0
29:58:00,,Nikola Portner (SC Magdeburg) mit einer Parade.,SC Magdeburg,Füchse Berlin,0,0,0,0,1,0,0,0
28:38:00,,Überragende Parade des Torwarts Nikola Portner (SC Magdeburg)! Max Darj kann den Ball nicht im Tor unterbringen!,SC Magdeburg,Füchse Berlin,0,0,0,0,1,0,0,0
28:25:00,,Zeitstrafe vorbei Füchse Berlin,SC Magdeburg,Füchse Berlin,0,0,0,0,1,1,0,0
28:13:00,,Es gibt eine 2 Minuten Strafe für Vladan Lipovina (SC Magdeburg).,SC Magdeburg,Füchse Berlin,0,0,0,0,1,1,0,1
28:12:00,,Auszeit SC Magdeburg,SC Magdeburg,Füchse Berlin,1,0,0,0,0,1,0,0
27:37:00,,Siebter Spieler eingewechselt Füchse Berlin,SC Magdeburg,Füchse Berlin,0,0,0,1,0,1,0,0
27:25:00,15:11,"Neuer Spielstand in Magdeburg, 15:11 durch den Treffer 6M von Tim Hornke für SC Magdeburg.",SC Magdeburg,Füchse Berlin,0,0,0,0,0,1,0,0
27:16:00,,Nikola Portner (SC Magdeburg) mit einer Parade.,SC Magdeburg,Füchse Berlin,0,0,0,0,0,1,0,0
26:35:00,,Siebter Spieler eingewechselt Füchse Berlin,SC Magdeburg,Füchse Berlin,0,0,0,1,0,1,0,0
26:27:00,14:11,Kay Smits (SC Magdeburg) trifft von der 7-Meter Linie und bringt den Spielstand auf 14:11.,SC Magdeburg,Füchse Berlin,0,0,0,0,0,1,0,0
26:22:00,,Marko Kopljar (Füchse Berlin) erhält eine 2 Minuten Strafe.,SC Magdeburg,Füchse Berlin,0,0,0,0,0,1,1,0
26:03:00,,"Der Torwart von Füchse Berlin, Dejan Milosavljev hält den Wurf von Gisli Thorgeir Kristjansson.",SC Magdeburg,Füchse Berlin,0,0,0,0,0,0,0,0
25:28:00,,Mathias Gidsel von Füchse Berlin unterläuft ein technischer Fehler. Der Ballbesitz wechselt.,SC Magdeburg,Füchse Berlin,0,0,0,0,0,0,0,0
25:11:00,,"Parade des Torwarts von Füchse Berlin, Dejan Milosavljev.",SC Magdeburg,Füchse Berlin,0,0,0,0,0,0,0,0
25:06:00,,"Der Torwart von Füchse Berlin, Dejan Milosavljev hält den Wurf von Gisli Thorgeir Kristjansson.",SC Magdeburg,Füchse Berlin,0,0,0,0,0,0,0,0
24:50:00,,Zeitstrafe vorbei SC Magdeburg,SC Magdeburg,Füchse Berlin,0,0,0,0,1,0,0,0
24:33:00,13:11,Milos Vujovic (Füchse Berlin) überwindet den Torwart zum neuen Spielstand von 13:11.,SC Magdeburg,Füchse Berlin,0,0,0,0,1,0,0,0
24:12:00,13:10,Lukas Mertens (SC Magdeburg) trifft von (6M). Neuer Spielstand in GETEC Arena: 13:10.,SC Magdeburg,Füchse Berlin,0,0,0,0,1,0,0,0
24:05:00,,Nikola Portner (SC Magdeburg) mit einer Parade.,SC Magdeburg,Füchse Berlin,0,0,0,0,1,0,0,0
23:45,12:10,Tor (6M)! Lucas Meister (SC Magdeburg) netzt ein zum neuen Spielstand von 12:10.,SC Magdeburg,Füchse Berlin,0,0,0,0,1,0,0,0
22:49,11:10,Mathias Gidsel (Füchse Berlin) trifft zum Spielstand von 11:10 in GETEC Arena.,SC Magdeburg,Füchse Berlin,0,0,0,0,1,0,0,0
22:48,,Oscar Bergendahl (SC Magdeburg) erhält wegen eines Regelverstoßes eine 2 Minuten Strafe.,SC Magdeburg,Füchse Berlin,0,0,0,0,1,0,0,1
22:03,,Auszeit Füchse Berlin,SC Magdeburg,Füchse Berlin,0,1,0,0,0,0,0,0
22:03,11:09,"Neuer Spielstand in Magdeburg, 11:9 durch den Treffer 6M von Lukas Mertens für SC Magdeburg.",SC Magdeburg,Füchse Berlin,0,0,0,0,0,0,0,0
21:53,,Überragende Parade des Torwarts Dejan Milosavljev (Füchse Berlin)! Philipp Weber kann den Ball nicht im Tor unterbringen!,SC Magdeburg,Füchse Berlin,0,0,0,0,0,0,0,0
21:45,10:09,"Neuer Spielstand in Magdeburg, 10:9 durch den Treffer von Kay Smits für SC Magdeburg.",SC Magdeburg,Füchse Berlin,0,0,0,0,0,0,0,0
21:05,,"Der Torwart von SC Magdeburg, Nikola Portner pariert den Wurf.",SC Magdeburg,Füchse Berlin,0,0,0,0,0,0,0,0
20:57,,Tim Hornke von SC Magdeburg unterläuft ein technischer Fehler. Der Ballbesitz wechselt.,SC Magdeburg,Füchse Berlin,0,0,0,0,0,0,0,0
20:48,,Jacob Holm von Füchse Berlin unterläuft ein technischer Fehler. Der Ballbesitz wechselt.,SC Magdeburg,Füchse Berlin,0,0,0,0,0,0,0,0
20:30,9:09,Tor! Tim Hornke (SC Magdeburg) netzt ein zum neuen Spielstand von 9:9.,SC Magdeburg,Füchse Berlin,0,0,0,0,0,0,0,0
19:58,,Zeitstrafe vorbei SC Magdeburg,SC Magdeburg,Füchse Berlin,0,0,0,0,1,0,0,0
19:49,8:09,Jacob Holm (Füchse Berlin) überwindet den Torwart von (6M) zum neuen Spielstand von 8:9.,SC Magdeburg,Füchse Berlin,0,0,0,0,1,0,0,0
19:23,,Dejan Milosavljev (Füchse Berlin) mit einer Parade.,SC Magdeburg,Füchse Berlin,0,0,0,0,1,0,0,0
18:30,,Siebter Spieler eingewechselt SC Magdeburg,SC Magdeburg,Füchse Berlin,0,0,1,0,1,0,0,0
18:17,8:08,Tor (6M)! Milos Vujovic (Füchse Berlin) netzt ein zum neuen Spielstand von 8:8.,SC Magdeburg,Füchse Berlin,0,0,0,0,1,0,0,0
18:11,,Jacob Holm (Füchse Berlin) scheitert am Torwart Nikola Portner (SC Magdeburg).,SC Magdeburg,Füchse Berlin,0,0,0,0,1,0,0,0
17:57,,2-Minuten-Strafe für Lucas Meister. SC Magdeburg muss nun die nächsten zwei Minuten mit einem Spieler weniger auskommen.,SC Magdeburg,Füchse Berlin,0,0,0,0,1,0,0,1
17:25,8:07,Christian O'Sullivan (SC Magdeburg) überwindet den Torwart zum neuen Spielstand von 8:7.,SC Magdeburg,Füchse Berlin,0,0,0,0,0,0,0,0
17:15,,Fehlwurf von Jacob Holm (Füchse Berlin).,SC Magdeburg,Füchse Berlin,0,0,0,0,0,0,0,0
16:49,7:07,Oscar Bergendahl (SC Magdeburg) trifft von (6M). Neuer Spielstand in GETEC Arena: 7:7.,SC Magdeburg,Füchse Berlin,0,0,0,0,0,0,0,0
16:38,6:07,Tor! Mathias Gidsel (Füchse Berlin) netzt ein zum neuen Spielstand von 6:7.,SC Magdeburg,Füchse Berlin,0,0,0,0,0,0,0,0
15:50,,Parade von Torwart Nikola Portner (SC Magdeburg).,SC Magdeburg,Füchse Berlin,0,0,0,0,0,0,0,0
15:19,,Reich/Brodbeck verwarnen Christian O'Sullivan (SC Magdeburg) mit einer Gelben Karte.,SC Magdeburg,Füchse Berlin,0,0,0,0,0,0,0,0
14:56,,Zeitstrafe vorbei Füchse Berlin,SC Magdeburg,Füchse Berlin,0,0,0,0,0,1,0,0
13:55,,Es gibt Gelb für Oscar Bergendahl (SC Magdeburg) von Reich/Brodbeck.,SC Magdeburg,Füchse Berlin,0,0,0,0,0,1,0,0
13:16,,Siebter Spieler eingewechselt Füchse Berlin,SC Magdeburg,Füchse Berlin,0,0,0,1,0,1,0,0
13:10,6:06,"Neuer Spielstand in Magdeburg, 6:6 durch den Treffer von Kay Smits für SC Magdeburg.",SC Magdeburg,Füchse Berlin,0,0,0,0,0,1,0,0
12:56,,"Nach einem harten Foul hat Mathias Gidsel (Füchse Berlin) nun zwei Minuten Zeit, um sich auszuruhen.",SC Magdeburg,Füchse Berlin,0,0,0,0,0,1,1,0
12:13,5:06,"Neuer Spielstand in Magdeburg, 5:6 durch den Treffer RR/fern von Mathias Gidsel für Füchse Berlin.",SC Magdeburg,Füchse Berlin,0,0,0,0,0,0,0,0
10:58,4:05,Paul Drux (Füchse Berlin) trifft zum Spielstand von 4:5 in GETEC Arena.,SC Magdeburg,Füchse Berlin,0,0,0,0,0,0,0,0
10:12,,Zeitstrafe vorbei Füchse Berlin,SC Magdeburg,Füchse Berlin,0,0,0,0,0,1,0,0
9:35,4:04,"Neuer Spielstand in Magdeburg, 4:4 durch den Treffer RM/fern von Mathias Gidsel für Füchse Berlin.",SC Magdeburg,Füchse Berlin,0,0,0,0,0,1,0,0
8:35,,Siebter Spieler eingewechselt Füchse Berlin,SC Magdeburg,Füchse Berlin,0,0,0,1,0,1,0,0
8:23,,"Chance für Tim Hornke (SC Magdeburg), er trifft aber nur den Pfosten.",SC Magdeburg,Füchse Berlin,0,0,0,0,0,1,0,0
8:10,,Marko Kopljar (Füchse Berlin) erhält eine Zeitstrafe und hat nun zwei Minuten Zeit sich auf der Bank zu beruhigen.,SC Magdeburg,Füchse Berlin,0,0,0,0,0,1,1,0
8:10,,Marko Kopljar (Füchse Berlin) bekommt die Gelbe Karte von Reich/Brodbeck gezeigt.,SC Magdeburg,Füchse Berlin,0,0,0,0,0,0,0,0
6:47,4:03,Milos Vujovic (Füchse Berlin) trifft von (LA). Neuer Spielstand in GETEC Arena: 4:3.,SC Magdeburg,Füchse Berlin,0,0,0,0,0,0,0,0
6:11,,Oscar Bergendahl von SC Magdeburg unterläuft ein technischer Fehler. Der Ballbesitz wechselt.,SC Magdeburg,Füchse Berlin,0,0,0,0,0,0,0,0
5:20,,Nikola Portner (SC Magdeburg) hält den Wurf von Milos Vujovic.,SC Magdeburg,Füchse Berlin,0,0,0,0,0,0,0,0
4:40,4:02,Gisli Thorgeir Kristjansson (SC Magdeburg) trifft zum Spielstand von 4:2 in GETEC Arena.,SC Magdeburg,Füchse Berlin,0,0,0,0,0,0,0,0
4:03,3:02,"Neuer Spielstand in Magdeburg, 3:2 durch den Treffer von Mijajlo Marsenic für Füchse Berlin.",SC Magdeburg,Füchse Berlin,0,0,0,0,0,0,0,0
3:25,3:01,Tor! Lukas Mertens (SC Magdeburg) netzt ein zum neuen Spielstand von 3:1.,SC Magdeburg,Füchse Berlin,0,0,0,0,0,0,0,0
3:11,2:01,Kay Smits (SC Magdeburg) überwindet den Torwart von (6M) zum neuen Spielstand von 2:1.,SC Magdeburg,Füchse Berlin,0,0,0,0,0,0,0,0
1:51,1:01,Philipp Weber (SC Magdeburg) überwindet den Torwart zum neuen Spielstand von 1:1.,SC Magdeburg,Füchse Berlin,0,0,0,0,0,0,0,0
0:39,0:01,Tor (RA)! Robert Weber (Füchse Berlin) netzt ein zum neuen Spielstand von 0:1.,SC Magdeburg,Füchse Berlin,0,0,0,0,0,0,0,0