,Time,Score,Event.Description,Hometeam,Awayteam,Timeout_Hometeam,Timeout_Awayteam,SeventhPlayer_Hometeam,SeventhPlayer_Awayteam,SixthPlayer_Hometeam,SixthPlayer_Awayteam,Penalty_Awayteam,Penalty_Hometeam
1,59:43:00,,"Parade des Torwarts von TVB Stuttgart, Silvio Heinevetter.",TVB Stuttgart,ASV Hamm-Westfalen,0,0,0,0,0,0,0,0
2,59:08:00,29:20:00,"Neuer Spielstand in Stuttgart, 29:20 durch den Treffer von Jan Forstbauer für TVB Stuttgart.",TVB Stuttgart,ASV Hamm-Westfalen,0,0,0,0,0,0,0,0
3,58:59:00,,Silvio Heinevetter (TVB Stuttgart) hält den Wurf von Yonatan Dayan.,TVB Stuttgart,ASV Hamm-Westfalen,0,0,0,0,0,0,0,0
4,58:33:00,28:20:00,Tor! Max Häfner (TVB Stuttgart) netzt ein zum neuen Spielstand von 28:20.,TVB Stuttgart,ASV Hamm-Westfalen,0,0,0,0,0,0,0,0
5,58:03:00,27:20:00,Der 7-Meter wurde von Savvas Savvas (ASV Hamm-Westfalen) erfolgreich verwandelt.,TVB Stuttgart,ASV Hamm-Westfalen,0,0,0,0,0,0,0,0
6,57:33:00,,Parade von Torwart Felix Hertlein (ASV Hamm-Westfalen).,TVB Stuttgart,ASV Hamm-Westfalen,0,0,0,0,0,0,0,0
7,56:29:00,,Stefan Bauer (ASV Hamm-Westfalen) scheitert am Torwart Silvio Heinevetter (TVB Stuttgart).,TVB Stuttgart,ASV Hamm-Westfalen,0,0,0,0,0,0,0,0
8,56:20:00,,Auszeit ASV Hamm-Westfalen,TVB Stuttgart,ASV Hamm-Westfalen,0,1,0,0,0,0,0,0
9,55:36:00,27:19:00,Nico Schöttle (TVB Stuttgart) trifft zum Spielstand von 27:19 in Porsche-Arena.,TVB Stuttgart,ASV Hamm-Westfalen,0,0,0,0,0,0,0,0
10,54:49:00,,Fehlwurf von Savvas Savvas (ASV Hamm-Westfalen).,TVB Stuttgart,ASV Hamm-Westfalen,0,0,0,0,0,0,0,0
11,54:39:00,26:19:00,Tor (6M)! Fynn-Luca Nicolaus (TVB Stuttgart) netzt ein zum neuen Spielstand von 26:19.,TVB Stuttgart,ASV Hamm-Westfalen,0,0,0,0,0,0,0,0
12,53:38:00,25:19:00,Savvas Savvas (ASV Hamm-Westfalen) überwindet den Torwart von (RM/fern) zum neuen Spielstand von 25:19.,TVB Stuttgart,ASV Hamm-Westfalen,0,0,0,0,0,1,0,0
13,53:04:00,25:18:00,Tor! Max Häfner (TVB Stuttgart) netzt ein zum neuen Spielstand von 25:18.,TVB Stuttgart,ASV Hamm-Westfalen,0,0,0,0,0,1,0,0
14,52:27:00,,Überragende Parade des Torwarts Silvio Heinevetter (TVB Stuttgart)! Yonatan Dayan kann den Ball nicht im Tor unterbringen!,TVB Stuttgart,ASV Hamm-Westfalen,0,0,0,0,0,1,0,0
15,51:44:00,,Siebter Spieler eingewechselt ASV Hamm-Westfalen,TVB Stuttgart,ASV Hamm-Westfalen,0,0,0,1,0,1,0,0
16,51:33:00,24:18:00,Patrick Zieker (TVB Stuttgart) trifft von der 7-Meter Linie.,TVB Stuttgart,ASV Hamm-Westfalen,0,0,0,0,0,1,0,0
17,51:25:00,,Benjamin Meschke geht den Gegner zu stark an. ASV Hamm-Westfalen muss nun die nächsten zwei Minuten mit einem Spieler weniger auskommen.,TVB Stuttgart,ASV Hamm-Westfalen,0,0,0,0,0,1,1,0
18,50:31:00,,Silvio Heinevetter (TVB Stuttgart) mit einer Parade.,TVB Stuttgart,ASV Hamm-Westfalen,0,0,0,0,0,0,0,0
19,49:41:00,,Auszeit ASV Hamm-Westfalen,TVB Stuttgart,ASV Hamm-Westfalen,0,1,0,0,0,0,0,0
20,49:14:00,23:17,"Neuer Spielstand in Stuttgart, 23:17 durch den Treffer 6M von Jerome Müller für TVB Stuttgart.",TVB Stuttgart,ASV Hamm-Westfalen,0,0,0,0,0,0,0,0
21,48:37:00,,"Der Torwart von TVB Stuttgart, Silvio Heinevetter pariert den Wurf.",TVB Stuttgart,ASV Hamm-Westfalen,0,0,0,0,0,0,0,0
22,48:28:00,22:17,"Neuer Spielstand in Stuttgart, 22:17 durch den Treffer von Jerome Müller für TVB Stuttgart.",TVB Stuttgart,ASV Hamm-Westfalen,0,0,0,0,0,0,0,0
23,47:59:00,,Benjamin Meschke von ASV Hamm-Westfalen unterläuft ein technischer Fehler. Der Ballbesitz wechselt.,TVB Stuttgart,ASV Hamm-Westfalen,0,0,0,0,0,0,0,0
24,47:23:00,,"Block von Alexander Schulze, der den Torwurf von Ivan Sliskovic verhindert.",TVB Stuttgart,ASV Hamm-Westfalen,0,0,0,0,0,0,0,0
25,46:52:00,,Andreas Bornemann von ASV Hamm-Westfalen unterläuft ein technischer Fehler. Der Ballbesitz wechselt.,TVB Stuttgart,ASV Hamm-Westfalen,0,0,0,0,0,0,0,0
26,46:18:00,21:17,Jorge Serrano Villalobos (TVB Stuttgart) überwindet den Torwart zum neuen Spielstand von 21:17.,TVB Stuttgart,ASV Hamm-Westfalen,0,0,0,0,0,0,0,0
27,46:03:00,,Auszeit TVB Stuttgart,TVB Stuttgart,ASV Hamm-Westfalen,1,0,0,0,0,0,0,0
28,45:26:00,20:17,"Neuer Spielstand in Stuttgart, 20:17 durch den Treffer RM/fern von Andreas Bornemann für ASV Hamm-Westfalen.",TVB Stuttgart,ASV Hamm-Westfalen,0,0,0,0,0,0,0,0
29,44:46:00,,Egon Hanusz von TVB Stuttgart unterläuft ein technischer Fehler. Der Ballbesitz wechselt.,TVB Stuttgart,ASV Hamm-Westfalen,0,0,0,0,0,0,0,0
30,43:56:00,20:16,Alexander Schulze (ASV Hamm-Westfalen) trifft von (LA). Neuer Spielstand in Porsche-Arena: 20:16.,TVB Stuttgart,ASV Hamm-Westfalen,0,0,0,0,0,0,0,0
31,43:09:00,,Zeitstrafe vorbei TVB Stuttgart,TVB Stuttgart,ASV Hamm-Westfalen,0,0,0,0,1,0,0,0
32,42:56:00,20:15,Jan Forstbauer (TVB Stuttgart) trifft zum Spielstand von 20:15 in Porsche-Arena.,TVB Stuttgart,ASV Hamm-Westfalen,0,0,0,0,1,0,0,0
33,41:58:00,,Siebter Spieler eingewechselt TVB Stuttgart,TVB Stuttgart,ASV Hamm-Westfalen,0,0,1,0,1,0,0,0
34,41:48:00,19:15,"Neuer Spielstand in Stuttgart, 19:15 durch den Treffer von Alexander Schulze für ASV Hamm-Westfalen.",TVB Stuttgart,ASV Hamm-Westfalen,0,0,0,0,1,0,0,0
35,41:30:00,,Der Wurfversuch von Marian Orlowski (ASV Hamm-Westfalen) wurde durch einen Block von Samuel Röthlisberger verhindert.,TVB Stuttgart,ASV Hamm-Westfalen,0,0,0,0,1,0,0,0
36,41:11:00,,Zeitstrafe vorbei ASV Hamm-Westfalen,TVB Stuttgart,ASV Hamm-Westfalen,0,0,0,0,1,1,0,0
37,41:07:00,,Siebter Spieler eingewechselt ASV Hamm-Westfalen,TVB Stuttgart,ASV Hamm-Westfalen,0,0,0,1,1,1,0,0
38,41:06:00,,"Nach einem harten Foul hat Jerome Müller (TVB Stuttgart) nun zwei Minuten Zeit, um sich auszuruhen.",TVB Stuttgart,ASV Hamm-Westfalen,0,0,0,0,1,1,0,1
39,39:54:00,,Siebter Spieler eingewechselt ASV Hamm-Westfalen,TVB Stuttgart,ASV Hamm-Westfalen,0,0,0,1,0,1,0,0
40,39:43:00,19:14,Tor (6M)! Ivan Sliskovic (TVB Stuttgart) netzt ein zum neuen Spielstand von 19:14.,TVB Stuttgart,ASV Hamm-Westfalen,0,0,0,0,0,1,0,0
41,39:08:00,,2-Minuten-Strafe für Benjamin Meschke. ASV Hamm-Westfalen muss nun die nächsten...,TVB Stuttgart,ASV Hamm-Westfalen,0,0,0,0,0,1,1,0
42,38:29:00,18:14,Marian Orlowski (ASV Hamm-Westfalen) durchbricht die Abwehr und trifft zum 18:14.,TVB Stuttgart,ASV Hamm-Westfalen,0,0,0,0,0,0,0,0
43,37:55:00,18:13,"Tor! Es war Yonatan Dayan (ASV Hamm-Westfalen), der das Tor von Alexander Schulze...",TVB Stuttgart,ASV Hamm-Westfalen,0,0,0,0,0,0,0,0
44,37:06:00,18:12,Jorge Serrano Villalobos (TVB Stuttgart) überwindet den Torwart zum neuen Spielsta...,TVB Stuttgart,ASV Hamm-Westfalen,0,0,0,0,0,0,0,0
45,36:38:00,17:12,Andreas Bornemann (ASV Hamm-Westfalen) überwindet den Torwart von (RL/fern) zum neue...,TVB Stuttgart,ASV Hamm-Westfalen,0,0,0,0,0,0,0,0
46,36:01:00,,Felix Hertlein (ASV Hamm-Westfalen) mit einer Parade.,TVB Stuttgart,ASV Hamm-Westfalen,0,0,0,0,0,0,0,0
47,34:55:00,,Silvio Heinevetter (TVB Stuttgart) mit einer Parade.,TVB Stuttgart,ASV Hamm-Westfalen,0,0,0,0,0,0,0,0
48,34:27:00,17:11,Ivan Sliskovic (TVB Stuttgart) legt den Treffer von Fynn-Luca Nicolaus auf. Es ste...,TVB Stuttgart,ASV Hamm-Westfalen,0,0,0,0,0,0,0,0
49,34:13:00,16:11,Tor! Andreas Bornemann (ASV Hamm-Westfalen) netzt ein zum neuen Spielstand von 16:11.,TVB Stuttgart,ASV Hamm-Westfalen,0,0,0,0,0,0,0,0
50,33:31:00,,Felix Hertlein (ASV Hamm-Westfalen) mit einer Parade.,TVB Stuttgart,ASV Hamm-Westfalen,0,0,0,0,0,0,0,0
51,32:55:00,,Silvio Heinevetter (TVB Stuttgart) mit einer Parade.,TVB Stuttgart,ASV Hamm-Westfalen,0,0,0,0,0,0,0,0
52,32:33:00,,Siebter Spieler eingewechselt ASV Hamm-Westfalen.,TVB Stuttgart,ASV Hamm-Westfalen,0,0,0,1,0,0,0,0
53,32:20:00,16:10,Jerome Müller (TVB Stuttgart) tankt sich durch und erzielt einen Treffer zum 16:10.,TVB Stuttgart,ASV Hamm-Westfalen,0,0,0,0,0,0,0,0
54,31:50:00,15:10,"Tor! Es war Marian Orlowski (ASV Hamm-Westfalen), der das Tor von Stefan Bauer v...",TVB Stuttgart,ASV Hamm-Westfalen,0,0,0,0,0,0,0,0
55,31:36:00,,Der Wurf von Ivan Sliskovic (TVB Stuttgart) landet hinter dem Tor.,TVB Stuttgart,ASV Hamm-Westfalen,0,0,0,0,0,0,0,0
56,31:27:00,,"Der Torwart von TVB Stuttgart, Silvio Heinevetter pariert den Wurf.",TVB Stuttgart,ASV Hamm-Westfalen,0,0,0,0,0,0,0,0
57,30:57:00,,Siebter Spieler eingewechselt ASV Hamm-Westfalen.,TVB Stuttgart,ASV Hamm-Westfalen,0,0,0,1,0,0,0,0
58,30:36:00,,Jerome Müller (TVB Stuttgart) trifft nur den Pfosten.,TVB Stuttgart,ASV Hamm-Westfalen,0,0,0,0,0,0,0,0
59,HALBZ,15:09,,TVB Stuttgart,ASV Hamm-Westfalen,0,0,0,0,0,0,0,0
60,30:00:00,15:09,Tor! Egon Hanusz (TVB Stuttgart) netzt ein zum neuen Spielstand von 15:9.,TVB Stuttgart,ASV Hamm-Westfalen,0,0,0,0,0,0,0,0
61,29:48:00,,Auszeit TVB Stuttgart,TVB Stuttgart,ASV Hamm-Westfalen,1,0,0,0,0,0,0,0
62,29:48:00,,Siebter Spieler eingewechselt TVB Stuttgart,TVB Stuttgart,ASV Hamm-Westfalen,0,0,1,0,0,0,0,0
63,29:22:00,,"Parade des Torwarts von TVB Stuttgart, Silvio Heinevetter.",TVB Stuttgart,ASV Hamm-Westfalen,0,0,0,0,0,0,0,0
64,28:13:00,14:09,"Neuer Spielstand in Stuttgart, 14:9 durch den Treffer von Fynn-Luca Nicolaus für TVB Stuttgart.",TVB Stuttgart,ASV Hamm-Westfalen,0,0,0,0,0,0,0,0
65,27:55:00,,Überragende Parade des Torwarts Silvio Heinevetter (TVB Stuttgart)! Jan Von Boenigk kann den Ball nicht im Tor unterbringen!,TVB Stuttgart,ASV Hamm-Westfalen,0,0,0,0,0,0,0,0
66,26:33:00,,Silvio Heinevetter (TVB Stuttgart) hält den Wurf von Savvas Savvas.,TVB Stuttgart,ASV Hamm-Westfalen,0,0,0,0,0,0,0,0
67,25:57:00,13:09,Jerome Müller (TVB Stuttgart) tankt sich durch und trifft!,TVB Stuttgart,ASV Hamm-Westfalen,0,0,0,0,0,0,0,0
68,25:23:00,,Savvas Savvas von ASV Hamm-Westfalen unterläuft ein technischer Fehler. Der Ballbesitz wechselt.,TVB Stuttgart,ASV Hamm-Westfalen,0,0,0,0,0,0,0,0
69,24:38:00,12:09,Egon Hanusz (TVB Stuttgart) durchbricht die Abwehr und trifft ins gegnerische Tor. Es steht nun 12:9.,TVB Stuttgart,ASV Hamm-Westfalen,0,0,0,0,0,0,0,0
70,23:33,,Der Strafwurf von Fabian Huesmann wurde von Silvio Heinevetter (TVB Stuttgart) gehalten.,TVB Stuttgart,ASV Hamm-Westfalen,0,0,0,0,0,0,0,0
71,22:31,11:09,Oscar Bergendahl (TVB Stuttgart) trifft zum Spielstand von 11:9 in Porsche-Arena.,TVB Stuttgart,ASV Hamm-Westfalen,0,0,0,0,0,0,0,0
72,22:14,,Parade von Torwart Silvio Heinevetter (TVB Stuttgart).,TVB Stuttgart,ASV Hamm-Westfalen,0,0,0,0,0,0,0,0
73,21:43,,Ivan Sliskovic (TVB Stuttgart) scheitert am Torwart Felix Hertlein (ASV Hamm-Westfalen).,TVB Stuttgart,ASV Hamm-Westfalen,0,0,0,0,0,0,0,0
74,21:02,10:09,"Neuer Spielstand in Stuttgart, 10:9 durch den Treffer RM/fern von Savvas Savvas für ASV Hamm-Westfalen.",TVB Stuttgart,ASV Hamm-Westfalen,0,0,0,0,0,0,0,0
75,20:55,,Auszeit ASV Hamm-Westfalen,TVB Stuttgart,ASV Hamm-Westfalen,0,1,0,0,0,0,0,0
76,19:51,,"Der Torwart von ASV Hamm-Westfalen, Felix Hertlein hält den Wurf von Sascha Pfattheicher.",TVB Stuttgart,ASV Hamm-Westfalen,0,0,0,0,0,0,0,0
77,19:51,,Felix Hertlein (ASV Hamm-Westfalen) mit einer Parade beim 7-Meter.,TVB Stuttgart,ASV Hamm-Westfalen,0,0,0,0,0,0,0,0
78,19:34,10:08,Tim Wieling (ASV Hamm-Westfalen) überwindet den Torwart von (RA) zum neuen Spielstand von 10:8.,TVB Stuttgart,ASV Hamm-Westfalen,0,0,0,0,0,0,0,0
79,18:51,,"Der Torwart von TVB Stuttgart, Silvio Heinevetter pariert den Wurf.",TVB Stuttgart,ASV Hamm-Westfalen,0,0,0,0,0,0,0,0
80,18:22,,"Der Torwart von TVB Stuttgart, Silvio Heinevetter hält den Wurf von Stefan Bauer.",TVB Stuttgart,ASV Hamm-Westfalen,0,0,0,0,0,0,0,0
81,17:46,,Felix Hertlein (ASV Hamm-Westfalen) bleibt Sieger im 7-Meter-Duell gegen Sascha Pfattheicher (TVB Stuttgart).,TVB Stuttgart,ASV Hamm-Westfalen,0,0,0,0,0,0,0,0
82,16:27,,Tor für ASV Hamm-Westfalen durch Fabian Huesmann nach einem Pass von Savvas Savvas.,TVB Stuttgart,ASV Hamm-Westfalen,0,0,0,0,0,0,0,0
83,15:58,,Der eingewechselte Torwart Felix Hertlein (ASV Hamm-Westfalen) steht nun zwischen den Pfosten.,TVB Stuttgart,ASV Hamm-Westfalen,0,0,0,0,0,0,0,0
84,15:41,10:06,Jerome Müller (TVB Stuttgart) überwindet den Torwart zum neuen Spielstand von 10:6.,TVB Stuttgart,ASV Hamm-Westfalen,0,0,0,0,0,0,0,0
85,15:12,,Die Vorbereitung von Alexander Schulze (ASV Hamm-Westfalen) führt zum Treffer durch Tim Wieling.,TVB Stuttgart,ASV Hamm-Westfalen,0,0,0,0,0,0,0,0
86,14:19,,Parade von Torwart Silvio Heinevetter (TVB Stuttgart).,TVB Stuttgart,ASV Hamm-Westfalen,0,0,0,0,0,0,0,0
87,14:01,,Silvio Heinevetter (TVB Stuttgart) mit einer Parade.,TVB Stuttgart,ASV Hamm-Westfalen,0,0,0,0,0,0,0,0
88,13:10,,Egon Hanusz von TVB Stuttgart unterläuft ein technischer Fehler. Der Ballbesitz wechselt.,TVB Stuttgart,ASV Hamm-Westfalen,0,0,0,0,0,0,0,0
89,12:59,,"Savvas Savvas (RM/fern) wirft, jedoch neben das Tor.",TVB Stuttgart,ASV Hamm-Westfalen,0,0,0,0,0,0,0,0
90,12:19,,Zeitstrafe vorbei ASV Hamm-Westfalen,TVB Stuttgart,ASV Hamm-Westfalen,0,0,0,0,0,1,0,0
91,12:08,9:05,"Tor Silvio Heinevetter, TVB Stuttgart",TVB Stuttgart,ASV Hamm-Westfalen,0,0,0,0,0,1,0,0
92,12:03,,"Gute Torchance, aber Jan Von Boenigk (ASV Hamm-Westfalen) kann diese nicht erfolgreich verwandeln.",TVB Stuttgart,ASV Hamm-Westfalen,0,0,0,0,0,1,0,0
93,11:05,,Siebter Spieler eingewechselt ASV Hamm-Westfalen,TVB Stuttgart,ASV Hamm-Westfalen,0,0,0,1,0,1,0,0
94,11:01,8:05,Tor (6M)! Egon Hanusz (TVB Stuttgart) netzt ein zum neuen Spielstand von 8:5.,TVB Stuttgart,ASV Hamm-Westfalen,0,0,0,0,0,1,0,0
95,10:48,,Savvas Savvas (ASV Hamm-Westfalen) trifft von (6M). Neuer Spielstand in Porsche-Arena: 7:5.,TVB Stuttgart,ASV Hamm-Westfalen,0,0,0,0,0,1,0,0
96,10:46,,"Der Trainer von ASV Hamm-Westfalen, Michael Lerscht stellt nun Vladimir Bozic zwischen die Pfosten.",TVB Stuttgart,ASV Hamm-Westfalen,0,0,0,0,0,1,0,0
97,10:22,,Siebter Spieler eingewechselt ASV Hamm-Westfalen,TVB Stuttgart,ASV Hamm-Westfalen,0,0,0,1,0,1,0,0
98,10:11,7:04,Sascha Pfattheicher (TVB Stuttgart) trifft von der 7-Meter Linie und bringt den Spielstand auf 7:4.,TVB Stuttgart,ASV Hamm-Westfalen,0,0,0,0,0,1,0,0
99,10:09,,Torwartwechsel bei ASV Hamm-Westfalen. Felix Hertlein kommt für Vladimir Bozic.,TVB Stuttgart,ASV Hamm-Westfalen,0,0,0,0,0,1,0,0
100,10:08,,Mait Patrail (ASV Hamm-Westfalen) erhält eine Zeitstrafe und hat nun zwei Minuten Zeit sich auf der Bank zu beruhigen.,TVB Stuttgart,ASV Hamm-Westfalen,0,0,0,0,0,1,1,0
101,9:57,,Silvio Heinevetter (TVB Stuttgart) hält den Wurf von Savvas Savvas.,TVB Stuttgart,ASV Hamm-Westfalen,0,0,0,0,0,0,0,0
102,9:41,,Oscar Bergendahl (TVB Stuttgart) scheitert am Torwart Vladimir Bozic (ASV Hamm-Westfalen).,TVB Stuttgart,ASV Hamm-Westfalen,0,0,0,0,0,0,0,0
103,9:05,6:04,Sascha Pfattheicher (TVB Stuttgart) trifft von der 7-Meter Linie.,TVB Stuttgart,ASV Hamm-Westfalen,0,0,0,0,0,0,0,0
104,8:45,,Fabian Huesmann von ASV Hamm-Westfalen wurde mit der Gelben Karte von Baumgart/Wild verwarnt.,TVB Stuttgart,ASV Hamm-Westfalen,0,0,0,0,0,0,0,0
105,8:32,5:04,Tim Wieling (ASV Hamm-Westfalen) überwindet den Torwart zum neuen Spielstand von 5:4.,TVB Stuttgart,ASV Hamm-Westfalen,0,0,0,0,0,0,0,0
106,7:43,5:03,"Neuer Spielstand in Stuttgart, 5:3 durch den Treffer von Sascha Pfattheicher für TVB Stuttgart.",TVB Stuttgart,ASV Hamm-Westfalen,0,0,0,0,0,0,0,0
107,7:31,4:03,"Neuer Spielstand in Stuttgart, 4:3 durch den Treffer 6M von Jan Von Boenigk für ASV Hamm-Westfalen.",TVB Stuttgart,ASV Hamm-Westfalen,0,0,0,0,0,0,0,0
108,7:01,,Zeitstrafe vorbei TVB Stuttgart,TVB Stuttgart,ASV Hamm-Westfalen,0,0,0,0,1,0,0,0
109,6:54,4:02,Oscar Bergendahl (TVB Stuttgart) überwindet den Torwart von (6M) zum neuen Spielstand von 4:2.,TVB Stuttgart,ASV Hamm-Westfalen,0,0,0,0,1,0,0,0
110,6:20,3:02,"Tor von der 7-Meter Linie von Fabian Huesmann (ASV Hamm-Westfalen), neuer Spielstand 3:2.",TVB Stuttgart,ASV Hamm-Westfalen,0,0,0,0,1,0,0,0
111,5:58,,Oscar Bergendahl (TVB Stuttgart) bekommt die Gelbe Karte von Baumgart/Wild gezeigt.,TVB Stuttgart,ASV Hamm-Westfalen,0,0,0,0,1,0,0,0
112,5:32,3:01,Tor! Jerome Müller (TVB Stuttgart) netzt ein zum neuen Spielstand von 3:1.,TVB Stuttgart,ASV Hamm-Westfalen,0,0,0,0,1,0,0,0
113,5:21,,Der Wurf von TVB Stuttgart wurde geblockt.,TVB Stuttgart,ASV Hamm-Westfalen,0,0,0,0,1,0,0,0
114,4:36,,Siebter Spieler eingewechselt TVB Stuttgart,TVB Stuttgart,ASV Hamm-Westfalen,0,0,1,0,1,0,0,0
115,4:29,,Überragende Parade des Torwarts Silvio Heinevetter (TVB Stuttgart)! Marian Orlowski kann den Ball nicht im Tor unterbringen!,TVB Stuttgart,ASV Hamm-Westfalen,0,0,0,0,1,0,0,0
116,4:10,,Adam Lönn (TVB Stuttgart) erhält wegen eines Regelverstoßes eine 2 Minuten Strafe.,TVB Stuttgart,ASV Hamm-Westfalen,0,0,0,0,1,0,0,1
117,3:34,2:01,Patrick Zieker (TVB Stuttgart) trifft zum Spielstand von 2:1 in Porsche-Arena.,TVB Stuttgart,ASV Hamm-Westfalen,0,0,0,0,0,0,0,0
118,3:04,,Benjamin Meschke von ASV Hamm-Westfalen unterläuft ein technischer Fehler. Der Ballbesitz wechselt.,TVB Stuttgart,ASV Hamm-Westfalen,0,0,0,0,0,0,0,0
119,2:10,,Silvio Heinevetter (TVB Stuttgart) mit einer Parade.,TVB Stuttgart,ASV Hamm-Westfalen,0,0,0,0,0,0,0,0
120,1:42,1:01,Der 7-Meter wurde von Sascha Pfattheicher (TVB Stuttgart) erfolgreich verwandelt.,TVB Stuttgart,ASV Hamm-Westfalen,0,0,0,0,0,0,0,0
121,0:48,0:01,Tor (6M)! Marian Orlowski (ASV Hamm-Westfalen) netzt ein zum neuen Spielstand von 0:1.,TVB Stuttgart,ASV Hamm-Westfalen,0,0,0,0,0,0,0,0
122,0:38,,"Parade des Torwarts von TVB Stuttgart, Silvio Heinevetter. ",TVB Stuttgart,ASV Hamm-Westfalen,0,0,0,0,0,0,0,0